ID,duration,wav,wrd
M03_050C0107_PED,7.8115625,/dt05_ped_simu/M03_050C0107_PED.wav,THE PARENT COMPANY ADDED THAT IT MAY SEEK OTHER BUSINESS OPPORTUNITIES SUBJECT TO THE AVAILABILITY OF FINANCING WHICH MAY NOT BE AVAILABLE
F01_050C010R_PED,8.2315,/dt05_ped_simu/F01_050C010R_PED.wav,THE MANAGEMENT COMMITTEE'S PLAN FOR THE NEW GOVERNING BODY CAN TAKE EFFECT IF APPROVED BY SEVENTY FIVE PERCENT OF THE EXCHANGE'S MEMBERS
M04_423C020O_PED,3.023875,/dt05_ped_simu/M04_423C020O_PED.wav,U. S. F. AND G. HAD NO COMMENT
M03_050C010S_PED,3.5358125,/dt05_ped_simu/M03_050C010S_PED.wav,A MEMBERSHIP MEETING HAS BEEN CALLED FOR JULY TWENTIETH TO VOTE ON IT
M04_053C0108_PED,3.463875,/dt05_ped_simu/M04_053C0108_PED.wav,THE TASK FORCE REPORT ISN'T ALL BAD
F01_421C0201_PED,14.1673125,/dt05_ped_simu/F01_421C0201_PED.wav,UNDERWRITERS LED BY MERRILL LYNCH CAPITAL MARKETS TENTATIVELY PRICED A PROPOSED ONE HUNDRED NINETY SIX POINT SEVEN MILLION DOLLAR OFFERING OF MORTGAGE REVENUE BONDS BY THE CALIFORNIA HOUSING FINANCE AGENCY
F01_052C010K_PED,4.168,/dt05_ped_simu/F01_052C010K_PED.wav,THE COMPANY SAID THE THREE GROUPS WILL OPERATE AS A UNIT
F04_22GC010I_PED,1.7959375,/dt05_ped_simu/F04_22GC010I_PED.wav,IT WAS A DONE DEAL
F01_050C010W_PED,4.1759375,/dt05_ped_simu/F01_050C010W_PED.wav,AT THE TIME THE COMPANY SAID IT WOULD EXPLORE OTHER OPTIONS
F01_050C010K_PED,6.63975,/dt05_ped_simu/F01_050C010K_PED.wav,MOST EUROPEAN TRADERS WERE REPORTEDLY STAYING OUT OF ACTION UNTIL THE TRADE FIGURES ARE RELEASED
F04_22GC010L_PED,9.812,/dt05_ped_simu/F04_22GC010L_PED.wav,RECOGNITION SAID IT REORGANIZED ITS U. S. BUSINESS INTO THREE UNITS SALES AND SERVICE FEDERAL GOVERNMENT SALES AND SALES DEVELOPMENT AND SPECIAL PRODUCTS
M03_422C0210_PED,3.379875,/dt05_ped_simu/M03_422C0210_PED.wav,THE OFFERS FOR BOTH CLASSES OF STOCK EXPIRED FRIDAY
F01_22HC010H_PED,4.2958125,/dt05_ped_simu/F01_22HC010H_PED.wav,INCOME ROSE ZERO POINT FOUR PERCENT LAST MONTH
M03_052C010D_PED,8.2435,/dt05_ped_simu/M03_052C010D_PED.wav,OF THE TOTAL FACE AMOUNT OUTSTANDING OF TWELVE WESTERN UNION DEBT SERIES EIGHTEEN POINT SIX PERCENT HAD BEEN TENDERED AS OF THURSDAY
F04_22GC010W_PED,3.61625,/dt05_ped_simu/F04_22GC010W_PED.wav,BUT HE SAID THAT WOULD ONLY BE TRUE IF THE DOLLAR WERE WEAK
F01_22HC0111_PED,5.311875,/dt05_ped_simu/F01_22HC0111_PED.wav,THAT'S NOT TO SAY HE IS LOOKING FOR A REBOUND IN THE NEXT COUPLE OF WEEKS OR EVEN MONTHS
M04_22HC0104_PED,8.303875,/dt05_ped_simu/M04_22HC0104_PED.wav,IN NEW YORK STOCK EXCHANGE COMPOSITE TRADING FRIDAY THE COMPANY'S STOCK CLOSED AT TWENTY THREE POINT ONE TWO FIVE DOLLARS UNCHANGED
F04_053C010F_PED,5.9235625,/dt05_ped_simu/F04_053C010F_PED.wav,IN NINETEEN EIGHTY FOUR THE COMPANY WON SEVERAL MULTIMILLION DOLLAR ACCOUNTS AND SALES AND EARNINGS SOARED
F01_053C0106_PED,8.6635625,/dt05_ped_simu/F01_053C0106_PED.wav,ONE OF THE NEW P. C.S OFFERS ALMOST DOUBLE THE MEMORY AND SLIGHTLY MORE STORAGE FOR ELEVEN PERCENT LESS THAN THE COMPETING COMPAQ MACHINE
M03_051C0114_PED,8.299375,/dt05_ped_simu/M03_051C0114_PED.wav,IN THE BULL MARKET OF NINETEEN EIGHTY SIX TO EIGHTY SEVEN CASH POSITIONS EXCEEDING FIVE PERCENT OF ASSETS WOULD HAVE HELD DOWN OVERALL RETURNS
M03_421C020J_PED,6.8915625,/dt05_ped_simu/M03_421C020J_PED.wav,MANUFACTURERS ALSO ARE URGING THE GOVERNMENT TO EASE IMMIGRATION RULES SO THEY CAN IMPORT WORKERS FROM NEIGHBORING COUNTRIES
M03_22GC010B_PED,10.2275625,/dt05_ped_simu/M03_22GC010B_PED.wav,THE OFFERING WILL COMPRISE SEVEN HUNDRED SIXTY SEVEN MILLION DOLLARS OF BONDS DUE NOVEMBER SECOND AND SIX HUNDRED THIRTY EIGHT MILLION DOLLARS OF BONDS MATURING NEXT FEBRUARY FIRST
F04_420C020E_PED,9.635625,/dt05_ped_simu/F04_420C020E_PED.wav,THE STOCK IS CONVERTIBLE AT ANY TIME INTO COMMON AT AN INITIAL PRICE OF TWELVE DOLLARS A SHARE SUBJECT TO ADJUSTMENT DECEMBER FIFTEENTH NINETEEN EIGHTY EIGHT
F04_422C020Y_PED,9.61975,/dt05_ped_simu/F04_422C020Y_PED.wav,DOFASCO HAMILTON ONTARIO SAID ABOUT THREE POINT THREE MILLION CONVERTIBLE PREFERRED SHARES ABOUT EIGHTY SIX PERCENT OF THE TOTAL OUTSTANDING WERE TENDERED
F04_420C020I_PED,4.5318125,/dt05_ped_simu/F04_420C020I_PED.wav,STOCK PRICES ALSO WERE MIXED IN PARIS ZURICH AND STOCKHOLM
F01_422C020P_PED,10.503625,/dt05_ped_simu/F01_422C020P_PED.wav,THE COMPANY SAID ITS QUARTERLY CASH DIVIDEND OF FORTY CENTS A SHARE WILL BE PAID BEFORE THE SPLIT ON SEPTEMBER TENTH TO STOCK OF RECORD ON AUGUST NINETEENTH
F01_421C020U_PED,4.431625,/dt05_ped_simu/F01_421C020U_PED.wav,STOCKS FELL IN NERVOUS TRADING WHILE BONDS WERE NARROWLY MIXED
F01_423C020L_PED,7.567625,/dt05_ped_simu/F01_423C020L_PED.wav,BUT THE PLAN WON'T BE FILED WITH THE BANKRUPTCY COURT UNTIL THE CREDITORS AND L. T. V. AGREE ON HOW THE DEBT WILL BE PAID
M04_050C0101_PED,7.823625,/dt05_ped_simu/M04_050C0101_PED.wav,LAST MONTH OVERALL GOODS PRODUCING EMPLOYMENT FELL SIXTY EIGHT THOUSAND AFTER A THIRTY TWO THOUSAND JOB RISE IN FEBRUARY
M03_052C0115_PED,4.3716875,/dt05_ped_simu/M03_052C0115_PED.wav,THERE WERE THIRTEEN POINT NINE MILLION CRIMES REPORTED IN NINETEEN EIGHTY EIGHT
M04_423C020I_PED,5.8796875,/dt05_ped_simu/M04_423C020I_PED.wav,SEPARATELY THE GOVERNMENT SAID RETAIL SALES CLIMBED ZERO POINT SIX PERCENT IN FEBRUARY
M04_422C020L_PED,6.87175,/dt05_ped_simu/M04_422C020L_PED.wav,REGIONAL BANKS APPEAR WILLING TO ACCEPT BIG LOSSES UNDER THE MEXICAN DEBT PLAN PUTTING PRESSURE ON BIG BANKS
M04_421C0206_PED,2.8559375,/dt05_ped_simu/M04_421C0206_PED.wav,WHAT ABOUT IN SOUTH AFRICA ITSELF
M04_423C020S_PED,7.8716875,/dt05_ped_simu/M04_423C020S_PED.wav,BUT HE OFFERED THE OPINION THAT ROBERT WADE THE UNIT'S CHIEF AND HALF A DOZEN OTHER SENIOR PEOPLE WILL GO WITH U. S. F. AND G.
M04_422C020A_PED,2.3999375,/dt05_ped_simu/M04_422C020A_PED.wav,I'M A GOOD WORKER
M03_422C020Z_PED,9.5315,/dt05_ped_simu/M03_422C020Z_PED.wav,ALL THE SHARES TENDERED HAVE AN INDICATED VALUE OF ABOUT FIVE HUNDRED THIRTY EIGHT POINT FIVE MILLION CANADIAN DOLLARS FOUR HUNDRED THIRTY EIGHT MILLION U. S. DOLLARS
M04_422C0215_PED,8.159875,/dt05_ped_simu/M04_422C0215_PED.wav,MR. GREENSPAN APPEARS TO BELIEVE THAT THE BEST COURSE IS TO PROCEED WITH A CAUTIOUS MOVE TOWARD EASE AND TO HOPE FOR A SOFT LANDING
F01_050C010G_PED,7.51175,/dt05_ped_simu/F01_050C010G_PED.wav,SALES OF BUILDING MATERIALS INCREASED ONE POINT THREE PERCENT AFTER A ONE POINT ONE PERCENT DROP
F04_421C0212_PED,3.37975,/dt05_ped_simu/F04_421C0212_PED.wav,CRITICS SAY THE FEDERAL APPROACH WAS WRONG FROM THE START
F04_423C0215_PED,6.55575,/dt05_ped_simu/F04_423C0215_PED.wav,INSTEAD SECURITIES FIRMS MAY BE REQUIRED TO MAKE FILINGS OF LARGE SHARE PURCHASES MADE ON BEHALF OF CLIENTS
M03_053C010B_PED,8.65975,/dt05_ped_simu/M03_053C010B_PED.wav,ACTIVELY TRADED THIRTY YEAR TREASURY ISSUES LAST WEEK PLUNGED ABOUT THREE POINTS OR ABOUT THIRTY DOLLARS FOR EACH ONE THOUSAND DOLLAR FACE AMOUNT
M03_051C010D_PED,10.1953125,/dt05_ped_simu/M03_051C010D_PED.wav,IN YESTERDAY'S RELEASE THE DEPARTMENT ALSO REVISED THE SEPTEMBER PERFORMANCE TO A ZERO POINT TWO PERCENT RISE AFTER PREVIOUSLY REPORTING IT AS UNCHANGED
M03_052C010R_PED,3.2115625,/dt05_ped_simu/M03_052C010R_PED.wav,MS. AMSTERDAM DECLINED TO COMMENT
M04_422C020E_PED,5.2078125,/dt05_ped_simu/M04_422C020E_PED.wav,THE TREND IS INEVITABLE UNLESS THE GOVERNMENT HAS AUTHORITY OVER THE WHOLE WORLD
F01_422C0208_PED,4.32775,/dt05_ped_simu/F01_422C0208_PED.wav,JUST BEFORE CHRISTMAS SHE FINALLY APPLIED FOR WELFARE
M03_420C020N_PED,4.9158125,/dt05_ped_simu/M03_420C020N_PED.wav,BUT ANY DIP IN INFLATION ASSOCIATED WITH OIL PRICES IS LIKELY TO BE TEMPORARY
F04_050C0111_PED,5.763625,/dt05_ped_simu/F04_050C0111_PED.wav,YET WHEN WE DISCUSS SOCIAL POLICY WE TALK AS IF MONEY THE POVERTY RATE WAS ALL THAT MATTERS
F01_22GC0107_PED,5.7358125,/dt05_ped_simu/F01_22GC0107_PED.wav,CONGRESS AND THE ADMINISTRATION HAVE BEGUN TO TAKE THE RIGHT STEPS TO IMPROVE THE CREDIT BUDGET
M04_420C0208_PED,7.50375,/dt05_ped_simu/M04_420C0208_PED.wav,LAST MONTH OVERALL GOODS PRODUCING EMPLOYMENT FELL SIXTY EIGHT THOUSAND AFTER A THIRTY TWO THOUSAND JOB RISE IN FEBRUARY
M03_420C020A_PED,5.7875625,/dt05_ped_simu/M03_420C020A_PED.wav,CONSTRUCTION EMPLOYMENT FELL FORTY SEVEN THOUSAND AFTER A FIFTEEN THOUSAND JOB DECLINE THE MONTH BEFORE
M03_051C0107_PED,3.659625,/dt05_ped_simu/M03_051C0107_PED.wav,CORPORATE AND MUNICIPAL BOND PRICES ALSO SLUMPED
M03_050C0110_PED,6.9081875,/dt05_ped_simu/M03_050C0110_PED.wav,IN ADDITION THE BANK HAS ALWAYS PURSUED A POLICY OF KEEPING ITS BALANCE SHEET RELATIVELY LIQUID INSIDERS AND COMPETITORS SAID
M03_051C010P_PED,8.859375,/dt05_ped_simu/M03_051C010P_PED.wav,HE AND HIS FAMILY OWN ABOUT TWENTY NINE PERCENT OF THE COMPANY'S CLASS A COMMON SHARES AND ABOUT NINETY ONE POINT FIVE PERCENT OF THE CLASS B. COMMON
M04_22GC0110_PED,6.3118125,/dt05_ped_simu/M04_22GC0110_PED.wav,NOW MANY INSTITUTIONS SAY THEIR CASH LEVELS ARE TEN PERCENT OR MORE AND A FEW ARE AT THIRTY PERCENT OR MORE
F04_051C010O_PED,8.715625,/dt05_ped_simu/F04_051C010O_PED.wav,MR. FICKLING STARTED THE COMPANY IN NINETEEN SIXTY NINE WITH EIGHT GENERAL HOSPITALS AND NURSING HOMES ALONG WITH A SMALL CONSTRUCTION OPERATION
M03_053C010G_PED,3.3878125,/dt05_ped_simu/M03_053C010G_PED.wav,SINCE THEN HOWEVER RESULTS HAVE BEEN POOR
F04_421C020H_PED,7.126,/dt05_ped_simu/F04_421C020H_PED.wav,THE DOLLAR ROSE ZERO POINT NINE PERCENT AGAINST THE YEN WHILE SOME LONG TERM TREASURY BONDS REACHED THE HIGHEST LEVEL IN A WEEK
M03_420C0207_PED,7.563875,/dt05_ped_simu/M03_420C0207_PED.wav,BUT THOSE CHARGES AREN'T REQUIRED TO BE MADE UNTIL THE NINETEEN EIGHTY EIGHT FIRST QUARTER OR UNDER CERTAIN CIRCUMSTANCES EVEN LATER
M03_22HC010K_PED,6.1025625,/dt05_ped_simu/M03_22HC010K_PED.wav,COMMON SHARES THAT AREN'T PURCHASED WILL BE EXCHANGED FOR THE COMBINATION OF NEW PREFERRED AND CASH
F04_051C010V_PED,9.3160625,/dt05_ped_simu/F04_051C010V_PED.wav,ALTHOUGH THE FOREIGN EXCHANGE MARKET RARELY HAS MUCH IMPACT ON TAX EXEMPT SECURITIES TRADERS SAID THE DOLLAR'S LATE RALLY YESTERDAY HELPED BUOY MUNICIPAL PRICES
M03_053C010M_PED,8.036,/dt05_ped_simu/M03_053C010M_PED.wav,THE PARENT COMPANY ADDED THAT IT MAY SEEK OTHER BUSINESS OPPORTUNITIES SUBJECT TO THE AVAILABILITY OF FINANCING WHICH MAY NOT BE AVAILABLE
F04_050C010M_PED,10.9553125,/dt05_ped_simu/F04_050C010M_PED.wav,LINK RESOURCES CORPORATION ESTIMATES THE ELECTRONIC MAIL MARKET AT ABOUT TWO HUNDRED NINETY SIX MILLION DOLLARS A YEAR AND VOICE MAIL AT ABOUT SEVENTY SIX MILLION DOLLARS
F04_422C020M_PED,3.6198125,/dt05_ped_simu/F04_422C020M_PED.wav,ALSO TWO BANKS BOOSTED FOREIGN LOAN LOSS RESERVES
F04_423C020A_PED,6.2998125,/dt05_ped_simu/F04_423C020A_PED.wav,THEY WANT INDEPENDENCE SOMEONE WHO HAS A SENSE OF DIRECTION AND PURPOSE AND WHO IDENTIFIES WITH THEM
F01_22HC010X_PED,7.2156875,/dt05_ped_simu/F01_22HC010X_PED.wav,WE COULD DISTRIBUTE THE BONDS IN JAPAN IN EUROPE IN THE U. K. BUT NOT IN THE U. S. MR. LABRECQUE SAID
F01_050C010U_PED,10.1675,/dt05_ped_simu/F01_050C010U_PED.wav,IN JANUARY THE BEAVERTON OREGON TOY MAKER DISCLOSED TALKS CONCERNING ITS POSSIBLE TAKEOVER BY A THIRD PARTY WHO PROPOSED A FRIENDLY TRANSACTION
M04_052C010U_PED,5.639625,/dt05_ped_simu/M04_052C010U_PED.wav,HE EXPECTS THE JAPANESE AGENT TO SELL IT FOR TWO HUNDRED SEVENTY FIVE THOUSAND DOLLARS
F01_051C010H_PED,3.536,/dt05_ped_simu/F01_051C010H_PED.wav,THE POLICY NEEDED FOR THIS WILL BE FURTHER DEVELOPED
M04_421C020B_PED,4.9278125,/dt05_ped_simu/M04_421C020B_PED.wav,SEPARATELY SHELL OIL COMPANY'S NET INCOME ROSE TWENTY ONE PERCENT
M04_420C020H_PED,8.0555625,/dt05_ped_simu/M04_420C020H_PED.wav,IN OVER THE COUNTER TRADING FRIDAY THE COMPANY'S COMMON CLOSED AT TEN DOLLARS AND TWENTY FIVE CENTS A SHARE DOWN FIFTY CENTS
F01_22HC010V_PED,7.58375,/dt05_ped_simu/F01_22HC010V_PED.wav,VOLUME ROSE TO AN ESTIMATED ONE BILLION SHARES FROM AN ESTIMATED SEVEN HUNDRED FIFTY MILLION SHARES ON THURSDAY
M03_22HC010I_PED,9.6915625,/dt05_ped_simu/M03_22HC010I_PED.wav,AS PREVIOUSLY REPORTED THOMPSON HAS A TENDER OFFER OUTSTANDING TO BUY THIRTY ONE POINT FIVE MILLION SOUTHLAND COMMON SHARES FOR SEVENTY SEVEN DOLLARS A SHARE
F01_422C020C_PED,4.496,/dt05_ped_simu/F01_422C020C_PED.wav,THE CHIEF TRADER IN NEW YORK FOR A TOKYO BASED BANK AGREES
M04_423C020X_PED,6.5594375,/dt05_ped_simu/M04_423C020X_PED.wav,MANUFACTURERS NATIONAL CORPORATION RAISED THE QUARTERLY DIVIDEND ON ITS COMMON STOCK TO FORTY SIX CENTS
F04_22GC010D_PED,2.5396875,/dt05_ped_simu/F04_22GC010D_PED.wav,INTEREST RATES WILL BE ANNOUNCED WEDNESDAY
F01_22GC010X_PED,10.61175,/dt05_ped_simu/F01_22GC010X_PED.wav,SINCE THE U. S. CURRENCY HAS STRENGTHENED SHARPLY IN RECENT WEEKS HE SEES NO NEED FOR THE FEDERAL RESERVE TO RAISE INTEREST RATES TO PROTECT THE DOLLAR
F01_420C020D_PED,4.8158125,/dt05_ped_simu/F01_420C020D_PED.wav,DREXEL BURNHAM LAMBERT INCORPORATED WAS LEAD UNDERWRITER
F04_053C010W_PED,7.13975,/dt05_ped_simu/F04_053C010W_PED.wav,THE FINANCIAL TIMES THIRTY SHARE INDEX CLOSED OFF SEVEN POINT FOUR POINTS AT ONE THOUSAND FOUR HUNDRED THIRTY POINT SEVEN
M04_422C020X_PED,7.6876875,/dt05_ped_simu/M04_422C020X_PED.wav,FORD'S SHARE ROSE TO TWENTY POINT EIGHT PERCENT CHRYSLER'S TO ELEVEN POINT FOUR PERCENT AND HONDA'S TO TEN POINT TWO PERCENT
F04_053C010A_PED,6.8316875,/dt05_ped_simu/F04_053C010A_PED.wav,AND THE IDEA OF LETTING EMPLOYERS PRE FUND POST RETIREMENT MEDICAL EXPENSES IS SURELY BETTER THAN HAVING GOVERNMENT DO IT
M03_051C0101_PED,4.09975,/dt05_ped_simu/M03_051C0101_PED.wav,SO CLEARLY THE ADVOCATES OF SANCTIONS WERE THE FOREIGN POLICY VICTORS
M04_22GC010G_PED,5.4558125,/dt05_ped_simu/M04_22GC010G_PED.wav,TRADERS SAY THE BUNDESBANK DID THIS WHEN THE DOLLAR STRENGTHENED IN LATE JULY AND EARLY AUGUST
M03_22GC0109_PED,4.868,/dt05_ped_simu/M03_22GC0109_PED.wav,INITIAL WALL STREET ENTHUSIASM HAS SURPRISED EVEN PRIVATIZATION ADVOCATES
M04_22GC010Q_PED,4.936,/dt05_ped_simu/M04_22GC010Q_PED.wav,SECOND DID ADMIRAL POINDEXTER BELIEVE WHAT HE AND COLONEL NORTH WERE DOING WAS LEGAL
F04_22HC0114_PED,3.307875,/dt05_ped_simu/F04_22HC0114_PED.wav,IT MIGHT BE A YEAR OR MORE BEFORE WE GET PAID
M04_22GC010V_PED,8.4638125,/dt05_ped_simu/M04_22GC010V_PED.wav,THE LOGIC APPARENTLY IS THAT WE'LL HAVE TO RAISE OUR RATES TO DEFEND THE DOLLAR SAID PETER CANELO A PORTFOLIO STRATEGIST AT BEAR STEARNS
M04_423C020J_PED,4.31975,/dt05_ped_simu/M04_423C020J_PED.wav,EXCLUDING AUTOS SALES INCREASED ZERO POINT THREE PERCENT
F04_420C020W_PED,5.69975,/dt05_ped_simu/F04_420C020W_PED.wav,PATTERN PROCESSING MAKES MACHINE VISION SYSTEMS FOR USE IN AUTOMATED INSPECTIONS
F01_22GC0111_PED,8.5038125,/dt05_ped_simu/F01_22GC0111_PED.wav,YIELDS ON LONG TERM BONDS AFTER DROPPING AS LOW AS SEVEN POINT EIGHT THREE PERCENT EARLY LAST WEEK ARE BACK UP ABOVE EIGHT PERCENT
M03_423C020B_PED,4.1636875,/dt05_ped_simu/M03_423C020B_PED.wav,MY POSITION ON CONTRA AID ISN'T SOMETHING THAT'S GOING TO LOSE AN ELECTION
M03_22HC0103_PED,6.0358125,/dt05_ped_simu/M03_22HC0103_PED.wav,PROCEEDS WILL BE USED TO FINANCE THE ELECTRIC UTILITY'S CONSTRUCTION PROGRAM AND FOR GENERAL PURPOSES
M04_421C020V_PED,2.231875,/dt05_ped_simu/M04_421C020V_PED.wav,THE DOLLAR STRENGTHENED
F01_22HC0105_PED,10.1118125,/dt05_ped_simu/F01_22HC0105_PED.wav,THE FOLLOWING OFFICERS DIRECTORS AND LARGE STOCKHOLDERS OF COMPANIES REPORTED CHANGES IN HOLDINGS UNDER THE SECURITIES EXCHANGE ACT OF NINETEEN THIRTY FOUR
M03_423C020F_PED,5.8196875,/dt05_ped_simu/M03_423C020F_PED.wav,THE COMPANY HAS THIRTY FOUR TOY STORES THROUGHOUT THE MIDWEST AND SOUTHEAST THAT ARE STILL OPEN
M04_053C010T_PED,8.9355,/dt05_ped_simu/M04_053C010T_PED.wav,INSTITUTIONAL INVESTORS FUELED THE RISE BY SHIFTING ASSETS TO THE FUNDS IN RESPONSE TO DECLINING RATES AVAILABLE ON SHORT TERM SECURITIES IN THE MARKET
F04_422C0207_PED,3.043625,/dt05_ped_simu/F04_422C0207_PED.wav,FRONTIER SAVINGS IS BASED IN LAS VEGAS
M04_052C010G_PED,11.335625,/dt05_ped_simu/M04_052C010G_PED.wav,THE NIKKEI INDEX OF TWO HUNDRED TWENTY FIVE SELECTED ISSUES EDGED UP TWELVE POINT FOUR THREE POINTS TO CLOSE AT TWENTY FIVE THOUSAND SIX HUNDRED SEVENTEEN POINT EIGHT TWO
F04_422C0216_PED,5.65175,/dt05_ped_simu/F04_422C0216_PED.wav,SOMETIME NEXT YEAR HE SAID LAST WEEK WE'LL KNOW WHETHER THE FED'S PLAN HAS BEEN SUCCESSFUL
F01_053C010Z_PED,7.7276875,/dt05_ped_simu/F01_053C010Z_PED.wav,JOB SECURITY CLAUSES GIVE UNIONS SOMETHING POSITIVE TO TAKE BACK TO THEIR MEMBERS AT MODEST COST TO EMPLOYERS
M04_22GC010C_PED,3.127875,/dt05_ped_simu/M04_22GC010C_PED.wav,ALL THE BONDS WILL BE DATED NEXT MONDAY
F01_051C0111_PED,3.6799375,/dt05_ped_simu/F01_051C0111_PED.wav,IN TODAY'S MARKET THEY ARE ALMOST NEVER AVAILABLE
M04_051C010S_PED,7.1678125,/dt05_ped_simu/M04_051C010S_PED.wav,CONSUMER PRICES ROSE ONE POINT SIX PERCENT IN FEBRUARY THE HIGHEST MONTHLY INCREASE SINCE MID NINETEEN EIGHTY ONE
M03_421C020N_PED,9.875625,/dt05_ped_simu/M03_421C020N_PED.wav,VOLUME WAS A VERY MODEST THREE HUNDRED FIFTY TWO POINT TWO MILLION SHARES DOWN FROM THREE HUNDRED SIXTY SIX POINT FOUR MILLION SHARES A DAY EARLIER
M04_421C020P_PED,8.9196875,/dt05_ped_simu/M04_421C020P_PED.wav,ALL TOLD AMOCO SAID IT REPLACED ONE HUNDRED THIRTY PERCENT OF THE RESERVES THAT IT PRODUCED LAST YEAR RECOVERING FROM A WEAK RECORD IN NINETEEN EIGHTY SIX
F01_423C020U_PED,7.67975,/dt05_ped_simu/F01_423C020U_PED.wav,THE MINUTES NOTE THAT THE VALUE OF THE DOLLAR ON FOREIGN EXCHANGE MARKETS COULD AFFECT THE TIMING OF POLICY CHANGES
F04_053C0111_PED,7.8115625,/dt05_ped_simu/F04_053C0111_PED.wav,AUTO CONTRACTS PROVIDE FOR JOB SECURITY BUT BECAUSE THEY LIMIT THE FUNDS AVAILABLE FOR IT THEY HAVEN'T PREVENTED SIZABLE LAYOFFS
M04_22GC010J_PED,5.023875,/dt05_ped_simu/M04_22GC010J_PED.wav,ALL OF A SUDDEN THEY CAME BACK AND SAID WE AREN'T BUYING AT THIS YIELD
M03_22HC010F_PED,6.035625,/dt05_ped_simu/M03_22HC010F_PED.wav,CONSUMER SPENDING SURGED ZERO POINT SEVEN PERCENT IN JUNE LED BY A JUMP IN AUTO SALES
M03_051C010X_PED,8.5743125,/dt05_ped_simu/M03_051C010X_PED.wav,THE ALL ORDINARIES INDEX WHICH FELL ELEVEN POINT THREE TUESDAY SLIPPED ONE POINT FIVE TO ONE THOUSAND FOUR HUNDRED FORTY THREE POINT TWO
M03_22GC0105_PED,4.6278125,/dt05_ped_simu/M03_22GC0105_PED.wav,EVEN IF JAPANESE INVESTORS DON'T SELL DOLLARS SOMEBODY ELSE WILL HE SAYS
M04_420C020G_PED,5.7119375,/dt05_ped_simu/M04_420C020G_PED.wav,THE PHILADELPHIA BASED CONCERN DEVELOPS AND DESIGNS ADVANCED TELECOMMUNICATIONS SYSTEMS
F01_050C0116_PED,3.6958125,/dt05_ped_simu/F01_050C0116_PED.wav,I PREFER NOT TO SAY ANYTHING MORE THAN THAT
F04_420C0206_PED,4.5476875,/dt05_ped_simu/F04_420C0206_PED.wav,THE FOUR OTHER UTILITY COMPANY OWNERS WILL ALSO HAVE TO TAKE WRITE OFFS
F04_053C010U_PED,7.155625,/dt05_ped_simu/F04_053C010U_PED.wav,ALSO INDIVIDUAL INVESTORS' CONCERN OVER VOLATILITY IN FINANCIAL MARKETS MAY HAVE CONTRIBUTED TO THE INCREASE SHE SAID
M04_420C0212_PED,6.0958125,/dt05_ped_simu/M04_420C0212_PED.wav,SEARS HAS APPROVED THE BUY BACK OF AS MANY AS FORTY MILLION OF ITS COMMON SHARES OUTSTANDING
M03_053C010Q_PED,4.1556875,/dt05_ped_simu/M03_053C010Q_PED.wav,THAT ASSESSMENT IS PROBABLY EVEN MORE APPROPRIATE NOW MARKET ANALYSTS SAY
M03_050C010B_PED,7.1713125,/dt05_ped_simu/M03_050C010B_PED.wav,L. T. V. THE NATION'S NUMBER TWO STEELMAKER SAID THE SALE IS AMONG A NUMBER OF OPTIONS UNDER STUDY FOR THE PLANT
M03_420C0205_PED,7.0116875,/dt05_ped_simu/M03_420C0205_PED.wav,REGULATORS AREN'T ALLOWING THE UTILITY AN EIGHTEEN PERCENT OWNER IN THE PROJECT TO PASS THAT ALONG TO CUSTOMERS
M04_423C020R_PED,6.3758125,/dt05_ped_simu/M04_423C020R_PED.wav,A CITICORP PORTFOLIO MANAGER SAID THE UNIT'S NEW OWNER COULD LOSE QUITE A FEW CURRENT MANAGERS
F01_053C0112_PED,8.551625,/dt05_ped_simu/F01_053C0112_PED.wav,WE COULD DISTRIBUTE THE BONDS IN JAPAN IN EUROPE IN THE U. K. BUT NOT IN THE U. S. MR. LABRECQUE SAID
M04_422C020O_PED,6.07175,/dt05_ped_simu/M04_422C020O_PED.wav,LA Z. BOY'S STOCK SPLIT IS PAYABLE SEPTEMBER FOURTEENTH TO STOCK OF RECORD ON AUGUST NINETEENTH
M04_421C0204_PED,4.879875,/dt05_ped_simu/M04_421C0204_PED.wav,SO CLEARLY THE ADVOCATES OF SANCTIONS WERE THE FOREIGN POLICY VICTORS
M03_423C0202_PED,3.71675,/dt05_ped_simu/M03_423C0202_PED.wav,PAYMENTS CHARGED AS LATE AS APRIL FIFTEENTH WOULD MEET THE I. R. S. DEADLINE
M04_421C020F_PED,10.2154375,/dt05_ped_simu/M04_421C020F_PED.wav,STOCKS REBOUNDED SHARPLY PUSHING THE DOW JONES INDUSTRIALS UP A RECORD SEVENTY FIVE POINT TWO THREE POINTS TO TWO THOUSAND FIVE HUNDRED SIXTY EIGHT POINT OH FIVE
F04_422C0211_PED,5.62775,/dt05_ped_simu/F04_422C0211_PED.wav,I JUST FELT IT WAS AN APPROPRIATE TIME TO PURSUE BUSINESS IDEAS OF MY OWN MR. SAUNDERS SAID
M03_420C020V_PED,9.6925,/dt05_ped_simu/M03_420C020V_PED.wav,A SPOKESMAN SAID THE COMPANY EXPECTS TO MORE THAN DOUBLE ITS SHARES OUTSTANDING TO ABOUT NINETEEN POINT TWO MILLION FROM EIGHTEEN POINT TWO MILLION AS A RESULT OF THE OFFERING
M03_052C0101_PED,9.1235,/dt05_ped_simu/M03_052C0101_PED.wav,THE NEED FOR ECONOMY HAS ALSO HELD TO A HANDFUL THE EXPENSIVE BUT ALL IMPORTANT LONGITUDINAL SURVEYS THAT FOLLOW A GROUP OF PEOPLE OVER MANY YEARS
M04_423C0201_PED,6.01975,/dt05_ped_simu/M04_423C0201_PED.wav,FOR TAXPAYERS THE CHIEF ADVANTAGE OF PAYING BY THEIR CREDIT CARDS WOULD BE EXTRA TIME TO PAY
F01_052C010F_PED,4.2718125,/dt05_ped_simu/F01_052C010F_PED.wav,WESTERN UNION SAID IT MAY AGAIN EXTEND ITS DEADLINE
M03_22HC010E_PED,7.0278125,/dt05_ped_simu/M03_22HC010E_PED.wav,YESTERDAY THE DOLLAR EASED SLIGHTLY AGAINST MOST MAJOR FOREIGN CURRENCIES CHEERING SOME STOCK MARKET PLAYERS WITH ITS RELATIVE STABILITY
F04_420C0209_PED,7.18775,/dt05_ped_simu/F04_420C0209_PED.wav,THE DEPARTMENT SAID THE DECLINE IN FACTORY JOBS WAS CONCENTRATED IN MOTOR VEHICLES AND ELECTRICAL AND ELECTRONIC EQUIPMENT
M03_052C010V_PED,6.7958125,/dt05_ped_simu/M03_052C010V_PED.wav,THE FOREST PRODUCTS CONCERN SAID THE WORKERS AT THE AFFECTED PLANTS RETURNED TO WORK YESTERDAY ENDING A TWO MONTH STRIKE
M04_22GC010U_PED,8.567625,/dt05_ped_simu/M04_22GC010U_PED.wav,THE DECLINE IN THE DOLLAR AND THE CONTINUED STRENGTH IN THE ECONOMY HOWEVER ARE NOW ADDING DEMAND AND CAUSING THOSE PRICES TO RISE TOO
F01_052C0110_PED,6.38375,/dt05_ped_simu/F01_052C0110_PED.wav,HE IS THE HEAD OF THE HUGE JUNK BOND OPERATION OF DREXEL BURNHAM LAMBERT INCORPORATED
M03_422C020W_PED,8.4039375,/dt05_ped_simu/M03_422C020W_PED.wav,ITS DECLINE WAS APPARENTLY SPLIT BY FORD CHRYSLER AND HONDA MOTOR COMPANY WHOSE MARKET SHARES EACH GREW ONE POINT ONE PERCENT
M03_22GC0108_PED,7.332125,/dt05_ped_simu/M03_22GC0108_PED.wav,A PILOT LOAN SALE PROGRAM APPROVED LAST YEAR WOULD PROVIDE A VIRTUALLY RISK FREE TEST OF THIS APPROACH
F04_423C020C_PED,9.3154375,/dt05_ped_simu/F04_423C020C_PED.wav,PRIOR TO THE FILING THE COMPANY SAID IT HAD BEEN ATTEMPTING TO SETTLE ITS DEBT WITH THE CREDITORS AND TO GAIN ADDITIONAL BANK FINANCING TO CONTINUE GOING OPERATIONS
F04_050C010D_PED,5.3396875,/dt05_ped_simu/F04_050C010D_PED.wav,L. T. V. SAID IT RETAINED SHEARSON LEHMAN BROTHERS INCORPORATED TO HELP WITH THE STUDY
M04_421C0203_PED,10.1916875,/dt05_ped_simu/M04_421C0203_PED.wav,YIELDS RANGE FROM FOUR POINT EIGHT PERCENT IN NINETEEN NINETY TO SEVEN POINT TWO PERCENT ON ZERO COUPON BONDS DUE IN TWO THOUSAND TWO
M04_422C0212_PED,6.7438125,/dt05_ped_simu/M04_422C0212_PED.wav,I'M NOT GOING TO RETIRE BUT I'M UNLIKELY TO GO TO ANY LARGE INVESTMENT BANKING FIRM THAT RIVALS MORGAN STANLEY
F04_053C010S_PED,4.979625,/dt05_ped_simu/F04_053C010S_PED.wav,SUCH ACTIVITY HAS ALL BUT ENDED SINCE STOCK PRICES PLUNGED THE ANALYSTS SAY
F01_423C0213_PED,4.440125,/dt05_ped_simu/F01_423C0213_PED.wav,IT DOES TALK ABOUT THE GENERAL MUNICIPAL BOND MARKET THOUGH
M03_053C010X_PED,9.2671875,/dt05_ped_simu/M03_053C010X_PED.wav,VOLUME WAS A MODERATE FOUR HUNDRED FIFTY FOUR POINT SEVEN MILLION SHARES PICKING UP SLIGHTLY FROM WEDNESDAY'S FOUR HUNDRED TWENTY SEVEN POINT FOUR MILLION SHARES
F04_052C010L_PED,7.9875625,/dt05_ped_simu/F04_052C010L_PED.wav,IT SAID IT PUT THREE KEY EXECUTIVES IN CHARGE OF THE GROUPS TO FOCUS EFFORTS ON INCREASING SALES PRODUCTIVITY IN THE U. S.
M03_050C010Z_PED,4.844,/dt05_ped_simu/M03_050C010Z_PED.wav,THESE GENERALLY REACT MUCH LESS THAN LARGE DEPOSITORS TO REPORTS OF A SCANDAL
M04_421C020W_PED,7.8399375,/dt05_ped_simu/M04_421C020W_PED.wav,AN ISSUE OF TEN MILLION COMMON SHARES OF BETHLEHEM STEEL WAS PRICED AT NINETEEN DOLLARS A SHARE THROUGH SALOMON BROTHERS INCORPORATED
M04_22GC010H_PED,4.8638125,/dt05_ped_simu/M04_22GC010H_PED.wav,THE BOSTON PROPERTY WAS FULLY OCCUPIED A BROKER CLOSE TO THE BUILDING SAID
F04_053C010N_PED,5.7958125,/dt05_ped_simu/F04_053C010N_PED.wav,STOCK AND BOND PRICES FELL FRIDAY AMID CONCERN ABOUT LACK OF PROGRESS IN THE BUDGET TALKS
F04_22HC0108_PED,6.539875,/dt05_ped_simu/F04_22HC0108_PED.wav,COMPANIES ARE LISTED WHERE TRANSACTIONS GENERALLY AGGREGATE TEN THOUSAND SHARES OR ONE HUNDRED THOUSAND DOLLARS
F04_053C0104_PED,4.2919375,/dt05_ped_simu/F04_053C0104_PED.wav,IN ADDITION I. B. M.'S PRICING STRATEGY COULD HURT COMPETITORS
F01_052C010C_PED,3.7998125,/dt05_ped_simu/F01_052C010C_PED.wav,NOW I GET TO DO IT AND I'M VERY EXCITED
F04_053C0113_PED,2.5796875,/dt05_ped_simu/F04_053C0113_PED.wav,THESE POWERS ARE IMPORTANT TO US
F04_22GC010Z_PED,8.6676875,/dt05_ped_simu/F04_22GC010Z_PED.wav,IN THE BULL MARKET OF NINETEEN EIGHTY SIX TO EIGHTY SEVEN CASH POSITIONS EXCEEDING FIVE PERCENT OF ASSETS WOULD HAVE HELD DOWN OVERALL RETURNS
M04_22GC010T_PED,10.3275625,/dt05_ped_simu/M04_22GC010T_PED.wav,BUT UNTIL RECENTLY INFLATION IN HEALTH EDUCATION AND OTHER SERVICES WAS OFFSET BY FLAT OR FALLING PRICES FOR MANY MANUFACTURED GOODS AND FARM COMMODITIES
F04_423C0203_PED,7.939625,/dt05_ped_simu/F04_423C0203_PED.wav,BUT CONSUMERS GENERALLY WOULD HAVE ANOTHER MONTH UNTIL CREDIT CARD BILLS CAME DUE AND CONSIDERABLY MORE TIME IF THEY WERE WILLING TO PAY INTEREST
M03_420C0213_PED,6.4916875,/dt05_ped_simu/M03_420C0213_PED.wav,AS OF JUNE THIRTIETH SEARS HAD THREE HUNDRED FORTY FIVE POINT EIGHT MILLION SHARES OUTSTANDING
