ID,duration,wav,wrd
F04_050C0115_PED,7.1741875,/dt05_ped_simu/F04_050C0115_PED.wav,I'M NOT GOING TO RETIRE BUT I'M UNLIKELY TO GO TO ANY LARGE INVESTMENT BANKING FIRM THAT RIVALS MORGAN STANLEY
M03_052C010I_PED,7.6199375,/dt05_ped_simu/M03_052C010I_PED.wav,FIRST SECTION VOLUME WAS ESTIMATED AT A HEAVY ONE POINT SIX BILLION SHARES UP FROM ONE POINT THREE BILLION SHARES WEDNESDAY
M03_052C0106_PED,4.215,/dt05_ped_simu/M03_052C0106_PED.wav,THE DIVIDEND IS PAYABLE JUNE FIRST TO STOCK OF RECORD MAY SEVENTH
M04_050C010T_PED,6.16775,/dt05_ped_simu/M04_050C010T_PED.wav,BECAUSE MOST MEMBERS ARE INDIVIDUAL BROKERS THE COMMITTEE COULD HAVE SOME DIFFICULTY WINNING APPROVAL
F04_22HC0109_PED,10.163375,/dt05_ped_simu/F04_22HC0109_PED.wav,THE PANEL MADE SEVERAL OTHER RECOMMENDATIONS CONCERNING PROGRAM TRADING INCLUDING CONSOLIDATING REGULATORY AUTHORITY OVER ALL U. S. FINANCIAL MARKETS UNDER ONE GOVERNMENT AGENCY
F01_051C010W_PED,8.8155,/dt05_ped_simu/F01_051C010W_PED.wav,IN FUTURES TRADING MUNICIPAL BONDS FOR JUNE DELIVERY ROSE SIX THIRTY SECONDS TO EIGHT THOUSAND FIVE HUNDRED TWENTY SEVEN
F04_422C020G_PED,3.8680625,/dt05_ped_simu/F04_422C020G_PED.wav,WHAT IS IMPORTANT IS WE SAVED THIS COMPANY AND ARE REBUILDING IT
F01_22HC010Q_PED,10.0558125,/dt05_ped_simu/F01_22HC010Q_PED.wav,IT HAS SINCE REBOUNDED TO SEVEN HUNDRED FORTY FIVE POINT FIVE SEVEN WHERE IT CLOSED FRIDAY LOSING FOUR POINT FIVE SEVEN POINTS IN THE SESSION
M03_053C010H_PED,8.8435625,/dt05_ped_simu/M03_053C010H_PED.wav,PER SHARE EARNINGS FOR THE FISCAL YEAR FELL ABOUT TWENTY ONE PERCENT THE COMPANY ESTIMATED REFLECTING AN EIGHTEEN PERCENT INCREASE IN AVERAGE SHARES OUTSTANDING
M04_420C0203_PED,8.7115625,/dt05_ped_simu/M04_420C0203_PED.wav,THE AGENCY ALSO PREDICTS THAT THE NUMBER OF BANKRUPTCY FILINGS WILL RISE SEVENTEEN PERCENT IN THE YEAR ENDING SEPTEMBER THIRTIETH NINETEEN EIGHTY SEVEN
M03_052C010T_PED,6.2675625,/dt05_ped_simu/M03_052C010T_PED.wav,MR. BARRETT SAYS HE PAID ONE HUNDRED SEVENTY FIVE THOUSAND DOLLARS FOR THE ROLLS ONLY SIX MONTHS AGO
F04_420C020P_PED,5.0914375,/dt05_ped_simu/F04_420C020P_PED.wav,FOR ONE THING THERE IS CURRENTLY A SHORTAGE OF CHANNEL CAPACITY AT MANY CABLE SYSTEMS
F04_052C010Q_PED,6.1508125,/dt05_ped_simu/F04_052C010Q_PED.wav,SHE ALSO HAS WORKED AT NEW YORK MAGAZINE ANOTHER WEEKLY CITY PUBLICATION AND THE WASHINGTON POST
M03_051C010B_PED,9.6275625,/dt05_ped_simu/M03_051C010B_PED.wav,THE NOVEMBER DROP BROUGHT THE INDEX TO ONE HUNDRED NINETY POINT TWO PERCENT OF ITS NINETEEN SIXTY SEVEN AVERAGE FROM ONE HUNDRED NINETY THREE POINT FIVE PERCENT IN OCTOBER
F01_421C020O_PED,10.191375,/dt05_ped_simu/F01_421C020O_PED.wav,THE ONE HUNDRED SHARE INDEX WAS UP TEN POINT OH POINTS AT ONE THOUSAND SEVEN HUNDRED FORTY THREE POINT FOUR AT THE CLOSE
F01_052C0113_PED,6.24775,/dt05_ped_simu/F01_052C0113_PED.wav,HE HAS BEEN TOLD BY THE JUSTICE DEPARTMENT THAT BEFORE LONG HE MAY BE INDICTED ON CRIMINAL CHARGES
M04_22HC0101_PED,9.4236875,/dt05_ped_simu/M04_22HC0101_PED.wav,CENTERIOR ENERGY CORPORATION CLEVELAND SAID IT BEGAN A PUBLIC OFFERING OF FOUR MILLION COMMON SHARES AT TWENTY THREE POINT ONE TWO FIVE DOLLARS A SHARE
F04_050C010Y_PED,9.811375,/dt05_ped_simu/F04_050C010Y_PED.wav,MOREOVER B. C. C. I. OFFICIALS AND INDUSTRY ANALYSTS STRESSED THAT AS MUCH AS SEVENTY FIVE PERCENT OF THE BANK'S DEPOSIT BASE IS MADE UP OF RETAIL DEPOSITS
F01_052C0108_PED,4.759875,/dt05_ped_simu/F01_052C0108_PED.wav,ALSO TWO BANKS BOOSTED FOREIGN LOAN LOSS RESERVES
M03_053C0115_PED,3.4674375,/dt05_ped_simu/M03_053C0115_PED.wav,THE QUESTION IS WHETHER U. S. BANKS WILL BE ALLOWED TO COMPETE
M03_423C0211_PED,3.995125,/dt05_ped_simu/M03_423C0211_PED.wav,IT'S WHAT HE DOESN'T SAY THAT HAS RILED ONE FUND INVESTOR
F01_053C010E_PED,12.9194375,/dt05_ped_simu/F01_053C010E_PED.wav,SINCE THE EARLY NINETEEN EIGHTIES DATA GENERAL HAS TRIED TO COMPETE HEAD ON WITH INTERNATIONAL BUSINESS MACHINES CORPORATION AND DIGITAL EQUIPMENT CORPORATION FOR LARGE CUSTOMERS
F01_052C0109_PED,6.1598125,/dt05_ped_simu/F01_052C0109_PED.wav,MEANWHILE MEXICO HAS DONE BETTER THAN OTHER BIG DEBTORS IN WINNING CONCESSIONS
F01_051C010R_PED,7.90375,/dt05_ped_simu/F01_051C010R_PED.wav,THE ECONOMIC PLANNING BOARD WHICH ANNOUNCED THE MEASURES SAID THE GOVERNMENT'S GOAL IS TO HOLD INFLATION BELOW FIVE PERCENT THIS YEAR
F04_421C0208_PED,3.9519375,/dt05_ped_simu/F04_421C0208_PED.wav,FEW PEOPLE PREDICT A DIVIDEND CUT AT G. M. HOWEVER
M03_051C010F_PED,2.523625,/dt05_ped_simu/M03_051C010F_PED.wav,I THINK WE HAVE TO OPEN OUR MARKETS
F01_422C0204_PED,7.759875,/dt05_ped_simu/F01_422C0204_PED.wav,THE INVESTORS EXPECT TO PROFIT ON THE DIFFERENCE BETWEEN THE PRICE REALIZED IN THE SALE AND THE COST OF REPLACING THE BORROWED SHARES
F04_421C020Q_PED,8.7154375,/dt05_ped_simu/F04_421C020Q_PED.wav,EXXON CORPORATION SAID EARLIER THIS WEEK THAT IT REPLACED ONE HUNDRED FOURTEEN PERCENT OF ITS OIL AND GAS PRODUCTION IN NINETEEN EIGHTY SEVEN
M04_421C020L_PED,7.535625,/dt05_ped_simu/M04_421C020L_PED.wav,THE GOVERNMENT PREDICTS SPENDING FOR PLANT AND MACHINERY WILL GROW TWENTY FIVE PERCENT THIS YEAR UP FROM NINE POINT EIGHT PERCENT LAST YEAR
F04_420C020Y_PED,6.9875,/dt05_ped_simu/F04_420C020Y_PED.wav,THIS RETAILER SAID IT OFFERED FOR SALE TWO HUNDRED MILLION DOLLARS IN NOTES DUE AUGUST FIRST NINETEEN NINETY SIX
M04_423C0216_PED,6.30375,/dt05_ped_simu/M04_423C0216_PED.wav,SUCH A RULE CHANGE EFFECTIVELY WOULD REMOVE ONE TECHNICALITY THAT COULD SLOW A TAKEOVER ATTEMPT
M03_050C010A_PED,2.916625,/dt05_ped_simu/M03_050C010A_PED.wav,CHRYSLER REDUCED SOME PRICES ON FRIDAY
F04_22HC010U_PED,7.4836875,/dt05_ped_simu/F04_22HC010U_PED.wav,THE NIKKEI INDEX ADDED EIGHTY POINT OH SIX POINTS TO FINISH AT TWENTY EIGHT THOUSAND TWO HUNDRED NINE POINT FOUR TWO
M04_422C0206_PED,7.5636875,/dt05_ped_simu/M04_422C0206_PED.wav,SPOKESMEN FOR BOTH COMPANIES SAID THEY ENDED THE NEGOTIATIONS BECAUSE IT APPEARED THAT THE MERGER WOULDN'T BE COMPLETED BY THAT DATE
M03_051C010I_PED,7.01175,/dt05_ped_simu/M03_051C010I_PED.wav,YESTERDAY'S ACTION DIDN'T AFFECT A FOURTH L. T. V. PLAN THE PENSION AGENCY TOOK OVER IN SEPTEMBER NINETEEN EIGHTY SIX
M04_051C010M_PED,6.063625,/dt05_ped_simu/M04_051C010M_PED.wav,THE PROPOSED PER SHARE PRICE INCLUDES TEN DOLLARS CASH AND TWO DOLLARS OF UNSPECIFIED SECURITIES
M04_053C010O_PED,7.5358125,/dt05_ped_simu/M04_053C010O_PED.wav,THE DOW JONES INDUSTRIALS DROPPED TWENTY FIVE POINT TWO OH TO ONE THOUSAND NINE HUNDRED THIRTY FIVE POINT OH ONE
F04_420C020Z_PED,7.59575,/dt05_ped_simu/F04_420C020Z_PED.wav,DEAN WITTER REYNOLDS INCORPORATED GOLDMAN SACHS AND COMPANY AND MORGAN STANLEY AND COMPANY ARE HANDLING THE SALE
M03_421C020E_PED,5.82775,/dt05_ped_simu/M03_421C020E_PED.wav,AND PENNZOIL COMPANY'S NET INCOME TUMBLED SEVENTY ONE PERCENT LARGELY FROM A ONE TIME CHARGE
M03_050C010E_PED,6.2035625,/dt05_ped_simu/M03_050C010E_PED.wav,AUTO SALES ROSE TWO POINT FOUR PERCENT IN DECEMBER AFTER DECLINING ZERO POINT SEVEN PERCENT IN NOVEMBER
F04_053C010P_PED,2.3079375,/dt05_ped_simu/F04_053C010P_PED.wav,THE DOLLAR WAS LITTLE CHANGED
M03_052C010Z_PED,5.5638125,/dt05_ped_simu/M03_052C010Z_PED.wav,WELL TO BEGIN WITH MR. MILKEN ISN'T RUNNING FOR OFFICE OR FOR MR. CONGENIALITY
M03_22HC010B_PED,10.067875,/dt05_ped_simu/M03_22HC010B_PED.wav,IT SAID TRADERS SHOULD BE ABLE TO DELIVER ACTUAL STOCKS TO SETTLE FUTURES CONTRACT OBLIGATIONS STOCK INDEX FUTURES CURRENTLY ARE SETTLED IN CASH UPON EXPIRATION
M03_22GC0102_PED,4.083875,/dt05_ped_simu/M03_22GC0102_PED.wav,MR. WOLF SAID THE NEW JOB WILL BE PRIMARILY BUSINESS ORIENTED
M04_052C0104_PED,7.99175,/dt05_ped_simu/M04_052C0104_PED.wav,STERLING DRUG INCORPORATED INCREASED THE QUARTERLY DIVIDEND FIFTEEN PERCENT TO THIRTY EIGHT CENTS A SHARE FROM THIRTY THREE CENTS
F01_22HC0107_PED,9.330375,/dt05_ped_simu/F01_22HC0107_PED.wav,UNLESS OTHERWISE NOTED CHANGES INVOLVED DIRECT HOLDINGS OF COMMON STOCK AND TOOK PLACE IN OCTOBER AND NOVEMBER OF NINETEEN EIGHTY SEVEN
F01_423C0205_PED,5.151625,/dt05_ped_simu/F01_423C0205_PED.wav,THE OTHER WAS MITSUBISHI MOTORS CORPORATION'S U. S. SALES OPERATION
M03_22GC0113_PED,6.1875625,/dt05_ped_simu/M03_22GC0113_PED.wav,RATES ARE EXPECTED TO REMAIN AT THOSE LEVELS OR MOVE A LITTLE HIGHER THIS WEEK AT THE TREASURY DEPARTMENT'S QUARTERLY AUCTION
F04_423C0207_PED,6.3686875,/dt05_ped_simu/F04_423C0207_PED.wav,REPRESENTATIVES FOR THE TWO IMPORTERS SAID THE PROGRAMS HAVE ENDED AND NEW INCENTIVES HAVEN'T BEEN ANNOUNCED
M03_050C010F_PED,5.89175,/dt05_ped_simu/M03_050C010F_PED.wav,FURNITURE SALES FELL ZERO POINT FIVE PERCENT AFTER RISING ZERO POINT TWO PERCENT
F04_22HC010R_PED,3.4518125,/dt05_ped_simu/F04_22HC010R_PED.wav,HE BEGAN FEARING A POSSIBLE DIVIDEND CUT
M04_420C020T_PED,8.935625,/dt05_ped_simu/M04_420C020T_PED.wav,AND A MERRILL LYNCH SPOKESMAN SAID ALL OF HIS FIRM'S PROGRAM TRADING SIMPLY REFLECTS REQUESTS FROM CUSTOMERS FOR SUCH TRADING
F04_423C020V_PED,3.9999375,/dt05_ped_simu/F04_423C020V_PED.wav,TIGHTER CREDIT CONDITIONS MEAN HIGHER INTEREST RATE
M03_422C020J_PED,7.6196875,/dt05_ped_simu/M03_422C020J_PED.wav,THE DOLLAR IS STILL THE KEY SAID JACK P. BAKER HEAD OF BLOCK TRADING AT SHEARSON LEHMAN BROTHERS INCORPORATED NEW YORK
F01_421C020C_PED,9.15975,/dt05_ped_simu/F01_421C020C_PED.wav,OCCIDENTAL PETROLEUM CORPORATION REPORTED A TWENTY THREE PERCENT PROFIT JUMP THOUGH THE COMPANY WOULD HAVE HAD A LOSS WITHOUT A ONE TIME ITEM
M04_422C0202_PED,6.6478125,/dt05_ped_simu/M04_422C0202_PED.wav,INVESTORS USE SHORT INTEREST FIGURES TO DETERMINE HOW MUCH SHORT SELLING IS GOING ON IN INDIVIDUAL STOCKS
F01_22HC010M_PED,6.5916875,/dt05_ped_simu/F01_22HC010M_PED.wav,U. S. ANALYSTS AREN'T CERTAIN WHETHER THE SOVIETS AND CHINA WILL SUPPORT THE EMBARGO RESOLUTION
M04_423C0208_PED,4.335875,/dt05_ped_simu/M04_423C0208_PED.wav,PEOPLE DON'T VOTE PRIMARILY ON THE BASIS OF ISSUES HE SAID
F04_420C020L_PED,5.9555625,/dt05_ped_simu/F04_420C020L_PED.wav,A DROP IN OIL PRICES COULD ALSO PROVIDE SOME PRICE RELIEF AS IT DID IN NINETEEN EIGHTY SIX
F01_421C020Z_PED,6.6236875,/dt05_ped_simu/F01_421C020Z_PED.wav,A CITICORP PORTFOLIO MANAGER SAYS THE UNIT'S NEW OWNER COULD LOSE QUITE A FEW CURRENT MANAGERS
F01_423C020G_PED,7.20775,/dt05_ped_simu/F01_423C020G_PED.wav,THE LATEST GOVERNMENT FIGURES THOUGH SHOW THE PRODUCER PRICE INDEX FELL ZERO POINT TWO PERCENT LAST MONTH
F01_051C0113_PED,4.855875,/dt05_ped_simu/F01_051C0113_PED.wav,MANY INSTITUTIONAL PLAYERS CONFESS TO HOLDING MORE CASH THAN USUAL
M04_22GC010N_PED,8.1758125,/dt05_ped_simu/M04_22GC010N_PED.wav,IT SAID IT PUT THREE KEY EXECUTIVES IN CHARGE OF THE GROUPS TO FOCUS EFFORTS ON INCREASING SALES PRODUCTIVITY IN THE U. S.
F01_421C020X_PED,4.7438125,/dt05_ped_simu/F01_421C020X_PED.wav,THE OFFERING SIZE WAS INCREASED FROM THE EIGHT MILLION SHARES ORIGINALLY PLANNED
F01_053C0107_PED,9.9116875,/dt05_ped_simu/F01_053C0107_PED.wav,I. B. M. P. C.S TRADITIONALLY ARE PRICED HIGHER THAN RIVAL BRANDS WHICH TYPICALLY MUST UNDERCUT I. B. M. PRICES BY FIFTEEN PERCENT
M04_22GC010F_PED,6.983625,/dt05_ped_simu/M04_22GC010F_PED.wav,WHEN POSSIBLE THEY TRY TO REDUCE THEIR U. S. CURRENCY PORTFOLIOS BY SELLING DOLLARS BACK INTO CALMER MARKETS
F04_050C0104_PED,7.3235625,/dt05_ped_simu/F04_050C0104_PED.wav,MINING EMPLOYMENT WHICH INCLUDES THE OIL AND GAS EXTRACTION INDUSTRY ROSE THREE THOUSAND AFTER A ONE THOUSAND JOB RISE
M03_051C0115_PED,5.9236875,/dt05_ped_simu/M03_051C0115_PED.wav,NOW MANY INSTITUTIONS SAY THEIR CASH LEVELS ARE TEN PERCENT OR MORE AND A FEW ARE AT THIRTY PERCENT OR MORE
F04_051C0109_PED,5.69175,/dt05_ped_simu/F04_051C0109_PED.wav,IN NOVEMBER IT WAS CUT TO SEVENTEEN POINT FIVE CENTS FROM TWENTY TWO POINT FIVE CENTS
F04_422C020U_PED,10.3235,/dt05_ped_simu/F04_422C020U_PED.wav,DOMESTIC CARS ACCOUNTED FOR SEVENTY THREE POINT FIVE PERCENT OF APRIL AUTO SALES WHILE THE IMPORT SHARE GREW ONE POINT FIVE PERCENT TO TWENTY SIX POINT FIVE PERCENT
F01_22GC010A_PED,4.8958125,/dt05_ped_simu/F01_22GC010A_PED.wav,THE FIRST SALES ARE EXPECTED TO GO TO MARKET SOMETIME THIS SUMMER
M04_050C010Q_PED,2.5600625,/dt05_ped_simu/M04_050C010Q_PED.wav,IT DIDN'T ELABORATE
F01_423C020D_PED,3.916,/dt05_ped_simu/F01_423C020D_PED.wav,ALL SETTLEMENT TALKS CEASED AFTER THE FILING
F01_22HC010D_PED,8.35175,/dt05_ped_simu/F01_22HC010D_PED.wav,THE DOLLAR IS STILL THE KEY SAID JACK P. BAKER HEAD OF BLOCK TRADING AT SHEARSON LEHMAN BROTHERS INCORPORATED NEW YORK
F01_051C010T_PED,5.1998125,/dt05_ped_simu/F01_051C010T_PED.wav,IN THE PREVIOUS FOUR YEARS ANNUAL INCREASES WERE WELL BELOW THREE PERCENT
F04_052C010P_PED,6.64775,/dt05_ped_simu/F04_052C010P_PED.wav,LAST NOVEMBER ALFRED A. KNOPF INCORPORATED THE BOOK PUBLISHER NAMED MS. AMSTERDAM A SENIOR EDITOR
F01_421C020D_PED,7.783625,/dt05_ped_simu/F01_421C020D_PED.wav,PHILLIPS PETROLEUM CORPORATION'S PROFIT MEANWHILE PLUNGED SIXTY THREE PERCENT AMID WEAK NATURAL GAS PRICES
F04_050C0114_PED,4.9800625,/dt05_ped_simu/F04_050C0114_PED.wav,I JUST FELT IT WAS AN APPROPRIATE TIME TO PURSUE BUSINESS IDEAS OF MY OWN MR. SAUNDERS SAID
F01_22HC010P_PED,9.1276875,/dt05_ped_simu/F01_22HC010P_PED.wav,HE POINTS OUT THAT SINCE THE OCTOBER NINETEENTH PLUNGE THE DOW JONES TRANSPORTATION AVERAGE HAS DROPPED BELOW THE LOW IT POSTED DURING THE CRASH
M04_423C020Q_PED,5.35975,/dt05_ped_simu/M04_423C020Q_PED.wav,SOURCES SAY AT LEAST TWO BIDDERS HAD SOME DOUBTS ABOUT CITICORP'S PERFORMANCE NUMBERS
M04_22GC010O_PED,2.8320625,/dt05_ped_simu/M04_22GC010O_PED.wav,THERE ARE TWO ISSUES TO CONSIDER
F01_053C0105_PED,9.5515625,/dt05_ped_simu/F01_053C0105_PED.wav,FOR EXAMPLE THE COMPANY PLANS BIG DISCOUNTS ON THE NEW ONE THOUSAND SIX HUNDRED NINETY FIVE DOLLAR MACHINE FOR SCHOOLS A MAIN APPLE MARKET
F01_422C0205_PED,11.7446875,/dt05_ped_simu/F01_422C0205_PED.wav,THE TWO FINANCIAL SERVICES CONCERNS SAID THEY PREVIOUSLY AGREED TO END THE AGREEMENT IF THE TRANSACTION WASN'T COMPLETED BY MARCH TWENTY FOURTH NINETEEN EIGHTY SEVEN
F01_053C0102_PED,5.5279375,/dt05_ped_simu/F01_053C0102_PED.wav,UNDER THE LAW THE JUSTICE DEPARTMENT CAN ELECT TO TAKE OVER AS PLAINTIFF
M03_422C0209_PED,3.152,/dt05_ped_simu/M03_422C0209_PED.wav,BUT SHE INSISTS I DON'T WANT TO GO ON WELFARE
F04_051C0106_PED,6.9479375,/dt05_ped_simu/F04_051C0106_PED.wav,ACTIVELY TRADED THIRTY YEAR BONDS DROPPED ABOUT A POINT OR AROUND TEN DOLLARS FOR EACH ONE THOUSAND DOLLAR FACE AMOUNT
F04_423C020P_PED,4.179625,/dt05_ped_simu/F04_423C020P_PED.wav,CITICORP SAID AN ACCORD HASN'T AT THIS MOMENT BEEN SIGNED
M04_421C020Y_PED,9.3036875,/dt05_ped_simu/M04_421C020Y_PED.wav,IN NEW YORK STOCK EXCHANGE COMPOSITE TRADING YESTERDAY THE COMPANY'S STOCK ROSE SIXTY TWO POINT FIVE CENTS TO NINETEEN POINT SIX TWO FIVE DOLLARS
F01_422C0214_PED,3.5439375,/dt05_ped_simu/F01_422C0214_PED.wav,WHAT CAN THE FEDERAL RESERVE DO NOW
