ID,duration,wav,wrd
M03_420C020S_BUS,5.68375,/dt05_bus_real/M03_420C020S_BUS.wav,WE BELIEVE PROGRAM TRADING IS IMPORTANT AS A SOURCE OF LIQUIDITY MORGAN STANLEY SAID
F04_050C0109_BUS,5.323875,/dt05_bus_real/F04_050C0109_BUS.wav,THOUGH THERE WAS LITTLE EVIDENCE THE STOCK MARKET PLUNGE HAD AFFECTED SALES THE OUTLOOK REMAINS UNCERTAIN
F01_051C0113_BUS,4.871875,/dt05_bus_real/F01_051C0113_BUS.wav,MANY INSTITUTIONAL PLAYERS CONFESS TO HOLDING MORE CASH THAN USUAL
F04_051C010O_BUS,8.0358125,/dt05_bus_real/F04_051C010O_BUS.wav,MR. FICKLING STARTED THE COMPANY IN NINETEEN SIXTY NINE WITH EIGHT GENERAL HOSPITALS AND NURSING HOMES ALONG WITH A SMALL CONSTRUCTION OPERATION
F04_051C010E_BUS,2.9959375,/dt05_bus_real/F04_051C010E_BUS.wav,FOR THE KOREAN ECONOMY HE FAVORS FREE TRADE
F04_22HC010T_BUS,5.0278125,/dt05_bus_real/F04_22HC010T_BUS.wav,WORST OF ALL HE SAYS SOMEBODY MIGHT HAVE BOUGHT THE COMPANY WITH THE INTENTION OF BREAKING IT UP
F01_051C0104_BUS,3.127875,/dt05_bus_real/F01_051C0104_BUS.wav,THAT'S ANOTHER STORY
F04_051C010G_BUS,6.964125,/dt05_bus_real/F04_051C010G_BUS.wav,HE ADDS THAT MORE EFFORT SHOULD BE MADE TO REALIZE A FAIR DISTRIBUTION OF INCOME BUT HE IS SHORT ON SPECIFICS
F01_053C0107_BUS,9.34375,/dt05_bus_real/F01_053C0107_BUS.wav,I. B. M. P. C.S TRADITIONALLY ARE PRICED HIGHER THAN RIVAL BRANDS TO TYPICALLY MUST UNDERCUT I. B. M. PRICES BY FIFTEEN PERCENT
F04_22GC010E_BUS,3.402,/dt05_bus_real/F04_22GC010E_BUS.wav,THE CENTRAL BANKS HAVE LITTLE CHANCE TO PROTECT THEMSELVES FROM THE DOLLAR'S FALL
F04_050C010M_BUS,10.315625,/dt05_bus_real/F04_050C010M_BUS.wav,LINK RESOURCES CORPORATION ESTIMATES THE ELECTRONIC MAIL MARKET AT ABOUT TWO HUNDRED NINETY SIX MILLION DOLLARS A YEAR AND VOICE MAIL AT ABOUT SEVENTY SIX MILLION DOLLARS
M04_052C010W_BUS,6.951625,/dt05_bus_real/M04_052C010W_BUS.wav,THE COMPANY SAID THE WESTERN COUNCIL OF INDUSTRIAL WORKERS RATIFIED ECONOMIC TERMS OF THE NEW THREE YEAR AGREEMENT ON FRIDAY
M03_22HC010B_BUS,9.715375,/dt05_bus_real/M03_22HC010B_BUS.wav,AND IT SAID TRADERS SHOULD BE ABLE TO DELIVER ACTUAL STOCKS TO SETTLE FUTURES CONTRACT OBLIGATIONS STOCK INDEX FUTURES CURRENTLY ARE SETTLED IN CASH UPON EXPIRATION
M03_423C020B_BUS,4.10825,/dt05_bus_real/M03_423C020B_BUS.wav,MY POSITION ON CONTRA AID ISN'T SOMETHING THAT'S GOING TO LOSE AN ELECTION
F01_051C0105_BUS,8.0718125,/dt05_bus_real/F01_051C0105_BUS.wav,IN THE BONDS MARKET PRICES OF SOME LONG TERM TREASURY ISSUES FELL TO THEIR LOWEST LEVELS IN ABOUT THREE MONTHS
M03_050C0108_BUS,4.9235,/dt05_bus_real/M03_050C0108_BUS.wav,U. S. CAR SALES FELL TEN POINT ONE PERCENT IN EARLY NOVEMBER FROM A YEAR AGO
M04_22HC010G_BUS,7.4398125,/dt05_bus_real/M04_22HC010G_BUS.wav,DESPITE THE UNEXPECTED STRENGTH ECONOMISTS SAY SPENDING WILL SLOW SOON DUE TO SLUGGISH INCOME GROWTH RISING PRICES AND HIGH CONSUMER DEBT
F01_053C010Z_BUS,7.471625,/dt05_bus_real/F01_053C010Z_BUS.wav,JOB SECURITY CLAUSES GIVE UNIONS SOMETHING POSITIVE TO TAKE BACK TO THEIR MEMBERS AT MODEST COST TO EMPLOYERS
F01_422C0213_BUS,3.6556875,/dt05_bus_real/F01_422C0213_BUS.wav,I PREFER NOT TO SAY ANYTHING MORE THAN THAT
M03_051C010X_BUS,9.6316875,/dt05_bus_real/M03_051C010X_BUS.wav,THE ALL ORDINARIES INDEX WHICH FELL ELEVEN POINT THREE TUESDAY SLIPPED ONE POINT FIVE TO ONE THOUSAND FOUR HUNDRED FORTY THREE POINT TWO
M04_422C0212_BUS,5.4796875,/dt05_bus_real/M04_422C0212_BUS.wav,I'M NOT GOING TO RETIRE BUT I'M UNLIKELY TO GO TO ANY LARGE INVESTMENT BANKING FIRM THAT RIVALS MORGAN STANLEY
M04_421C020W_BUS,7.1518125,/dt05_bus_real/M04_421C020W_BUS.wav,AN ISSUE OF TEN MILLION COMMON SHARES OF BETHLEHEM STEEL WAS PRICED AT NINETEEN DOLLARS A SHARE THROUGH SALOMON BROTHERS INCORPORATED
M04_421C020B_BUS,4.4516875,/dt05_bus_real/M04_421C020B_BUS.wav,SEPARATELY SHELL OIL COMPANY'S NET INCOME ROSE TWENTY ONE PERCENT
F01_22GC0104_BUS,4.61575,/dt05_bus_real/F01_22GC0104_BUS.wav,THE CHIEF TRADER IN NEW YORK FOR A TOKYO BASED BANK AGREES
F01_421C0201_BUS,13.855375,/dt05_bus_real/F01_421C0201_BUS.wav,UNDERWRITERS LED BY MERRILL LYNCH CAPITAL MARKETS TENTATIVELY PRICED A PROPOSED ONE HUNDRED NINETY SIX POINT SEVEN MILLION DOLLAR OFFERING OF MORTGAGE REVENUE BONDS BY THE CALIFORNIA HOUSING FINANCE AGENCY
M03_420C0207_BUS,6.8915,/dt05_bus_real/M03_420C0207_BUS.wav,BUT THOSE CHARGES AREN'T REQUIRED TO BE MADE UNTIL THE NINETEEN EIGHTY EIGHT FIRST QUARTER OR UNDER CERTAIN CIRCUMSTANCES EVEN LATER
M04_22GC010G_BUS,4.607875,/dt05_bus_real/M04_22GC010G_BUS.wav,TRADERS SAY THE BUNDESBANK DID THIS WHEN THE DOLLAR STRENGTHENED IN LATE JULY AND EARLY AUGUST
F01_052C010J_BUS,11.2155,/dt05_bus_real/F01_052C010J_BUS.wav,RECOGNITION SAID IT REORGANIZED ITS U. S. BUSINESS INTO THREE UNITS SALES AND SERVICE FEDERAL GOVERNMENT SALES AND SALES DEVELOPMENT AND SPECIAL PRODUCTS
F01_22GC0106_BUS,5.8958125,/dt05_bus_real/F01_22GC0106_BUS.wav,THE TREND IS INEVITABLE UNLESS THE GOVERNMENT HAS AUTHORITY OVER THE WHOLE WORLD
M04_22GC0101_BUS,7.0316875,/dt05_bus_real/M04_22GC0101_BUS.wav,ROBINS SAID MR. WOLF FORTY THREE YEARS OLD IS LEAVING AFTER THIRTEEN YEARS WITH THE COMPANY FOR A POSITION WITH A TEXAS HEALTH CARE CONCERN
F01_423C0205_BUS,5.8236875,/dt05_bus_real/F01_423C0205_BUS.wav,THE OTHER WAS MITSUBISHI MOTORS CORPORATION'S U. S. SALES OPERATION
M03_051C010C_BUS,4.6040625,/dt05_bus_real/M03_051C010C_BUS.wav,THE OCTOBER RISE WAS INITIALLY REPORTED AS A ZERO POINT TWO PERCENT DROP
M03_052C010T_BUS,6.0836875,/dt05_bus_real/M03_052C010T_BUS.wav,MR. BARRETT SAYS HE PAID ONE HUNDRED SEVENTY FIVE THOUSAND DOLLARS FOR THE ROLLS ONLY SIX MONTHS AGO
F04_050C010H_BUS,8.6515,/dt05_bus_real/F04_050C010H_BUS.wav,OVERALL SALES OF DURABLE GOODS INTENDED TO LAST THREE YEARS OR MORE CLIMBED ONE POINT SEVEN PERCENT AFTER A ZERO POINT TWO PERCENT RISE IN NOVEMBER
M03_22GC010S_BUS,7.1050625,/dt05_bus_real/M03_22GC010S_BUS.wav,HEALTH CARE INFLATION FOR INSTANCE HASN'T DROPPED BELOW SIX PERCENT ANNUALLY AND THE COST OF EDUCATION HAS RISEN EVEN FASTER
M03_052C010I_BUS,7.875625,/dt05_bus_real/M03_052C010I_BUS.wav,FIRST SECTION VOLUME WAS ESTIMATED AT A HEAVY ONE POINT SIX BILLION SHARES UP FROM ONE POINT THREE BILLION SHARES WEDNESDAY
F04_053C0111_BUS,7.62775,/dt05_bus_real/F04_053C0111_BUS.wav,AUTO CONTRACTS PROVIDE FOR JOB SECURITY BUT BECAUSE THEY LIMIT THE FUNDS AVAILABLE FOR IT THEY HAVEN'T PREVENTED SIZABLE LAYOFFS
M04_421C0206_BUS,2.1439375,/dt05_bus_real/M04_421C0206_BUS.wav,WHAT ABOUT IN SOUTH AFRICA ITSELF
F01_051C010W_BUS,8.50375,/dt05_bus_real/F01_051C010W_BUS.wav,IN FUTURES TRADING MUNICIPAL BONDS FOR JUNE DELIVERY ROSE SIX THIRTY SECONDS TO EIGHT THOUSAND FIVE HUNDRED TWENTY SEVEN
F04_420C020L_BUS,5.411625,/dt05_bus_real/F04_420C020L_BUS.wav,A DROP IN OIL PRICES COULD ALSO PROVIDE SOME PRICE RELIEF AS IT DID IN NINETEEN EIGHTY SIX
M03_053C010Q_BUS,4.412,/dt05_bus_real/M03_053C010Q_BUS.wav,THAT ASSESSMENT IS PROBABLY EVEN MORE APPROPRIATE NOW MARKET ANALYSTS SAY
F04_422C020V_BUS,5.9958125,/dt05_bus_real/F04_422C020V_BUS.wav,G. M.'S SHARE OF THE TOTAL CAR MARKET FELL TO THIRTY FIVE POINT SIX PERCENT FROM THIRTY NINE POINT TWO PERCENT
M04_22GC010F_BUS,6.271625,/dt05_bus_real/M04_22GC010F_BUS.wav,WHEN POSSIBLE THEY TRY TO REDUCE THEIR U. S. CURRENCY PORTFOLIOS BY SELLING DOLLARS BACK INTO CALMER MARKETS
F04_422C020S_BUS,7.195875,/dt05_bus_real/F04_422C020S_BUS.wav,IN NATIONAL OVER THE COUNTER TRADING INFORMATION RESOURCES CLOSED AT TWENTY ONE DOLLARS UP TWO POINT ONE TWO FIVE DOLLARS
M03_053C0101_BUS,6.4435,/dt05_bus_real/M03_053C0101_BUS.wav,THE SUIT WAS FILED UNDER THE FALSE CLAIMS ACT WHICH ALLOWS PRIVATE CITIZENS TO SUE ON BEHALF OF THE GOVERNMENT
M04_22GC010N_BUS,7.027875,/dt05_bus_real/M04_22GC010N_BUS.wav,IT SAID IT PUT THREE KEY EXECUTIVES IN CHARGE OF THE GROUPS TO FOCUS EFFORTS ON INCREASING SALES PRODUCTIVITY IN THE U. S.
M03_053C010X_BUS,10.0439375,/dt05_bus_real/M03_053C010X_BUS.wav,VOLUME WAS A MODERATE FOUR HUNDRED FIFTY FOUR POINT SEVEN MILLION SHARES PICKING UP SLIGHTLY FROM WEDNESDAY'S FOUR HUNDRED TWENTY SEVEN POINT FOUR MILLION SHARES
F01_421C0210_BUS,8.4078125,/dt05_bus_real/F01_421C0210_BUS.wav,BUT HE OFFERED THE OPINION THAT ROBERT WADE THE UNIT'S CHIEF AND HALF A DOZEN OTHER SENIOR PEOPLE WILL GO WITH U. S. F. AND G.
F01_053C010Y_BUS,7.67975,/dt05_bus_real/F01_053C010Y_BUS.wav,THE ONE HUNDRED SHARE INDEX WAS OFF FIVE POINT TWO POINTS AT ONE THOUSAND SEVEN HUNDRED EIGHTY NINE POINT FIVE
M03_050C010I_BUS,4.3556875,/dt05_bus_real/M03_050C010I_BUS.wav,STOCK PRICES ALSO WERE MIXED IN PARIS ZURICH AND STOCKHOLM
F01_052C010M_BUS,9.2315625,/dt05_bus_real/F01_052C010M_BUS.wav,IN THE ELECTRICAL SECTOR SIEMENS RECOVERED SOME OF THE LOSS IT HAD TUESDAY WHEN IT REPORTED A NINE PERCENT DECLINE IN FIRST HALF GROUP PROFIT
M04_053C0108_BUS,2.4879375,/dt05_bus_real/M04_053C0108_BUS.wav,THE TASK FORCE REPORT ISN'T ALL BAD
M04_051C010N_BUS,8.26375,/dt05_bus_real/M04_051C010N_BUS.wav,IN AMERICAN STOCK EXCHANGE COMPOSITE TRADING YESTERDAY SUN CITY CLOSED AT TEN DOLLARS AND FIFTY CENTS A SHARE UP ONE POINT EIGHT SEVEN FIVE DOLLARS
M03_423C0211_BUS,4.8198125,/dt05_bus_real/M03_423C0211_BUS.wav,IT'S WHAT HE DOESN'T SAY THAT HAS RILED ONE FUND INVESTOR
F04_051C0106_BUS,7.3153125,/dt05_bus_real/F04_051C0106_BUS.wav,ACTIVELY TRADED THIRTY YEAR BONDS DROPPED ABOUT A POINT OR AROUND TEN DOLLARS FOR EACH ONE THOUSAND DOLLAR FACE AMOUNT
F04_420C020W_BUS,5.1158125,/dt05_bus_real/F04_420C020W_BUS.wav,PATTERN PROCESSING MAKES MACHINE VISION SYSTEMS FOR USE IN AUTOMATED INSPECTIONS
M04_053C010J_BUS,6.0478125,/dt05_bus_real/M04_053C010J_BUS.wav,THE COMPANY WHICH MAKES MOTOR VEHICLE REPLACEMENT PARTS SAID SALES EXCEEDED ONE BILLION DOLLARS FOR THE FISCAL YEAR
F01_22GC010X_BUS,9.4398125,/dt05_bus_real/F01_22GC010X_BUS.wav,SINCE THE U. S. CURRENCY HAS STRENGTHENED SHARPLY IN RECENT WEEKS HE SEES NO NEED FOR THE FEDERAL RESERVE TO RAISE INTEREST RATES TO PROTECT THE DOLLAR
M04_052C010H_BUS,8.08775,/dt05_bus_real/M04_052C010H_BUS.wav,THE TOKYO STOCK EXCHANGE'S FIRST SECTION INDEX FELL ONE POINT SEVEN EIGHT POINTS TO CLOSE AT TWO THOUSAND ONE HUNDRED TWO POINT FIVE FIVE
M04_053C0110_BUS,2.4880625,/dt05_bus_real/M04_053C0110_BUS.wav,BUT THEY CAN LOOK MORE GENEROUS THAN THEY ARE
F01_051C010T_BUS,5.072,/dt05_bus_real/F01_051C010T_BUS.wav,IN THE PREVIOUS FOUR YEARS ANNUAL INCREASES WERE WELL BELOW THREE PERCENT
M04_422C020L_BUS,5.775875,/dt05_bus_real/M04_422C020L_BUS.wav,REGIONAL BANKS APPEAR WILLING TO ACCEPT BIG LOSSES UNDER THE MEXICAN DEBT PLAN PUTTING PRESSURE ON BIG BANKS
F01_422C0204_BUS,8.270875,/dt05_bus_real/F01_422C0204_BUS.wav,THE INVESTORS EXPECT TO PROFIT ON THE DIFFERENCE BETWEEN THE PRICE REALIZED IN THE SALE AND THE COST OF REPLACING THE BORROWED SHARES
F01_22HC010Q_BUS,9.6875,/dt05_bus_real/F01_22HC010Q_BUS.wav,IT HAS SINCE REBOUNDED TO SEVEN HUNDRED FORTY FIVE POINT FIVE SEVEN WHERE IT CLOSED FRIDAY LOSING FOUR POINT FIVE SEVEN POINTS IN THE SESSION
M03_421C020N_BUS,8.035375,/dt05_bus_real/M03_421C020N_BUS.wav,VOLUME WAS A VERY MODEST THREE HUNDRED FIFTY TWO POINT TWO MILLION SHARES DOWN FROM THREE HUNDRED SIXTY SIX POINT FOUR MILLION SHARES A DAY EARLIER
M03_422C0210_BUS,3.467625,/dt05_bus_real/M03_422C0210_BUS.wav,THE OFFERS FOR BOTH CLASSES OF STOCK EXPIRED FRIDAY
M03_423C0206_BUS,9.83575,/dt05_bus_real/M03_423C0206_BUS.wav,BOTH COMPANIES OFFERED DEALERS CASH INCENTIVES DURING THE MONTH NISSAN ON THREE OF ITS BEST SELLING CARS AND MITSUBISHI ON ALL BUT ONE OF ITS PASSENGER CARS
M04_22GC010R_BUS,3.6159375,/dt05_bus_real/M04_22GC010R_BUS.wav,CERTAIN PRICES HAVE RISEN AT A BRISK PACE THROUGHOUT THIS DECADE
F04_421C020Q_BUS,7.8595,/dt05_bus_real/F04_421C020Q_BUS.wav,EXXON CORPORATION SAID EARLIER THIS WEEK THAT IT REPLACED ONE HUNDRED FOURTEEN PERCENT OF ITS OIL AND GAS PRODUCTION IN NINETEEN EIGHTY SEVEN
M04_052C0104_BUS,6.25575,/dt05_bus_real/M04_052C0104_BUS.wav,STERLING DRUG INCORPORATED INCREASED THE QUARTERLY DIVIDEND FIFTEEN PERCENT TO THIRTY EIGHT CENTS A SHARE FROM THIRTY THREE CENTS
F04_422C020F_BUS,2.603875,/dt05_bus_real/F04_422C020F_BUS.wav,EVERYTHING IS DONE MR. LEVY SAID YESTERDAY
M03_053C010H_BUS,9.027125,/dt05_bus_real/M03_053C010H_BUS.wav,PER SHARE EARNINGS FOR THE FISCAL YEAR FELL ABOUT TWENTY ONE PERCENT THE COMPANY ESTIMATED REFLECTING AN EIGHTEEN PERCENT INCREASE IN AVERAGE SHARES OUTSTANDING
F04_420C0206_BUS,4.643875,/dt05_bus_real/F04_420C0206_BUS.wav,THE FOUR OTHER UTILITY COMPANY OWNERS WILL ALSO HAVE TO TAKE WRITE OFFS
M03_052C010D_BUS,7.6756875,/dt05_bus_real/M03_052C010D_BUS.wav,OF THE TOTAL FACE AMOUNT OUTSTANDING OF TWELVE WESTERN UNION DEBT SERIES EIGHTEEN POINT SIX PERCENT HAD BEEN TENDERED AS OF THURSDAY
F04_422C0216_BUS,4.9878125,/dt05_bus_real/F04_422C0216_BUS.wav,SOMETIME NEXT YEAR HE SAID LAST WEEK WE'LL KNOW WHETHER THE FED'S PLAN HAS BEEN SUCCESSFUL
F01_050C0103_BUS,6.6316875,/dt05_bus_real/F01_050C0103_BUS.wav,CONSTRUCTION EMPLOYMENT FELL FORTY SEVEN THOUSAND AFTER A FIFTEEN THOUSAND JOB DECLINE THE MONTH BEFORE
M04_423C020Q_BUS,4.4798125,/dt05_bus_real/M04_423C020Q_BUS.wav,SOURCES SAY AT LEAST TWO BIDDERS HAD SOME DOUBTS ABOUT CITICORP'S PERFORMANCE NUMBERS
M03_053C010G_BUS,2.6916875,/dt05_bus_real/M03_053C010G_BUS.wav,SINCE THEN HOWEVER RESULTS HAVE BEEN POOR
F04_22HC0108_BUS,6.2193125,/dt05_bus_real/F04_22HC0108_BUS.wav,COMPANIES ARE LISTED WHERE TRANSACTIONS GENERALLY AGGREGATE TEN THOUSAND SHARES OR ONE HUNDRED THOUSAND DOLLARS
M04_421C0203_BUS,8.1115625,/dt05_bus_real/M04_421C0203_BUS.wav,YIELDS RANGE FROM FOUR POINT EIGHT PERCENT IN NINETEEN NINETY TO SEVEN POINT TWO PERCENT ON ZERO COUPON BONDS DUE IN TWO THOUSAND TWO
F04_22HC0110_BUS,3.8585625,/dt05_bus_real/F04_22HC0110_BUS.wav,THE QUESTION IS WHETHER U. S. BANKS WILL BE ALLOWED TO COMPETE
M03_420C0211_BUS,5.0360625,/dt05_bus_real/M03_420C0211_BUS.wav,PROCEEDS ALSO MAY BE USED EVENTUALLY TO BUY BACK COMMON SHARES THE COMPANY SAID
M04_423C020K_BUS,4.9276875,/dt05_bus_real/M04_423C020K_BUS.wav,L. T. V. WILL PRESENT THE PLAN TO ALL THE MEMBERS OF ITS BANK AND CREDITOR COMMITTEES NEXT WEEK
F01_050C0105_BUS,6.0878125,/dt05_bus_real/F01_050C0105_BUS.wav,IN A STATEMENT R. L. R. SAID THE BROKERAGE UNIT GENERATED SUBSTANTIALLY ALL OF ITS REVENUE
M04_050C010V_BUS,5.3996875,/dt05_bus_real/M04_050C010V_BUS.wav,BUT THE DISCUSSIONS SUBSEQUENTLY ENDED BECAUSE THE TWO SIDES COULDN'T AGREE ON FINANCIAL AND OTHER TERMS
F01_22GC0111_BUS,8.9351875,/dt05_bus_real/F01_22GC0111_BUS.wav,YIELDS ON LONG TERM BONDS AFTER DROPPING AS LOW AS SEVEN POINT EIGHT THREE PERCENT EARLY LAST WEEK ARE BACK UP ABOVE EIGHT PERCENT
