ID,duration,wav,wrd
M06_440C0205_BUS,2.848,/et05_bus_simu/M06_440C0205_BUS.wav,THE COMPANY PREVIOUSLY TRADED OVER THE COUNTER
M05_443C0214_BUS,9.659625,/et05_bus_simu/M05_443C0214_BUS.wav,NISSAN LOST THIRTY TO ONE THOUSAND FIVE HUNDRED TWENTY AND TOYOTA WAS DOWN THIRTY TO END THE DAY AT TWO THOUSAND SIX HUNDRED TWENTY
M05_441C020Q_BUS,5.803625,/et05_bus_simu/M05_441C020Q_BUS.wav,IF THE FED PUSHES THE DOLLAR HIGHER IT MAY CURB THE DEMAND FOR U. S. EXPORTS
M06_443C020M_BUS,4.8721875,/et05_bus_simu/M06_443C020M_BUS.wav,THE NEW COMPANY ASHLAND COAL INCORPORATED IS LISTED ON THE NEW YORK STOCK EXCHANGE
F06_446C020D_BUS,6.472,/et05_bus_simu/F06_446C020D_BUS.wav,THE ISSUE IS RATED SINGLE A BY MOODY'S AND SINGLE A MINUS BY S. AND P.
M05_444C0212_BUS,10.955625,/et05_bus_simu/M05_444C0212_BUS.wav,REALIZED CAPITAL GAINS INCREASED FORTY TWO PERCENT TO NINE HUNDRED NINE MILLION DOLLARS FROM SIX HUNDRED FORTY POINT NINE MILLION DOLLARS
M05_443C020O_BUS,8.9719375,/et05_bus_simu/M05_443C020O_BUS.wav,HE SAID THE COMPANY HAS ENTERED SIXTEEN SMALLER CELLULAR MARKETS THIS YEAR AND HAS EXPANDED ITS FINANCIAL SERVICES WORK FORCE
