ID,duration,wav,wrd
F06_443C020J_CAF,6.3965,/et05_caf_real/F06_443C020J_CAF.wav,COMPANIES ARE LISTED WHERE TRANSACTIONS GENERALLY AGGREGATE TEN THOUSAND SHARES OR ONE HUNDRED THOUSAND DOLLARS
F06_441C020S_CAF,2.94025,/et05_caf_real/F06_441C020S_CAF.wav,ANALYSTS HAVEN'T FOCUSED ON WHAT HAPPENED TO THEM
M05_440C020B_CAF,11.979625,/et05_caf_real/M05_440C020B_CAF.wav,ECONOMISTS WERE ENCOURAGED BY A ONE POINT SIX PERCENT INCREASE IN NEW ORDERS FOR NON DEFENSE CAPITAL GOODS AN IMPORTANT INDICATOR OF FUTURE BUSINESS INVESTMENT
F06_441C0213_CAF,7.6361875,/et05_caf_real/F06_441C0213_CAF.wav,THE ONE HUNDRED SHARE INDEX CLOSED SIX POINT EIGHT POINTS LOWER AT ONE THOUSAND SEVEN HUNDRED FIFTY NINE POINT NINE
F05_441C0208_CAF,5.888,/et05_caf_real/F05_441C0208_CAF.wav,THE OVERALL GAIN THE FIFTH IN THE PAST SEVEN MONTHS FOLLOWED A REVISED FOUR POINT ONE PERCENT INCREASE IN FEBRUARY
M06_447C0206_CAF,5.383875,/et05_caf_real/M06_447C0206_CAF.wav,HE CITES THE LAW OF LARGE NUMBERS CAN YOU REALLY EXPECT IT TO GROW AT LARGE NUMBERS VERY LONG
M05_446C020O_CAF,4.5878125,/et05_caf_real/M05_446C020O_CAF.wav,WE'RE NOT READY TO SAY WE'RE IN TECHNICAL DEFAULT A SPOKESMAN SAID
F06_440C0205_CAF,3.1478125,/et05_caf_real/F06_440C0205_CAF.wav,THE COMPANY PREVIOUSLY TRADED OVER THE COUNTER
F05_441C020P_CAF,4.1519375,/et05_caf_real/F05_441C020P_CAF.wav,IF THE DOLLAR STARTS TO PLUNGE THE FED MAY STEP UP ITS DEFENSE OF THE CURRENCY
F06_444C020W_CAF,3.2519375,/et05_caf_real/F06_444C020W_CAF.wav,A PRINT MEDIA CAMPAIGN WILL BEGIN THE FOLLOWING DAY
M05_441C020Z_CAF,10.843625,/et05_caf_real/M05_441C020Z_CAF.wav,THE COMPANY SAID ITS EUROPEAN BANKING AFFILIATE SAFRA REPUBLIC PLANS TO RAISE MORE THAN FOUR HUNDRED FIFTY MILLION DOLLARS THROUGH AN INTERNATIONAL OFFERING
F06_445C020K_CAF,6.763875,/et05_caf_real/F06_445C020K_CAF.wav,BUT TO THE SURPRISE OF ALMOST EVERYONE STOCK PRICES BEGAN A STEADY CLIMB THAT PUSHED THE AVERAGE ABOVE WEDNESDAY'S CLOSE
M06_440C020E_CAF,8.792125,/et05_caf_real/M06_440C020E_CAF.wav,THE AVERAGE RATE ON NEW THIRTEEN WEEK TREASURY BILLS INCREASED TO SIX POINT ONE TWO PERCENT FROM FIVE POINT NINE SEVEN PERCENT AT THE PREVIOUS AUCTION LAST WEEK
F06_443C020P_CAF,10.732125,/et05_caf_real/F06_443C020P_CAF.wav,IN ADDITION U. S. WEST'S DATA SOLUTIONS BUSINESS APPLIED COMMUNICATIONS INCORPORATED IS WORKING OUT WELL AND PERFORMED AHEAD OF ALL OUR SCHEDULES
F06_443C0201_CAF,11.1201875,/et05_caf_real/F06_443C0201_CAF.wav,THE LABOR DEPARTMENT SAID NON FARM PAYROLL EMPLOYMENT INCREASED A ROBUST THREE HUNDRED THIRTY SEVEN THOUSAND LAST MONTH AFTER A REVISED THREE HUNDRED NINETEEN THOUSAND GAIN THE MONTH BEFORE
F06_445C020S_CAF,3.5960625,/et05_caf_real/F06_445C020S_CAF.wav,LATELY COMPUTER RETAILING HAS BEEN TOUGH ON EVERYBODY
F05_444C020X_CAF,5.6160625,/et05_caf_real/F05_444C020X_CAF.wav,THE AMERICAN STOCK EXCHANGE INDEX LOST ZERO POINT SEVEN THREE TO THREE HUNDRED EIGHTY POINT NINE FOUR
F05_442C020O_CAF,5.383625,/et05_caf_real/F05_442C020O_CAF.wav,BUT IF THE WINNING BIDS ARE AS HIGH AS THEY WERE IN SOME DEALS EARLIER THIS YEAR THEN WE'RE NOT GOING TO BE WINNING BIDDERS
F06_441C020A_CAF,6.123875,/et05_caf_real/F06_441C020A_CAF.wav,IF DEFENSE IS EXCLUDED MARCH ORDERS ROSE ONE PERCENT AFTER A THREE PERCENT INCREASE IN FEBRUARY
M05_445C0215_CAF,6.6678125,/et05_caf_real/M05_445C0215_CAF.wav,AND AFTER A TEMPORARY DOWNTURN IN THE NEXT COUPLE OF YEARS THE NUMBERS PROBABLY WILL GO BACK UP
M05_443C020F_CAF,8.1398125,/et05_caf_real/M05_443C020F_CAF.wav,SONY WHICH LOST POINTS IN PREVIOUS SESSIONS THIS WEEK REBOUNDED EIGHTY TO FIVE THOUSAND ONE HUNDRED THIRTY
F06_442C0210_CAF,3.3480625,/et05_caf_real/F06_442C0210_CAF.wav,HE DECLINED TO NAME SPECIFIC PRODUCTS
F05_441C020H_CAF,4.1759375,/et05_caf_real/F05_441C020H_CAF.wav,TWO YEARS AGO B. A. S. F. MADE THREE SEPARATE ACQUISITIONS IN THE U. S.
M06_444C020H_CAF,6.0876875,/et05_caf_real/M06_444C020H_CAF.wav,AMONG EXPORT LED ELECTRICAL AND COMPUTER MAKERS JAPAN VICTOR COMPANY FELL FIFTY TO TWO THOUSAND THREE HUNDRED TWENTY
M06_446C020E_CAF,9.1759375,/et05_caf_real/M06_446C020E_CAF.wav,FIDELITY HAD CONTENDED THAT GENCORP ISN'T A QUALIFIED BROADCASTER BECAUSE IT FAILED TO DISCLOSE ALLEGEDLY IMPROPER POLITICAL CAMPAIGN CONTRIBUTIONS AND FOREIGN PAYMENTS
F06_446C020P_CAF,1.900125,/et05_caf_real/F06_446C020P_CAF.wav,IT'S STILL UNCLEAR
M06_440C0202_CAF,7.64325,/et05_caf_real/M06_440C0202_CAF.wav,THE COMPANY HAS FIVE HUNDRED JAPANESE MANAGERS OVERSEAS MOST OF THEM IN KEY POSITIONS AND EXPECTS THE NUMBER TO RISE SIXTY PERCENT IN THE NEXT FIVE YEARS
F05_447C0212_CAF,5.8325625,/et05_caf_real/F05_447C0212_CAF.wav,NO ONE IS MAKING VERY MUCH MONEY ON IT ACKNOWLEDGES BRIAN J. KELLY CHAIRMAN OF BELL ATLANTIC'S INVESTMENT DEVELOPMENT UNIT
M06_447C020Y_CAF,5.44,/et05_caf_real/M06_447C020Y_CAF.wav,INCREASINGLY PEOPLE WHO TEST POSITIVE JOIN THE SUPPORT GROUPS THAT HAVE SPRUNG ACROSS THE COUNTRY IN THE PAST YEAR
F05_444C020P_CAF,7.775875,/et05_caf_real/F05_444C020P_CAF.wav,IN RESPONSE AMFAC SHARES ROSE ONE DOLLAR TO FORTY SEVEN DOLLARS AND SEVENTY FIVE CENTS IN NEW YORK STOCK EXCHANGE COMPOSITE TRADING YESTERDAY
M05_444C020E_CAF,6.291875,/et05_caf_real/M05_444C020E_CAF.wav,SEVERAL AIRLINES HAVE ALSO OPPOSED THE STANDARDS AND MAY FIGHT SOME ASPECTS IN COURT
M06_445C020I_CAF,3.03975,/et05_caf_real/M06_445C020I_CAF.wav,THE AIRLINE IMPOSED THE CONTRACT WITHOUT UNION BARGAINING
F05_443C020O_CAF,6.031875,/et05_caf_real/F05_443C020O_CAF.wav,HE SAID THE COMPANY HAS ENTERED SIXTEEN SMALLER CELLULAR MARKETS THIS YEAR AND HAS EXPANDED ITS FINANCIAL SERVICES WORK FORCE
F05_447C0203_CAF,2.1040625,/et05_caf_real/F05_447C0203_CAF.wav,AND I'M SURE YOU HAVE YOUR OWN LIST
M05_443C020W_CAF,8.32775,/et05_caf_real/M05_443C020W_CAF.wav,THE AMERICAN STOCK EXCHANGE INDEX LOST ZERO POINT SEVEN THREE TO THREE HUNDRED EIGHTY POINT NINE FOUR
M06_444C020F_CAF,3.159875,/et05_caf_real/M06_444C020F_CAF.wav,SO FAR THEY HAVE DECLINED TO COMMENT PUBLICLY ON THEIR PLANS
M06_441C0216_CAF,2.491625,/et05_caf_real/M06_441C0216_CAF.wav,HE DECLINED TO NAME SPECIFIC PRODUCTS
M05_446C0201_CAF,9.1956875,/et05_caf_real/M05_446C0201_CAF.wav,HERE ARE PRICE TRENDS ON THE WORLD'S MAJOR STOCK MARKETS AS CALCULATED BY MORGAN STANLEY CAPITAL INTERNATIONAL PERSPECTIVE GENEVA
F06_444C0213_CAF,4.563875,/et05_caf_real/F06_444C0213_CAF.wav,A CHANGE IN THE FIRM'S OWNERSHIP ALSO SHOULD TURN ON A BRIGHT WARNING LIGHT
F06_442C020T_CAF,9.788125,/et05_caf_real/F06_442C020T_CAF.wav,VOLUME WAS MODEST AS THREE HUNDRED TWENTY SIX POINT SEVEN MILLION SHARES CHANGED HANDS COMPARED WITH THREE HUNDRED NINETY SIX POINT FIVE MILLION FRIDAY
F06_442C020Z_CAF,5.356,/et05_caf_real/F06_442C020Z_CAF.wav,HE SAID SUCH PRODUCTS WOULD BE MARKETED BY OTHER COMPANIES WITH EXPERIENCE IN THAT BUSINESS
M05_441C0204_CAF,8.4438125,/et05_caf_real/M05_441C0204_CAF.wav,AND THEN THERE'S THE EXPLANATION OF WHY TERADYNE'S GROWTH IN JAPAN IS SLOW DESPITE FIFTEEN YEARS OF EFFORT
M05_444C0207_CAF,5.275875,/et05_caf_real/M05_444C0207_CAF.wav,THE ISSUE IS RATED SINGLE A BY MOODY'S AND SINGLE A MINUS BY S. AND P.
F05_442C0211_CAF,1.8959375,/et05_caf_real/F05_442C0211_CAF.wav,SO NORMALCY HAS RETURNED
F06_447C0216_CAF,7.996125,/et05_caf_real/F06_447C0216_CAF.wav,THE INDEX ENDED WITH A DECLINE OF ZERO POINT THREE FIVE POINT TO ONE THOUSAND TWO HUNDRED SEVENTY TWO POINT ONE EIGHT
F05_446C0211_CAF,4.0479375,/et05_caf_real/F05_446C0211_CAF.wav,AFTER THE OFFERING REPUBLIC NEW YORK WILL HOLD ABOUT FORTY NINE PERCENT OF THE AFFILIATE
M06_442C0205_CAF,7.80775,/et05_caf_real/M06_442C0205_CAF.wav,M. I. C. C. SAID IT INTENDS TO PAY THE DIVIDEND ARREARS ON JULY THIRTY FIRST TO STOCK OF RECORD JULY SECOND
M06_442C020W_CAF,6.0718125,/et05_caf_real/M06_442C020W_CAF.wav,YESTERDAY MOODY'S INVESTORS SERVICE RAISED LILCO'S CREDIT RATINGS IN RECOGNITION OF THE IMPROVED OUTLOOK FOR STEADY FINANCIAL RECOVERY
F06_447C020X_CAF,6.1001875,/et05_caf_real/F06_447C020X_CAF.wav,SALANT SHARES CLOSED UNCHANGED ON THE BIG BOARD AT NINE DOLLARS AND SEVENTY FIVE CENTS
F05_447C020K_CAF,1.74375,/et05_caf_real/F05_447C020K_CAF.wav,THAT WAS CERTAINLY TRUE LAST WEEK
F06_445C020T_CAF,7.6839375,/et05_caf_real/F06_445C020T_CAF.wav,NO ONE IS MAKING VERY MUCH MONEY ON IT ACKNOWLEDGES BRIAN J. KELLY CHAIRMAN OF BELL ATLANTIC'S INVESTMENT DEVELOPMENT UNIT
F05_445C020E_CAF,7.384,/et05_caf_real/F05_445C020E_CAF.wav,THE COMPANY WHICH RUNS RETAIL AUTOMOTIVE STORES TOLD SHEARSON LEHMAN BROTHERS ITS FINANCIAL ADVISER TO TERMINATE DISCUSSIONS TO SELL THE FIRM
F06_445C0207_CAF,2.7558125,/et05_caf_real/F06_445C0207_CAF.wav,BUT THE PENALTIES FOR FAILURE ARE REAL
F06_440C020Y_CAF,3.668,/et05_caf_real/F06_440C020Y_CAF.wav,ESTIMATES FOR THE GAIN RANGED FROM TWO PERCENT TO THREE PERCENT
F05_446C020D_CAF,4.07175,/et05_caf_real/F05_446C020D_CAF.wav,THE ISSUE IS RATED SINGLE A BY MOODY'S AND SINGLE A MINUS BY S. AND P.
M05_443C020S_CAF,3.5,/et05_caf_real/M05_443C020S_CAF.wav,A PRINT MEDIA CAMPAIGN WILL BEGIN THE FOLLOWING DAY
M06_443C0202_CAF,4.6956875,/et05_caf_real/M06_443C0202_CAF.wav,THE DEPARTMENT PREVIOUSLY SAID JOBS ROSE BY FOUR HUNDRED FORTY EIGHT THOUSAND IN JANUARY
F06_446C020W_CAF,4.596,/et05_caf_real/F06_446C020W_CAF.wav,DURABLE GOODS REPORTS FREQUENTLY ARE HIGHLY VOLATILE FROM MONTH TO MONTH
F06_446C0202_CAF,7.164125,/et05_caf_real/F06_446C0202_CAF.wav,TO MAKE THEM DIRECTLY COMPARABLE EACH INDEX IS BASED ON THE CLOSE OF NINETEEN SIXTY NINE EQUALING ONE HUNDRED
M05_445C0203_CAF,4.4838125,/et05_caf_real/M05_445C0203_CAF.wav,A SPOKESMAN SAID THE COMPANY HAS ABOUT SIXTY MILLION SHARES OUTSTANDING
F06_441C0210_CAF,5.564,/et05_caf_real/F06_441C0210_CAF.wav,AFTER THE OFFERING REPUBLIC NEW YORK WILL HOLD ABOUT FORTY NINE PERCENT OF THE AFFILIATE
M05_440C020A_CAF,8.3643125,/et05_caf_real/M05_440C020A_CAF.wav,DESPITE THE JULY DECLINE DURABLE GOODS ORDERS REMAINED SEVEN POINT SEVEN PERCENT ABOVE THE YEAR EARLIER LEVEL
F05_441C0202_CAF,3.5439375,/et05_caf_real/F05_441C0202_CAF.wav,A COMMISSION SPOKESMAN SAID A DECISION ON THE APPEAL IS EXPECTED SOON
F06_446C020C_CAF,8.732,/et05_caf_real/F06_446C020C_CAF.wav,THE UNSOLD BALANCE LATE YESTERDAY WAS ABOUT THIRTY SIX POINT THREE MILLION DOLLARS ACCORDING TO SHEARSON LEHMAN BROTHERS THE LEAD UNDERWRITER
F06_442C0207_CAF,5.0119375,/et05_caf_real/F06_442C0207_CAF.wav,GRAND AUTO SLID THREE TO FIFTEEN AND ONE EIGHTH ON THE AMERICAN STOCK EXCHANGE
F06_443C020M_CAF,5.5641875,/et05_caf_real/F06_443C020M_CAF.wav,THE NEW COMPANY ASHLAND COAL INCORPORATED IS LISTED ON THE NEW YORK STOCK EXCHANGE
M06_441C020O_CAF,3.9841875,/et05_caf_real/M06_441C020O_CAF.wav,ABOUT ALL BUSINESSMEN CAN COUNT ON IS THAT POLICY WILL BE PRETTY VOLATILE
M06_443C0203_CAF,6.76375,/et05_caf_real/M06_443C0203_CAF.wav,USING A MEASURE THAT COUNTS THE MILITARY AMONG THE EMPLOYED THE RATE WAS UNCHANGED AT SIX POINT SIX PERCENT LAST MONTH
F05_445C0216_CAF,3.983875,/et05_caf_real/F05_445C0216_CAF.wav,WHERE ELSE IN THE THIRD WORLD IS THERE SO MUCH ENERGY AND PROGRESS AS IN CHINA
F06_441C020C_CAF,9.3800625,/et05_caf_real/F06_441C020C_CAF.wav,THE COMPANY WHICH RUNS RETAIL AUTOMOTIVE STORES TOLD SHEARSON LEHMAN BROTHERS ITS FINANCIAL ADVISER TO TERMINATE DISCUSSIONS TO SELL THE FIRM
M06_442C020H_CAF,3.9439375,/et05_caf_real/M06_442C020H_CAF.wav,WE JUST RECEIVED THE SUIT AND THE DOCUMENT IS IS MASSIVE IT'S TWO HUNDRED PAGES
F06_440C020V_CAF,6.4441875,/et05_caf_real/F06_440C020V_CAF.wav,THE RATE ON SIX MONTH BILLS FELL TO SIX POINT SEVEN THREE PERCENT FROM SIX POINT EIGHT THREE PERCENT
M05_441C020R_CAF,6.579875,/et05_caf_real/M05_441C020R_CAF.wav,TOO MUCH FOCUS IS PLACED ON REDUCTION OF CROSS COUNTRY LOANS MR. MEYERMAN SAID
M05_447C020Z_CAF,5.443875,/et05_caf_real/M05_447C020Z_CAF.wav,SEVERAL CITIES HAVE VERSIONS OF THE BRITISH ORGANIZATION BODY POSITIVE
M05_440C0213_CAF,6.0836875,/et05_caf_real/M05_440C0213_CAF.wav,HE SAID SUCH PRODUCTS WOULD BE MARKETED BY OTHER COMPANIES WITH EXPERIENCE IN THAT BUSINESS
M06_442C020L_CAF,6.6438125,/et05_caf_real/M06_442C020L_CAF.wav,THE MAY SLUMP REPORTED JUNE TWENTY SECOND CAME AS A BIG SURPRISE TO MOST ANALYSTS AND HELPED TRIGGER A POWERFUL BOND RALLY THAT DAY
F05_447C0211_CAF,3.1119375,/et05_caf_real/F05_447C0211_CAF.wav,LATELY COMPUTER RETAILING HAS BEEN TOUGH ON EVERYBODY
F05_445C020A_CAF,4.51975,/et05_caf_real/F05_445C020A_CAF.wav,A LONG LIST OF OTHER WITNESSES HAVE ALSO TESTIFIED IN THE TRIAL NOW IN ITS FOURTH MONTH
F06_443C020L_CAF,6.948375,/et05_caf_real/F06_443C020L_CAF.wav,WHEN ITS INITIAL PUBLIC OFFERING IS COMPLETED ASHLAND IS EXPECTED TO RETAIN A FORTY SIX PERCENT STAKE
M06_440C020H_CAF,5.2639375,/et05_caf_real/M06_440C020H_CAF.wav,IN A FUNDAMENTAL SENSE THE EQUITY MARKETS HAVE VERY LITTLE TO DO WITH WHAT GOES ON IN THE COMMERCIAL BANKS
M05_445C020V_CAF,1.6604375,/et05_caf_real/M05_445C020V_CAF.wav,WE DIDN'T LIKE THAT
F05_441C0205_CAF,1.9758125,/et05_caf_real/F05_441C0205_CAF.wav,THE LANGUAGE IS A BIG PROBLEM
F05_441C0206_CAF,3.1118125,/et05_caf_real/F05_441C0206_CAF.wav,IN EUROPE AN AMERICAN CAN AT LEAST READ STREET SIGNS
M06_440C020P_CAF,6.831625,/et05_caf_real/M06_440C020P_CAF.wav,COMMERCE DEPARTMENT OFFICIALS NOTED HOWEVER THAT AUTO IMPORTS USUALLY RISE IN OCTOBER AS DEALERS FILL THEIR INVENTORIES WITH NEW MODELS
F05_445C0209_CAF,4.2559375,/et05_caf_real/F05_445C0209_CAF.wav,AND BOTH MORTGAGED THEIR HOMES TO SECURE THE LOANS THEY NEEDED TO START THE BUSINESS
M06_441C020M_CAF,6.73975,/et05_caf_real/M06_441C020M_CAF.wav,UNLESS OTHERWISE NOTED CHANGES INVOLVED DIRECT HOLDINGS OF COMMON STOCK AND TOOK PLACE IN SEPTEMBER AND OCTOBER OF NINETEEN EIGHTY SEVEN
F05_446C0212_CAF,9.5035,/et05_caf_real/F05_446C0212_CAF.wav,CLOSELY HELD TIMES PUBLISHING ALSO OWNS TWO WASHINGTON BASED PUBLICATIONS CONGRESSIONAL QUARTERLY WHICH COVERS CAPITOL HILL AND GOVERNING WHICH COVERS STATE AND LOCAL GOVERNMENTS
F06_445C020P_CAF,4.4996875,/et05_caf_real/F06_445C020P_CAF.wav,ABOUT ALL THE BUSINESSMAN CAN COUNT ON IS THAT POLICY WILL BE PRETTY VOLATILE
M06_443C0210_CAF,6.935625,/et05_caf_real/M06_443C0210_CAF.wav,THE COMPANIES ARE FOLLOWED BY AT LEAST THREE ANALYSTS AND HAD A MINIMUM FIVE CENT CHANGE IN ACTUAL EARNINGS PER SHARE
M06_440C0210_CAF,8.151625,/et05_caf_real/M06_440C0210_CAF.wav,YESTERDAY MOODY'S INVESTORS SERVICE RAISED LILCO'S CREDIT RATINGS IN RECOGNITION OF THE IMPROVED OUTLOOK FOR STEADY FINANCIAL RECOVERY
F05_443C020N_CAF,6.279875,/et05_caf_real/F05_443C020N_CAF.wav,THE OFFICIAL DECLINED TO ELABORATE ON PROJECTIONS FOR NON TELEPHONE OPERATIONS BUT CITED SEVERAL INDICATORS OF RECENT GAINS
M05_447C020G_CAF,8.1236875,/et05_caf_real/M05_447C020G_CAF.wav,THE UNDERWRITING GROUP HAS A THIRTY DAY OPTION TO ACQUIRE AN ADDITIONAL SIX HUNDRED THOUSAND SHARES AT EIGHT DOLLARS EACH
F05_442C020B_CAF,4.9953125,/et05_caf_real/F05_442C020B_CAF.wav,SHAMROCK'S PRETAX PROFIT FROM THE SALE WAS ONE HUNDRED TWENTY FIVE MILLION DOLLARS A SPOKESWOMAN SAID
M06_447C0209_CAF,3.087875,/et05_caf_real/M06_447C0209_CAF.wav,WASHINGTON NATIONAL IS A FINANCIAL SERVICES CONCERN
M06_447C0201_CAF,5.183875,/et05_caf_real/M06_447C0201_CAF.wav,I DON'T MEAN THERE COULDN'T BE SOME IMPROVEMENTS IN THE REVENUE ACT OF NINETEEN EIGHTY SIX WHICH TOOK EFFECT THIS MONTH
F06_440C020N_CAF,8.71575,/et05_caf_real/F06_440C020N_CAF.wav,IT CAN SIGN ONTO THE PLAN FILE A COMPETING PLAN OR TAKE A COMPLETELY PASSIVE ROLE THAT NEITHER ENDORSES NOR OPPOSES A PLAN
F05_447C020R_CAF,2.968,/et05_caf_real/F05_447C020R_CAF.wav,THE INVESTOR NOW OWNS SEVENTY THREE PERCENT OF THE COMPANY
M06_442C0201_CAF,4.2,/et05_caf_real/M06_442C0201_CAF.wav,BIDS TOTALING FIVE HUNDRED TWENTY FIVE POINT FIVE MILLION DOLLARS WERE SUBMITTED
F05_445C020R_CAF,3.912,/et05_caf_real/F05_445C020R_CAF.wav,IF THE FED PUSHES THE DOLLAR HIGHER IT MAY CURB THE DEMAND FOR U. S. EXPORTS
M05_447C0205_CAF,1.348,/et05_caf_real/M05_447C0205_CAF.wav,HE DOESN'T
M06_444C0202_CAF,5.2954375,/et05_caf_real/M06_444C0202_CAF.wav,IT HAD FORECAST A NINETEEN EIGHTY SIX FOURTH QUARTER LOSS OF EIGHTEEN MILLION DOLLARS TO TWENTY TWO MILLION DOLLARS
M06_440C020F_CAF,8.8876875,/et05_caf_real/M06_440C020F_CAF.wav,THE AVERAGE RATE ON NEW TWENTY SIX WEEK BILLS ROSE TO SIX POINT ONE SIX PERCENT FROM SIX POINT ONE TWO PERCENT
F05_445C020F_CAF,4.216,/et05_caf_real/F05_445C020F_CAF.wav,IT RECEIVED NO PROPOSALS THAT WERE IN THE BEST INTEREST OF THE SHAREHOLDERS THE COMPANY SAID
M06_442C0206_CAF,4.6958125,/et05_caf_real/M06_442C0206_CAF.wav,THE TORONTO BASED COMPANY PROVIDES MORTGAGE GUARANTEES TO THE CANADIAN REAL ESTATE INDUSTRY
F06_443C0211_CAF,4.1559375,/et05_caf_real/F06_443C0211_CAF.wav,ESTIMATED AND ACTUAL RESULTS INVOLVING LOSSES ARE OMITTED
M05_442C020M_CAF,5.6278125,/et05_caf_real/M05_442C020M_CAF.wav,EVEN SOME BIGGER COMPANIES CAUTION THAT THEY ARE LEERY OF PAYING TOO BIG A PREMIUM
F06_446C020B_CAF,9.1400625,/et05_caf_real/F06_446C020B_CAF.wav,THE ISSUE WAS PRICED AFTER AUCTION TO YIELD FROM THREE POINT FIVE PERCENT IN NINETEEN EIGHTY SEVEN TO FIVE POINT FIVE PERCENT IN NINETEEN NINETY SEVEN
M05_440C0214_CAF,3.2200625,/et05_caf_real/M05_440C0214_CAF.wav,HE DECLINED TO NAME SPECIFIC PRODUCTS
M06_440C0204_CAF,9.087875,/et05_caf_real/M06_440C0204_CAF.wav,R. L. I. CORPORATION A PEORIA ILLINOIS BASED INSURANCE HOLDING COMPANY WILL BEGIN TRADING FRIDAY ON THE BIG BOARD UNDER THE SYMBOL R. L. I.
F06_441C020F_CAF,3.94825,/et05_caf_real/F06_441C020F_CAF.wav,ALSO A MOVE TO BASE IT ABROAD WILL HAVE TAX ADVANTAGES
M05_446C0209_CAF,9.06775,/et05_caf_real/M05_446C0209_CAF.wav,MR. ICAHN AND AN INVESTOR GROUP HE HEADS HOLD SEVENTY TWO POINT SEVEN PERCENT OF T. W. A.'S SHARES
F05_447C020D_CAF,2.527375,/et05_caf_real/F05_447C020D_CAF.wav,I WILL TELL YOU WHAT I THINK IN MY OFFICE
F05_447C020P_CAF,5.7996875,/et05_caf_real/F05_447C020P_CAF.wav,THE INDEPENDENT COMMITTEE WILL RECOMMEND THAT HOLDERS ACCEPT THE OFFER AT A MEETING EXPECTED TO BE HELD IN DECEMBER T. W. A. SAID
M05_442C0213_CAF,1.6834375,/et05_caf_real/M05_442C0213_CAF.wav,THAT'S FINE
M06_445C020M_CAF,2.9915625,/et05_caf_real/M06_445C020M_CAF.wav,GILLETTE IS AGAIN A TARGET OF A MAJOR CORPORATE RAIDER
F06_446C020A_CAF,6.596125,/et05_caf_real/F06_446C020A_CAF.wav,SEPARATELY NEW YORK STATE SOLD ABOUT SEVENTY SEVEN POINT ONE MILLION DOLLARS OF CERTIFICATES OF PARTICIPATION
M06_440C020T_CAF,2.711875,/et05_caf_real/M06_440C020T_CAF.wav,RATES FELL ON SHORT TERM TREASURY BILLS
F05_444C020J_CAF,5.6723125,/et05_caf_real/F05_444C020J_CAF.wav,SONY WHICH LOST POINTS IN PREVIOUS SESSIONS THIS WEEK REBOUNDED EIGHTY TO FIVE THOUSAND ONE HUNDRED THIRTY
F05_442C020S_CAF,7.527875,/et05_caf_real/F05_442C020S_CAF.wav,AT THE CLOSE THE FINANCIAL TIMES THIRTY SHARE INDEX WAS THREE POINT NINE POINTS LOWER AT ONE THOUSAND FOUR HUNDRED EIGHTEEN POINT SIX
F05_440C0207_CAF,5.496,/et05_caf_real/F05_440C0207_CAF.wav,THE AGENCY ISN'T LIKELY TO TAKE ANY ACTION UNTIL THE UNION'S RANK AND FILE VOTES ON THE CONTRACT IN TWO TO THREE WEEKS
F06_442C020G_CAF,4.652125,/et05_caf_real/F06_442C020G_CAF.wav,A MONSANTO SPOKESMAN SAID THERE'S VERY LITTLE WE CAN SAY
F05_443C0206_CAF,4.615875,/et05_caf_real/F05_443C0206_CAF.wav,THE TORONTO BASED COMPANY PROVIDES MORTGAGE GUARANTEES TO THE CANADIAN REAL ESTATE INDUSTRY
M05_445C0202_CAF,6.05975,/et05_caf_real/M05_445C0202_CAF.wav,IF ALL TWENTY MILLION SHARES WERE PURCHASED THE COMPANY'S EQUITY WOULD BE REDUCED BY ABOUT ONE THIRD
F06_441C020D_CAF,5.2119375,/et05_caf_real/F06_441C020D_CAF.wav,IT RECEIVED NO PROPOSALS THAT WERE IN THE BEST INTEREST OF THE SHAREHOLDERS THE COMPANY SAID
M06_445C020J_CAF,8.47975,/et05_caf_real/M06_445C020J_CAF.wav,YESTERDAY'S SESSION BEGAN WITH A SHARP QUICK DECLINE IN THE INDUSTRIAL AVERAGE OF MORE THAN FORTY FIVE POINTS WHICH SOME MARKET ANALYSTS ATTRIBUTED TO FOREIGN SELLING
M05_442C020E_CAF,9.49175,/et05_caf_real/M05_442C020E_CAF.wav,UNDER TOKYO TRADING RULES THE MAXIMUM ONE DAY DROP FOR SONY IS FIVE HUNDRED YEN ABOUT THREE DOLLARS AND FIFTY CENTS
M05_447C0208_CAF,12.0198125,/et05_caf_real/M05_447C0208_CAF.wav,BEFORE THE TRANSACTION WASHINGTON NATIONAL CONTROLLED ONE POINT EIGHT MILLION UNITED PRESIDENTIAL SHARES OR FORTY ONE POINT FIVE PERCENT OF THE COMPANY
M05_446C020R_CAF,8.7556875,/et05_caf_real/M05_446C020R_CAF.wav,AMONG MEN FIFTY SIX PERCENT SAID THE U. S. WAS DOING TOO LITTLE IN SPACE EXPLORATION ONLY A QUARTER OF WOMEN AGREED
M05_445C0212_CAF,3.971875,/et05_caf_real/M05_445C0212_CAF.wav,THE REAL CHANGE THOUGH IS IN HOW CHINA LOOKS
M05_447C0217_CAF,9.6596875,/et05_caf_real/M05_447C0217_CAF.wav,THE LOW WAS ONE THOUSAND TWO HUNDRED SEVENTY POINT ONE NINE AND THE HIGH WAS ONE THOUSAND TWO HUNDRED SEVENTY THREE POINT EIGHT EIGHT
F05_443C0204_CAF,6.6958125,/et05_caf_real/F05_443C0204_CAF.wav,M. I. C. C. INVESTMENTS HAS THREE SERIES OF PUBLICLY TRADED PREFERRED SHARES AND TEN SERIES OF PRIVATELY HELD PREFERRED STOCK
M05_440C0208_CAF,3.0839375,/et05_caf_real/M05_440C0208_CAF.wav,UNION OFFICIALS EXPECT RATIFICATION
F05_444C0209_CAF,8.415875,/et05_caf_real/F05_444C0209_CAF.wav,AS ONE OF THE MOST ACQUISITION HUNGRY OF MAJOR BANKS CITICORP IS OFTEN REQUIRED BY REGULATORS TO RAISE ADDITIONAL CAPITAL AS A CONDITION OF MAKING ACQUISITIONS
M05_445C020B_CAF,5.0999375,/et05_caf_real/M05_445C020B_CAF.wav,BUT IT IS MR. WEST UPON WHOM THE OUTCOME PROBABLY DEPENDS THE MOST
M06_443C020D_CAF,6.711875,/et05_caf_real/M06_443C020D_CAF.wav,AMONG EXPORT LED ELECTRICAL AND COMPUTER MAKERS JAPAN VICTOR COMPANY FELL FIFTY TO TWO THOUSAND THREE HUNDRED TWENTY
M05_445C0201_CAF,8.1318125,/et05_caf_real/M05_445C0201_CAF.wav,OWENS ILLINOIS SAID ITS SHARE PURCHASES WOULD BE FINANCED BY EXISTING CREDIT LINES AND NEW ONES TO BE ARRANGED
F05_444C0214_CAF,5.7033125,/et05_caf_real/F05_444C0214_CAF.wav,MONEY MANAGERS WHO SELL THEIR FIRMS BUT THEN CONTINUE WORKING FOR THEM MAY BE LESS DEDICATED UNDER NEW OWNERSHIP THEY SAY
F05_446C020Y_CAF,3.047875,/et05_caf_real/F05_446C020Y_CAF.wav,ESTIMATES FOR THE GAIN RANGED FROM TWO PERCENT TO THREE PERCENT
M05_443C020B_CAF,2.795875,/et05_caf_real/M05_443C020B_CAF.wav,THAT WAS CERTAINLY TRUE LAST WEEK
M05_440C020Z_CAF,6.2278125,/et05_caf_real/M05_440C020Z_CAF.wav,UTILITY ANALYSTS HOWEVER EXPECT THE AGREEMENT TO BE COMPLETED WITHOUT MUCH DIFFICULTY
F05_440C020L_CAF,3.28,/et05_caf_real/F05_440C020L_CAF.wav,THE INVESTOR NOW OWNS SEVENTY THREE PERCENT OF THE COMPANY
M05_440C020R_CAF,7.755875,/et05_caf_real/M05_440C020R_CAF.wav,PRICES ARE GOING UP SAID GEORGE C. EADS VICE PRESIDENT AND CHIEF ECONOMIST AT GENERAL MOTORS CORPORATION
F05_440C020M_CAF,3.296,/et05_caf_real/F05_440C020M_CAF.wav,TEXACO HAS THREE CHOICES A COMPANY ADVISER SAYS
M05_443C020E_CAF,4.979875,/et05_caf_real/M05_443C020E_CAF.wav,KYOCERA WAS UP SIXTY AT FIVE THOUSAND TWO HUNDRED SIXTY
F06_440C0201_CAF,4.652,/et05_caf_real/F06_440C0201_CAF.wav,AT N. E. C. THE NEED FOR INTERNATIONAL MANAGERS WILL KEEP RISING
F05_446C020Z_CAF,4.0798125,/et05_caf_real/F05_446C020Z_CAF.wav,REPUBLIC NEW YORK ROSE ONE AND ONE QUARTER TO FORTY FIVE AND SEVEN EIGHTHS
M05_442C0202_CAF,6.4195625,/et05_caf_real/M05_442C0202_CAF.wav,ACCEPTED BIDS RANGED FROM SIX POINT TWO PERCENT TO SIX POINT TWO TWO FIVE PERCENT
F05_445C0211_CAF,2.6239375,/et05_caf_real/F05_445C0211_CAF.wav,A PRINT MEDIA CAMPAIGN WILL BEGIN THE FOLLOWING DAY
M06_444C0205_CAF,10.03975,/et05_caf_real/M06_444C0205_CAF.wav,THE ISSUE WAS PRICED AFTER AUCTION TO YIELD FROM THREE POINT FIVE PERCENT IN NINETEEN EIGHTY SEVEN TO FIVE POINT FIVE PERCENT IN NINETEEN NINETY SEVEN
F06_447C0204_CAF,9.06,/et05_caf_real/F06_447C0204_CAF.wav,MR. ROBERTSON SAYS HE WOULD ONLY BE ATTRACTED BY A NINETEEN MULTIPLE IF HE THOUGHT THE PROJECTED EARNINGS GROWTH RATE WAS EIGHTEEN PERCENT TO TWENTY PERCENT
F05_440C0203_CAF,2.608,/et05_caf_real/F05_440C0203_CAF.wav,ABOUT HALF THESE MANAGERS ARE IN THE U. S.
M06_446C020L_CAF,8.92775,/et05_caf_real/M06_446C020L_CAF.wav,ASSETS MORE THAN DOUBLED SINCE THEN TO ONE HUNDRED SIXTY POINT FOUR BILLION SWISS FRANCS ONE HUNDRED FIFTEEN POINT SIX BILLION DOLLARS IN NINETEEN EIGHTY SEVEN
F05_442C0208_CAF,7.6078125,/et05_caf_real/F05_442C0208_CAF.wav,THE COMPANY WHICH RUNS RETAIL AUTOMOTIVE STORES TOLD SHEARSON LEHMAN BROTHERS ITS FINANCIAL ADVISER TO TERMINATE DISCUSSIONS TO SELL THE FIRM
M06_441C0207_CAF,2.631875,/et05_caf_real/M06_441C0207_CAF.wav,IN JAPAN IT'S ALL GREEK SO TO SPEAK
F06_444C020O_CAF,6.5403125,/et05_caf_real/F06_444C020O_CAF.wav,THE COMPANY DECLINED TO IDENTIFY THE BIDDERS BUT SAID IT RECEIVED OFFERS IN THE HIGH FORTY DOLLARS PER SHARE
F06_447C020C_CAF,7.68425,/et05_caf_real/F06_447C020C_CAF.wav,SENDING THE REFUGEES BACK ISN'T THEIR IDEA IT'S JUST WHAT THE OPPOSITION POLITICIANS ARE SAYING IN OUR COUNTRY THESE DAYS
F05_445C020G_CAF,8.0398125,/et05_caf_real/F05_445C020G_CAF.wav,THE ORDER ISSUED LATE WEDNESDAY BY JUDGE DIANA MURPHY STEMS FROM A SUIT FILED IN FEDERAL COURT LAST MONTH BY THE UNION REPRESENTING THE MACHINISTS
F06_446C0207_CAF,3.6920625,/et05_caf_real/F06_446C0207_CAF.wav,THAT DOESN'T MEAN MR. ICAHN HAS COMMITTED ANY WRONGDOING
M05_441C0211_CAF,10.34,/et05_caf_real/M05_441C0211_CAF.wav,AT THE CLOSE THE FINANCIAL TIMES THIRTY SHARE INDEX WAS THREE POINT NINE POINTS LOWER AT ONE THOUSAND FOUR HUNDRED EIGHTEEN POINT SIX
M06_446C020S_CAF,6.44775,/et05_caf_real/M06_446C020S_CAF.wav,AMONG MEN FORTY ONE PERCENT SUPPORTED BOOSTING THE SPACE EXPLORATION BUDGET COMPARED WITH NINETEEN PERCENT OF WOMEN
F06_443C020R_CAF,8.18025,/et05_caf_real/F06_443C020R_CAF.wav,AS PART OF THE MARKETING PLAN THE COMPANY WILL BEGIN AIRING TELEVISION COMMERCIALS DURING PRIME TIME ON ELECTION NIGHT NEXT TUESDAY
M06_444C020K_CAF,2.9836875,/et05_caf_real/M06_444C020K_CAF.wav,LATELY COMPUTER RETAILING HAS BEEN TOUGH ON EVERYBODY
F05_445C020D_CAF,4.551875,/et05_caf_real/F05_445C020D_CAF.wav,GRAND AUTO SLID THREE TO FIFTEEN AND ONE EIGHTH ON THE AMERICAN STOCK EXCHANGE
F05_441C020J_CAF,5.6080625,/et05_caf_real/F05_441C020J_CAF.wav,TODAY NINETY PERCENT OF THE FOUR BILLION DOLLARS OF B. A. S. F. SALES IN THE U. S. IS PRODUCED THERE
