ID,duration,wav,wrd
F06_444C020V_CAF,7.300125,/et05_caf_real/F06_444C020V_CAF.wav,AS PART OF THE MARKETING PLAN THE COMPANY WILL BEGIN AIRING TELEVISION COMMERCIALS DURING PRIME TIME ON ELECTION NIGHT NEXT TUESDAY
F06_447C0207_CAF,7.988,/et05_caf_real/F06_447C0207_CAF.wav,WASHINGTON NATIONAL PAID NINETEEN DOLLARS A SHARE FOR THE TWO POINT SIX MILLION UNITED PRESIDENTIAL SHARES IT DIDN'T ALREADY OWN
M06_444C020B_CAF,9.73175,/et05_caf_real/M06_444C020B_CAF.wav,MONDAY'S CRASH IS LIKELY TO AFFECT AT LEAST ONE OTHER PIECE OF PENDING LEGISLATION THE SWEEPING TRADE BILL THAT IS NOW THE SUBJECT OF A HOUSE SENATE CONFERENCE
M05_441C020G_CAF,5.4918125,/et05_caf_real/M05_441C020G_CAF.wav,ELDERS FINANCE AND ELDERS AGRIBUSINESS WILL REMAIN BASED IN AUSTRALIA
M05_447C0214_CAF,1.616125,/et05_caf_real/M05_447C0214_CAF.wav,WE DIDN'T LIKE THAT
M05_442C020V_CAF,5.8438125,/et05_caf_real/M05_442C020V_CAF.wav,UTILITY ANALYSTS HOWEVER EXPECT THE AGREEMENT TO BE COMPLETED WITHOUT MUCH DIFFICULTY
