ID,duration,wav,wrd
M05_444C020L_BUS,7.6598125,/et05_bus_simu/M05_444C020L_BUS.wav,NO ONE IS MAKING VERY MUCH MONEY ON IT ACKNOWLEDGES BRIAN J. KELLY CHAIRMAN OF BELL ATLANTIC'S INVESTMENT DEVELOPMENT UNIT
F06_445C0214_BUS,7.096125,/et05_bus_simu/F06_445C0214_BUS.wav,THE NUMBERS LOOKED AMAZINGLY GOOD INDUSTRIAL GROWTH RATES ABOVE TEN PERCENT PER YEAR YEAR AFTER YEAR
M05_442C020D_BUS,9.371625,/et05_bus_simu/M05_442C020D_BUS.wav,SONY CORPORATION FOR EXAMPLE CLOSED AT FOUR THOUSAND NINE HUNDRED FIFTY YEN THIRTY FOUR DOLLARS AND FIFTY CENTS A SHARE YESTERDAY
M06_442C0214_BUS,4.416125,/et05_bus_simu/M06_442C0214_BUS.wav,A CHANGE IN THE FIRM'S OWNERSHIP ALSO SHOULD TURN ON A BRIGHT WARNING LIGHT
M06_441C020N_BUS,6.4925,/et05_bus_simu/M06_441C020N_BUS.wav,COMPANIES ARE LISTED WHERE TRANSACTIONS GENERALLY AGGREGATE TEN THOUSAND SHARES OR ONE HUNDRED THOUSAND DOLLARS
M06_440C0201_BUS,4.296125,/et05_bus_simu/M06_440C0201_BUS.wav,AT N. E. C. THE NEED FOR INTERNATIONAL MANAGERS WILL KEEP RISING
M05_447C020F_BUS,5.6598125,/et05_bus_simu/M05_447C020F_BUS.wav,THEY WERE SOLD TO UNDERWRITERS LED BY PRUDENTIAL BACHE SECURITIES INCORPORATED
F06_447C0208_BUS,11.2644375,/et05_bus_simu/F06_447C0208_BUS.wav,BEFORE THE TRANSACTION WASHINGTON NATIONAL CONTROLLED ONE POINT EIGHT MILLION UNITED PRESIDENTIAL SHARES OR FORTY ONE POINT FIVE PERCENT OF THE COMPANY
F05_447C0206_BUS,5.116,/et05_bus_simu/F05_447C0206_BUS.wav,HE CITES THE LAW OF LARGE NUMBERS CAN YOU REALLY EXPECT IT TO GROW AT LARGE NUMBERS VERY LONG
M05_443C0209_BUS,8.548,/et05_bus_simu/M05_443C0209_BUS.wav,NONETHELESS THE UNION HAS MOVED THE EXPERIMENT TO RICHMOND VIRGINIA AND HAS RECEIVED INQUIRIES FROM OTHER UNIONS ABOUT ITS TACTICS
F06_445C020U_BUS,3.9439375,/et05_bus_simu/F06_445C020U_BUS.wav,WE HAD TO SUSTAIN SOME MODEST OPERATING LOSSES
F05_444C020C_BUS,6.4605,/et05_bus_simu/F05_444C020C_BUS.wav,SENATE FINANCE CHAIRMAN LLOYD BENTSEN D. TEXAS SAID HE WOULD SPEED UP WORK ON THE PACKAGE BECAUSE OF THE CRASH
M05_447C020V_BUS,7.98775,/et05_bus_simu/M05_447C020V_BUS.wav,MANHATTAN INDUSTRIES CONTINUED TO TRADE ABOVE THE OFFER PRICE YESTERDAY INDICATING THE MARKET EXPECTS A HIGHER BID
F06_446C020R_BUS,9.0801875,/et05_bus_simu/F06_446C020R_BUS.wav,AMONG MEN FIFTY SIX PERCENT SAID THE U. S. WAS DOING TOO LITTLE IN SPACE EXPLORATION ONLY A QUARTER OF WOMEN AGREED
M06_441C020V_BUS,6.0801875,/et05_bus_simu/M06_441C020V_BUS.wav,CLOSED END FUNDS ARE TRADED ON EXCHANGES LIKE STOCKS BUT INVEST IN A WIDE PORTFOLIO OF OTHER SECURITIES
F06_447C020K_BUS,2.600125,/et05_bus_simu/F06_447C020K_BUS.wav,THAT WAS CERTAINLY TRUE LAST WEEK
M06_442C0207_BUS,5.82,/et05_bus_simu/M06_442C0207_BUS.wav,GRAND AUTO SLID THREE TO FIFTEEN AND ONE EIGHTH ON THE AMERICAN STOCK EXCHANGE
M05_440C020S_BUS,4.6361875,/et05_bus_simu/M05_440C020S_BUS.wav,WHAT WE DON'T KNOW IS HOW MUCH IS PRICE AND HOW MUCH IS VOLUME
M05_446C020G_BUS,7.5155625,/et05_bus_simu/M05_446C020G_BUS.wav,THE CLOSELY HELD GROUP DOESN'T HAVE ANY SIGNIFICANT ASSETS ACCORDING TO WILLIAM G. SIMON ITS PRESIDENT
F05_440C020I_BUS,6.220625,/et05_bus_simu/F05_440C020I_BUS.wav,THERE SHOULDN'T BE ANY RISK TO THE BANKS IN THIS SORT OF STUFF SAID LAWRENCE COHN A BANKING ANALYST AT MERRILL LYNCH AND COMPANY
M06_447C020X_BUS,5.264,/et05_bus_simu/M06_447C020X_BUS.wav,SALANT SHARES CLOSED UNCHANGED ON THE BIG BOARD AT NINE DOLLARS AND SEVENTY FIVE CENTS
F05_446C020K_BUS,5.44425,/et05_bus_simu/F05_446C020K_BUS.wav,IN MANY WAYS THAT'S JUST WHAT U. B. S. HAS DONE SINCE MR. SENN WAS NAMED PRESIDENT IN NINETEEN EIGHTY
M05_441C020E_BUS,7.4758125,/et05_bus_simu/M05_441C020E_BUS.wav,ELDERS BREWING WILL BE BASED OUTSIDE AUSTRALIA BECAUSE SEVENTY PERCENT OF ITS ASSETS ARE IN BRITAIN AND CANADA
F06_440C0206_BUS,4.335875,/et05_bus_simu/F06_440C0206_BUS.wav,TWO OTHER ISSUES BEGAN TRADING RECENTLY ON THE BIG BOARD
M05_441C020J_BUS,7.5556875,/et05_bus_simu/M05_441C020J_BUS.wav,TODAY NINETY PERCENT OF THE FOUR BILLION DOLLARS OF B. A. S. F. SALES IN THE U. S. IS PRODUCED THERE
F06_440C020Z_BUS,5.976125,/et05_bus_simu/F06_440C020Z_BUS.wav,UTILITY ANALYSTS HOWEVER EXPECT THE AGREEMENT TO BE COMPLETED WITHOUT MUCH DIFFICULTY
F06_444C020Z_BUS,8.5441875,/et05_bus_simu/F06_444C020Z_BUS.wav,THERE WERE TWO HUNDRED FIFTY SIX ISSUES ADVANCING THREE HUNDRED THREE DECLINING AND TWO HUNDRED NINETY TWO UNCHANGED
F06_445C020N_BUS,9.8001875,/et05_bus_simu/F06_445C020N_BUS.wav,CONISTON PARTNERS OF NEW YORK SAID IT HAS A SIX POINT EIGHT PERCENT STAKE IN GILLETTE AND MAY SEEK TO ACQUIRE THE COMPANY OR GAIN SEATS ON ITS BOARD
M05_445C020Q_BUS,4.7559375,/et05_bus_simu/M05_445C020Q_BUS.wav,IF THE DOLLAR STARTS TO PLUNGE THE FED MAY STEP UP ITS DEFENSE OF THE CURRENCY
F05_443C0206_BUS,4.9163125,/et05_bus_simu/F05_443C0206_BUS.wav,THE TORONTO BASED COMPANY PROVIDES MORTGAGE GUARANTEES TO THE CANADIAN REAL ESTATE INDUSTRY
F05_441C0207_BUS,2.652,/et05_bus_simu/F05_441C0207_BUS.wav,IN JAPAN IT'S ALL GREEK SO TO SPEAK
M05_440C020C_BUS,8.7716875,/et05_bus_simu/M05_440C020C_BUS.wav,THE RISE IN THAT CATEGORY IN JULY WAS LED BY INCREASED ORDERS FOR AIRCRAFT AND PARTS NONELECTRICAL MACHINERY LUMBER AND FURNITURE
F06_445C0215_BUS,6.000125,/et05_bus_simu/F06_445C0215_BUS.wav,AND AFTER A TEMPORARY DOWNTURN IN THE NEXT COUPLE OF YEARS THE NUMBERS PROBABLY WILL GO BACK UP
F06_444C020X_BUS,7.4480625,/et05_bus_simu/F06_444C020X_BUS.wav,THE AMERICAN STOCK EXCHANGE INDEX LOST ZERO POINT SEVEN THREE TO THREE HUNDRED EIGHTY POINT NINE FOUR
F06_443C0204_BUS,10.0643125,/et05_bus_simu/F06_443C0204_BUS.wav,M. I. C. C. INVESTMENTS HAS THREE SERIES OF PUBLICLY TRADED PREFERRED SHARES AND TEN SERIES OF PRIVATELY HELD PREFERRED STOCK
F05_447C020M_BUS,4.7961875,/et05_bus_simu/F05_447C020M_BUS.wav,ENVIRODYNE SAID IT EXPECTS SALES TO BE THE HIGHEST FOR ANY THIRD QUARTER IN THE COMPANY'S HISTORY
M05_447C0215_BUS,11.3554375,/et05_bus_simu/M05_447C0215_BUS.wav,SHEARSON LEHMAN HUTTON INCORPORATED'S INDEX OF LONG TERM TREASURY BONDS STAYED IN A VERY SMALL RANGE YESTERDAY FINISHING VERY CLOSE TO WEDNESDAY'S CLOSING LEVEL
F06_446C0210_BUS,10.6963125,/et05_bus_simu/F06_446C0210_BUS.wav,THE COMPANY SAID ITS EUROPEAN BANKING AFFILIATE SAFRA REPUBLIC PLANS TO RAISE MORE THAN FOUR HUNDRED FIFTY MILLION DOLLARS THROUGH AN INTERNATIONAL OFFERING
M06_441C020S_BUS,3.192,/et05_bus_simu/M06_441C020S_BUS.wav,ANALYSTS HAVEN'T FOCUSED ON WHAT HAPPENED TO THEM
M05_441C020H_BUS,5.6280625,/et05_bus_simu/M05_441C020H_BUS.wav,TWO YEARS AGO B. A. S. F. MADE THREE SEPARATE ACQUISITIONS IN THE U. S.
F06_441C020U_BUS,1.7916875,/et05_bus_simu/F06_441C020U_BUS.wav,OUR GUESS IS NO
M06_447C0204_BUS,11.04,/et05_bus_simu/M06_447C0204_BUS.wav,MR. ROBERTSON SAYS HE WOULD ONLY BE ATTRACTED BY A NINETEEN MULTIPLE IF HE THOUGHT THE PROJECTED EARNINGS GROWTH RATE WAS EIGHTEEN PERCENT TO TWENTY PERCENT
F06_446C020O_BUS,4.7199375,/et05_bus_simu/F06_446C020O_BUS.wav,WE'RE NOT READY TO SAY WE'RE IN TECHNICAL DEFAULT A SPOKESMAN SAID
M05_441C0205_BUS,2.97975,/et05_bus_simu/M05_441C0205_BUS.wav,THE LANGUAGE IS A BIG PROBLEM
M06_442C020F_BUS,5.7239375,/et05_bus_simu/M06_442C020F_BUS.wav,THIS MORNING THE ASKING PRICE FOR THE STOCK WAS FOUR THOUSAND EIGHT HUNDRED FIFTY BUT THERE ARE WERE NO BUYERS
F06_444C020J_BUS,7.9920625,/et05_bus_simu/F06_444C020J_BUS.wav,SONY WHICH LOST POINTS IN PREVIOUS SESSIONS THIS WEEK REBOUNDED EIGHTY TO FIVE THOUSAND ONE HUNDRED THIRTY
F05_440C020F_BUS,5.65225,/et05_bus_simu/F05_440C020F_BUS.wav,THE AVERAGE RATE ON NEW TWENTY SIX WEEK BILLS ROSE TO SIX POINT ONE SIX PERCENT FROM SIX POINT ONE TWO PERCENT
M05_443C020N_BUS,8.491625,/et05_bus_simu/M05_443C020N_BUS.wav,THE OFFICIAL DECLINED TO ELABORATE ON PROJECTIONS FOR NON TELEPHONE OPERATIONS BUT CITED SEVERAL INDICATORS OF RECENT GAINS
M05_445C020A_BUS,6.73175,/et05_bus_simu/M05_445C020A_BUS.wav,A LONG LIST OF OTHER WITNESSES HAVE ALSO TESTIFIED IN THE TRIAL NOW IN ITS FOURTH MONTH
F05_444C0201_BUS,7.90825,/et05_bus_simu/F05_444C0201_BUS.wav,IN THE NINETEEN EIGHTY FIVE QUARTER THE OWNER AND OPERATOR OF HEALTH MAINTENANCE ORGANIZATIONS EARNED SIX POINT NINE MILLION DOLLARS OR TWENTY FOUR CENTS A SHARE
F05_442C020N_BUS,3.3801875,/et05_bus_simu/F05_442C020N_BUS.wav,WE'RE GOING TO BE BIDDERS SAID A TOP OFFICIAL OF A MAJOR OIL COMPANY
M06_441C0212_BUS,9.704,/et05_bus_simu/M06_441C0212_BUS.wav,VOLUME WAS MODEST AS THREE HUNDRED TWENTY SIX POINT SEVEN MILLION SHARES CHANGED HANDS COMPARED WITH THREE HUNDRED NINETY SIX POINT FIVE MILLION FRIDAY
F06_446C020Z_BUS,5.712125,/et05_bus_simu/F06_446C020Z_BUS.wav,REPUBLIC NEW YORK ROSE ONE AND ONE QUARTER TO FORTY FIVE AND SEVEN EIGHTHS
M05_441C020L_BUS,6.987625,/et05_bus_simu/M05_441C020L_BUS.wav,THOSE IDENTIFIED AS BENEFICIAL OWNERS HOLD AT LEAST TEN PERCENT OF A COMPANY'S EQUITY SECURITIES
F06_440C0208_BUS,3.448,/et05_bus_simu/F06_440C0208_BUS.wav,UNION OFFICIALS EXPECT RATIFICATION
M06_442C0203_BUS,4.6640625,/et05_bus_simu/M06_442C0203_BUS.wav,THE BANK HOLDING COMPANY SLATED ANOTHER FIFTY MILLION DOLLAR SALE NEXT TUESDAY
F05_446C020B_BUS,7.66025,/et05_bus_simu/F05_446C020B_BUS.wav,THE ISSUE WAS PRICED AFTER AUCTION TO YIELD FROM THREE POINT FIVE PERCENT IN NINETEEN EIGHTY SEVEN TO FIVE POINT FIVE PERCENT IN NINETEEN NINETY SEVEN
F05_446C020T_BUS,9.0521875,/et05_bus_simu/F05_446C020T_BUS.wav,ACCORDING TO THE AVERAGE ESTIMATE OF SEVEN ECONOMISTS SURVEYED BY DOW JONES CAPITAL MARKETS REPORT NEW ORDERS FOR U. S. DURABLE GOODS ROSE TWO POINT FOUR PERCENT LAST MONTH
M06_442C020K_BUS,3.5040625,/et05_bus_simu/M06_442C020K_BUS.wav,THAT WOULD FOLLOW A TWO POINT TWO PERCENT DROP IN MAY
M05_443C020C_BUS,7.55575,/et05_bus_simu/M05_443C020C_BUS.wav,EMPLOYMENT LOOKED STRONG INFLATION WAS LOW AND CONSUMER SPENDING AND INVESTMENT WERE HOLDING UP REASONABLY WELL
M06_444C020M_BUS,3.3040625,/et05_bus_simu/M06_444C020M_BUS.wav,WE HAD TO SUSTAIN SOME MODEST OPERATING LOSSES
M06_443C020Y_BUS,7.1518125,/et05_bus_simu/M06_443C020Y_BUS.wav,THERE WERE TWO HUNDRED FIFTY SIX ISSUES ADVANCING THREE HUNDRED THREE DECLINING AND TWO HUNDRED NINETY TWO UNCHANGED
M05_447C020A_BUS,3.9479375,/et05_bus_simu/M05_447C020A_BUS.wav,UNITED PRESIDENTIAL IS A LIFE INSURANCE COMPANY
M05_442C0205_BUS,9.628,/et05_bus_simu/M05_442C0205_BUS.wav,M. I. C. C. SAID IT INTENDS TO PAY THE DIVIDEND ARREARS ON JULY THIRTY FIRST TO STOCK OF RECORD JULY SECOND
F05_440C0210_BUS,7.0604375,/et05_bus_simu/F05_440C0210_BUS.wav,YESTERDAY MOODY'S INVESTORS SERVICE RAISED LILCO'S CREDIT RATINGS IN RECOGNITION OF THE IMPROVED OUTLOOK FOR STEADY FINANCIAL RECOVERY
F06_442C020S_BUS,11.9443125,/et05_bus_simu/F06_442C020S_BUS.wav,AT THE CLOSE THE FINANCIAL TIMES THIRTY SHARE INDEX WAS THREE POINT NINE POINTS LOWER AT ONE THOUSAND FOUR HUNDRED EIGHTEEN POINT SIX
F05_442C020X_BUS,3.384,/et05_bus_simu/F05_442C020X_BUS.wav,ABOUT THREE POINT FIVE BILLION DOLLARS OF SECURITIES ARE AFFECTED
F06_442C020E_BUS,9.0241875,/et05_bus_simu/F06_442C020E_BUS.wav,UNDER TOKYO TRADING RULES THE MAXIMUM ONE DAY DROP FOR SONY IS FIVE HUNDRED YEN ABOUT THREE DOLLARS AND FIFTY CENTS
F06_445C020B_BUS,4.960125,/et05_bus_simu/F06_445C020B_BUS.wav,BUT IT IS MR. WEST UPON WHOM THE OUTCOME PROBABLY DEPENDS MOST
M05_443C020Q_BUS,5.099875,/et05_bus_simu/M05_443C020Q_BUS.wav,M. C. I. PLANS TO BEGIN OFFERING THE SERVICE AT THE END OF THIS MONTH
F06_442C020M_BUS,5.8160625,/et05_bus_simu/F06_442C020M_BUS.wav,EVEN SOME BIGGER COMPANIES CAUTION THAT THEY ARE LEERY OF PAYING TOO BIG A PREMIUM
F05_445C020R_BUS,4.6760625,/et05_bus_simu/F05_445C020R_BUS.wav,IF THE FED PUSHES THE DOLLAR HIGHER IT MAY CURB THE DEMAND FOR U. S. EXPORTS
M05_444C0208_BUS,5.8760625,/et05_bus_simu/M05_444C0208_BUS.wav,CITICORP HAD TWENTY ONE POINT FIVE BILLION DOLLARS IN CAPITAL AT THE END OF LAST YEAR
F06_441C020K_BUS,12.3601875,/et05_bus_simu/F06_441C020K_BUS.wav,THE FOLLOWING OFFICERS DIRECTORS AND LARGE STOCKHOLDERS OF COMPANIES REPORTED CHANGES IN HOLDINGS UNDER THE SECURITIES EXCHANGE ACT OF NINETEEN THIRTY FOUR
M05_440C020J_BUS,7.9798125,/et05_bus_simu/M05_440C020J_BUS.wav,THE INDEPENDENT COMMITTEE WILL RECOMMEND THAT HOLDERS ACCEPT THE OFFER AT A MEETING EXPECTED TO BE HELD IN DECEMBER T. W. A. SAID
M06_446C020P_BUS,1.856,/et05_bus_simu/M06_446C020P_BUS.wav,IT'S STILL UNCLEAR
F06_440C020Q_BUS,5.8401875,/et05_bus_simu/F06_440C020Q_BUS.wav,THE RISE IN AUTO IMPORTS ALSO REFLECTS HIGHER PRICES FOR IMPORTED CARS
F05_443C0203_BUS,6.7643125,/et05_bus_simu/F05_443C0203_BUS.wav,USING A MEASURE THAT COUNTS THE MILITARY AMONG THE EMPLOYED THE RATE WAS UNCHANGED AT SIX POINT SIX PERCENT LAST MONTH
F06_444C020E_BUS,6.3360625,/et05_bus_simu/F06_444C020E_BUS.wav,SEVERAL AIRLINES HAVE ALSO OPPOSED THE STANDARDS AND MAY FIGHT SOME ASPECTS IN COURT
M05_440C020L_BUS,5.027625,/et05_bus_simu/M05_440C020L_BUS.wav,THE INVESTOR NOW OWNS SEVENTY THREE PERCENT OF THE COMPANY
F05_447C020S_BUS,4.300125,/et05_bus_simu/F05_447C020S_BUS.wav,BUT WHILE THE FED STANDS PAT IT IS COMING UNDER INCREASING ATTACK FROM BOTH SIDES
F05_440C020G_BUS,3.3080625,/et05_bus_simu/F05_440C020G_BUS.wav,ANALYSTS TOO GENERALLY PLAYED DOWN THE EFFECT ON BANKS
F05_442C020T_BUS,6.7561875,/et05_bus_simu/F05_442C020T_BUS.wav,VOLUME WAS MODEST AS THREE HUNDRED TWENTY SIX POINT SEVEN MILLION SHARES CHANGED HANDS COMPARED WITH THREE HUNDRED NINETY SIX POINT FIVE MILLION FRIDAY
M06_443C020Z_BUS,6.112375,/et05_bus_simu/M06_443C020Z_BUS.wav,COMPANIES LISTED BELOW REPORTED QUARTERLY PROFIT SUBSTANTIALLY DIFFERENT FROM THE AVERAGE OF ANALYSTS' ESTIMATES
M05_443C020V_BUS,4.1639375,/et05_bus_simu/M05_443C020V_BUS.wav,IN CERTAIN CASES THE CARDS ARE GIVEN FREE TO SUBSCRIBERS
F05_443C0210_BUS,5.7961875,/et05_bus_simu/F05_443C0210_BUS.wav,THE COMPANIES ARE FOLLOWED BY AT LEAST THREE ANALYSTS AND HAD A MINIMUM FIVE CENT CHANGE IN ACTUAL EARNINGS PER SHARE
M06_447C020L_BUS,5.496625,/et05_bus_simu/M06_447C020L_BUS.wav,EMPLOYMENT LOOKED STRONG INFLATION WAS LOW AND CONSUMER SPENDING AND INVESTMENT WERE HOLDING UP REASONABLY WELL
M06_444C0204_BUS,5.9121875,/et05_bus_simu/M06_444C0204_BUS.wav,SEPARATELY NEW YORK STATE SOLD ABOUT SEVENTY SEVEN POINT ONE MILLION DOLLARS OF CERTIFICATES OF PARTICIPATION
M06_446C0207_BUS,3.888125,/et05_bus_simu/M06_446C0207_BUS.wav,THAT DOESN'T MEAN MR. ICAHN HAS COMMITTED ANY WRONGDOING
F06_447C0205_BUS,1.704125,/et05_bus_simu/F06_447C0205_BUS.wav,HE DOESN'T
M05_442C0206_BUS,6.09175,/et05_bus_simu/M05_442C0206_BUS.wav,THE TORONTO BASED COMPANY PROVIDES MORTGAGE GUARANTEES TO THE CANADIAN REAL ESTATE INDUSTRY
F05_442C020Z_BUS,4.1800625,/et05_bus_simu/F05_442C020Z_BUS.wav,HE SAID SUCH PRODUCTS WOULD BE MARKETED BY OTHER COMPANIES WITH EXPERIENCE IN THAT BUSINESS
F06_446C0201_BUS,9.888,/et05_bus_simu/F06_446C0201_BUS.wav,HERE ARE PRICE TRENDS ON THE WORLD'S MAJOR STOCK MARKETS AS CALCULATED BY MORGAN STANLEY CAPITAL INTERNATIONAL PERSPECTIVE GENEVA
F06_441C0216_BUS,3.3119375,/et05_bus_simu/F06_441C0216_BUS.wav,HE DECLINED TO NAME SPECIFIC PRODUCTS
M05_443C020W_BUS,8.235625,/et05_bus_simu/M05_443C020W_BUS.wav,THE AMERICAN STOCK EXCHANGE INDEX LOST ZERO POINT SEVEN THREE TO THREE HUNDRED EIGHTY POINT NINE FOUR
F06_447C020P_BUS,8.7523125,/et05_bus_simu/F06_447C020P_BUS.wav,THE INDEPENDENT COMMITTEE WILL RECOMMEND THAT HOLDERS ACCEPT THE OFFER AT A MEETING EXPECTED TO BE HELD IN DECEMBER T. W. A. SAID
F06_444C020I_BUS,5.1760625,/et05_bus_simu/F06_444C020I_BUS.wav,KYOCERA WAS UP SIXTY AT FIVE THOUSAND TWO HUNDRED SIXTY
M05_442C0208_BUS,9.5238125,/et05_bus_simu/M05_442C0208_BUS.wav,THE COMPANY WHICH RUNS RETAIL AUTOMOTIVE STORES TOLD SHEARSON LEHMAN BROTHERS ITS FINANCIAL ADVISER TO TERMINATE DISCUSSIONS TO SELL THE FIRM
M05_441C020Y_BUS,6.2839375,/et05_bus_simu/M05_441C020Y_BUS.wav,REPUBLIC NEW YORK ROSE ONE AND ONE QUARTER TO FORTY FIVE AND SEVEN EIGHTHS
F05_445C020Y_BUS,2.50425,/et05_bus_simu/F05_445C020Y_BUS.wav,NEITHER SIDE WOULD DISCLOSE TERMS
M05_441C020B_BUS,6.835875,/et05_bus_simu/M05_441C020B_BUS.wav,GRAND AUTO SLID THREE TO FIFTEEN AND ONE EIGHTH ON THE AMERICAN STOCK EXCHANGE
F05_444C020D_BUS,3.268125,/et05_bus_simu/F05_444C020D_BUS.wav,IT ADDS TO THE SUPPORT FOR THE TRADE BILL GETTING THROUGH HE SAID
F05_447C020H_BUS,4.7085625,/et05_bus_simu/F05_447C020H_BUS.wav,THE TORONTO BASED GOLD MINING CONCERN SAID PROCEEDS WOULD BE USED FOR GENERAL PURPOSES
M06_441C020O_BUS,5.552125,/et05_bus_simu/M06_441C020O_BUS.wav,ABOUT ALL BUSINESSMEN CAN COUNT ON IS THAT POLICY WILL BE PRETTY VOLATILE
M05_441C020D_BUS,5.81175,/et05_bus_simu/M05_441C020D_BUS.wav,IT RECEIVED NO PROPOSALS THAT WERE IN THE BEST INTEREST OF THE SHAREHOLDERS THE COMPANY SAID
M05_441C0210_BUS,6.0436875,/et05_bus_simu/M05_441C0210_BUS.wav,AFTER THE OFFERING REPUBLIC NEW YORK WILL HOLD ABOUT FORTY NINE PERCENT OF THE AFFILIATE
M06_444C020O_BUS,7.1601875,/et05_bus_simu/M06_444C020O_BUS.wav,THE COMPANY DECLINED TO IDENTIFY THE BIDDERS BUT SAID IT RECEIVED OFFERS IN THE HIGH FORTY DOLLARS PER SHARE
F05_447C0201_BUS,5.3961875,/et05_bus_simu/F05_447C0201_BUS.wav,I DON'T MEAN THERE COULDN'T BE SOME IMPROVEMENTS IN THE REVENUE ACT OF NINETEEN EIGHTY SIX WHICH TOOK EFFECT THIS MONTH
F06_445C0201_BUS,8.24825,/et05_bus_simu/F06_445C0201_BUS.wav,OWENS ILLINOIS SAID ITS SHARE PURCHASES WOULD BE FINANCED BY EXISTING CREDIT LINES AND NEW ONES TO BE ARRANGED
M05_444C020R_BUS,9.8996875,/et05_bus_simu/M05_444C020R_BUS.wav,THE MID JULY INCREASE CAME EVEN THOUGH AUTO MAKERS ARE OFFERING INCENTIVES ON FEWER CARS THIS YEAR THAN THEY DID LAST YEAR OR EARLIER THIS YEAR
M06_446C0203_BUS,2.6960625,/et05_bus_simu/M06_446C0203_BUS.wav,THE PERCENTAGE CHANGE IS SINCE YEAR END
F06_444C020A_BUS,6.5760625,/et05_bus_simu/F06_444C020A_BUS.wav,IN ADDITION BANKS IN GENERAL ARE BEING PUSHED BY REGULATORS TO BOOST THEIR CAPITAL POSITIONS
F05_440C0202_BUS,7.7005625,/et05_bus_simu/F05_440C0202_BUS.wav,THE COMPANY HAS FIVE HUNDRED JAPANESE MANAGERS OVERSEAS MOST OF THEM IN KEY POSITIONS AND EXPECTS THE NUMBER TO RISE SIXTY PERCENT IN THE NEXT FIVE YEARS
F06_440C020K_BUS,7.896125,/et05_bus_simu/F06_440C020K_BUS.wav,THE TRANSACTION REQUIRES APPROVAL OF A MAJORITY OF THE SHARES OF THE HOLDERS NOT AFFILIATED WITH MR. ICAHN
F05_440C0209_BUS,3.0040625,/et05_bus_simu/F05_440C0209_BUS.wav,A P. B. G. C. SPOKESWOMAN DECLINED COMMENT
F05_443C0207_BUS,2.732125,/et05_bus_simu/F05_443C0207_BUS.wav,IT ISN'T CLEAR YET WHETHER THE CAMPAIGN WORKS
M05_441C020I_BUS,10.623625,/et05_bus_simu/M05_441C020I_BUS.wav,ITS BIGGEST WAS THE ONE BILLION DOLLAR PURCHASE OF THE UNITED TECHNOLOGIES CORPORATION'S INMONT SUBSIDIARY A MAJOR SUPPLIER OF PAINT TO THE AUTO INDUSTRY
M06_443C0213_BUS,3.3290625,/et05_bus_simu/M06_443C0213_BUS.wav,HONDA WAS DOWN TEN TO ONE THOUSAND NINE HUNDRED THIRTY
F05_442C020P_BUS,7.156375,/et05_bus_simu/F05_442C020P_BUS.wav,THE COMPANY SAID IT WOULD BEGIN A DUTCH AUCTION LATER THIS WEEK FOR AS MANY AS FORTY MILLION SHARES OR TWENTY SIX PERCENT OF ITS SHARES OUTSTANDING
F06_447C020I_BUS,5.28825,/et05_bus_simu/F06_447C020I_BUS.wav,IT HAD FOURTEEN POINT FIVE MILLION COMMON SHARES OUTSTANDING BEFORE THE ISSUE
M05_447C020B_BUS,6.0198125,/et05_bus_simu/M05_447C020B_BUS.wav,THESE ARE UNEDUCATED PEOPLE HE SAYS IN ENGLISH SO THE PATIENTS WON'T UNDERSTAND
M05_442C020O_BUS,7.98775,/et05_bus_simu/M05_442C020O_BUS.wav,BUT IF THE WINNING BIDS ARE AS HIGH AS THEY WERE IN SOME DEALS EARLIER THIS YEAR THEN WE'RE NOT GOING TO BE WINNING BIDDERS
M05_440C020D_BUS,7.9875625,/et05_bus_simu/M05_440C020D_BUS.wav,INTEREST RATES ROSE ON SHORT TERM TREASURY BILLS SOLD BY THE GOVERNMENT YESTERDAY AT ITS REGULAR WEEKLY AUCTION
M05_444C020S_BUS,8.2518125,/et05_bus_simu/M05_444C020S_BUS.wav,INCENTIVES CAN MOVE AROUND SALES BUT NOT CREATE THEM SAID CHARLES BRADY AN OPPENHEIMER AND COMPANY AUTO STOCK ANALYST
F06_446C020X_BUS,8.440125,/et05_bus_simu/F06_446C020X_BUS.wav,MANY ANALYSTS CITE AN EXPECTED INCREASE IN AIRCRAFT ORDERS AS A BIG REASON FOR THE ANTICIPATED JUNE INCREASE
F05_444C020F_BUS,3.4041875,/et05_bus_simu/F05_444C020F_BUS.wav,SO FAR THEY HAVE DECLINED TO COMMENT PUBLICLY ON THEIR PLANS
M05_440C0203_BUS,3.9879375,/et05_bus_simu/M05_440C0203_BUS.wav,ABOUT HALF THESE MANAGERS ARE IN THE U. S.
F05_446C020V_BUS,6.996125,/et05_bus_simu/F05_446C020V_BUS.wav,THE MAY SLUMP REPORTED JUNE TWENTY SECOND CAME AS A BIG SURPRISE TO MOST ANALYSTS AND HELPED TRIGGER A POWERFUL BOND RALLY THAT DAY
F06_445C0202_BUS,6.864125,/et05_bus_simu/F06_445C0202_BUS.wav,IF ALL TWENTY MILLION SHARES WERE PURCHASED THE COMPANY'S EQUITY WOULD BE REDUCED BY ABOUT ONE THIRD
F05_446C020W_BUS,4.0124375,/et05_bus_simu/F05_446C020W_BUS.wav,DURABLE GOODS REPORTS FREQUENTLY ARE HIGHLY VOLATILE FROM MONTH TO MONTH
M06_444C020W_BUS,3.4880625,/et05_bus_simu/M06_444C020W_BUS.wav,A PRINT MEDIA CAMPAIGN WILL BEGIN THE FOLLOWING DAY
F06_446C020A_BUS,8.0400625,/et05_bus_simu/F06_446C020A_BUS.wav,SEPARATELY NEW YORK STATE SOLD ABOUT SEVENTY SEVEN POINT ONE MILLION DOLLARS OF CERTIFICATES OF PARTICIPATION
F06_440C020R_BUS,8.08825,/et05_bus_simu/F06_440C020R_BUS.wav,PRICES ARE GOING UP SAID GEORGE C. EADS VICE PRESIDENT AND CHIEF ECONOMIST AT GENERAL MOTORS CORPORATION
M05_443C020S_BUS,3.9559375,/et05_bus_simu/M05_443C020S_BUS.wav,A PRINT MEDIA CAMPAIGN WILL BEGIN THE FOLLOWING DAY
M06_443C020L_BUS,5.632125,/et05_bus_simu/M06_443C020L_BUS.wav,WHEN ITS INITIAL PUBLIC OFFERING IS COMPLETED ASHLAND IS EXPECTED TO RETAIN A FORTY SIX PERCENT STAKE
M06_444C0203_BUS,8.600125,/et05_bus_simu/M06_444C0203_BUS.wav,REVENUE IN THE QUARTER MORE THAN DOUBLED TO THREE HUNDRED SIXTY TWO POINT FOUR MILLION DOLLARS FROM ONE HUNDRED FORTY NINE POINT TWO MILLION DOLLARS
F05_446C020E_BUS,8.5881875,/et05_bus_simu/F05_446C020E_BUS.wav,FIDELITY HAD CONTENDED THAT GENCORP ISN'T A QUALIFIED BROADCASTER BECAUSE IT FAILED TO DISCLOSE ALLEGEDLY IMPROPER POLITICAL CAMPAIGN CONTRIBUTIONS AND FOREIGN PAYMENTS
M06_447C0216_BUS,8.400125,/et05_bus_simu/M06_447C0216_BUS.wav,THE INDEX ENDED WITH A DECLINE OF ZERO POINT THREE FIVE POINT TO ONE THOUSAND TWO HUNDRED SEVENTY TWO POINT ONE EIGHT
M05_441C020W_BUS,7.20375,/et05_bus_simu/M05_441C020W_BUS.wav,ALTHOUGH CLOSED END FUNDS HAVE BEEN AROUND SINCE AT LEAST THE NINETEEN TWENTIES THEY HAVE BOOMED IN POPULARITY THIS YEAR
F06_447C020Z_BUS,5.280125,/et05_bus_simu/F06_447C020Z_BUS.wav,SEVERAL CITIES HAVE VERSIONS OF THE BRITISH ORGANIZATION BODY POSITIVE
M06_445C020H_BUS,4.5040625,/et05_bus_simu/M06_445C020H_BUS.wav,THE SUIT SEEKS TO BLOCK THE CONTRACT WHICH WOULD HAVE RAISED PAY LEVELS BUT CUT BENEFITS
M05_446C0212_BUS,12.3475625,/et05_bus_simu/M05_446C0212_BUS.wav,CLOSELY HELD TIMES PUBLISHING ALSO OWNS TWO WASHINGTON BASED PUBLICATIONS CONGRESSIONAL QUARTERLY WHICH COVERS CAPITOL HILL AND GOVERNING WHICH COVERS STATE AND LOCAL GOVERNMENTS
M05_444C020P_BUS,11.147375,/et05_bus_simu/M05_444C020P_BUS.wav,IN RESPONSE AMFAC SHARES ROSE ONE DOLLAR TO FORTY SEVEN DOLLARS AND SEVENTY FIVE CENTS IN NEW YORK STOCK EXCHANGE COMPOSITE TRADING YESTERDAY
M05_447C020R_BUS,4.067875,/et05_bus_simu/M05_447C020R_BUS.wav,THE INVESTOR NOW OWNS SEVENTY THREE PERCENT OF THE COMPANY
F05_443C020D_BUS,6.56425,/et05_bus_simu/F05_443C020D_BUS.wav,AMONG EXPORT LED ELECTRICAL AND COMPUTER MAKERS JAPAN VICTOR COMPANY FELL FIFTY TO TWO THOUSAND THREE HUNDRED TWENTY
F05_443C0205_BUS,6.612125,/et05_bus_simu/F05_443C0205_BUS.wav,M. I. C. C. SAID IT INTENDS TO PAY THE DIVIDEND ARREARS ON JULY THIRTY FIRST TO STOCK OF RECORD JULY SECOND
M06_442C020G_BUS,4.32,/et05_bus_simu/M06_442C020G_BUS.wav,A MONSANTO SPOKESMAN SAID THERE'S VERY LITTLE WE CAN SAY
F06_444C0213_BUS,4.9600625,/et05_bus_simu/F06_444C0213_BUS.wav,A CHANGE IN THE FIRM'S OWNERSHIP ALSO SHOULD TURN ON A BRIGHT WARNING LIGHT
M05_444C0209_BUS,10.267625,/et05_bus_simu/M05_444C0209_BUS.wav,AS ONE OF THE MOST ACQUISITION HUNGRY OF MAJOR BANKS CITICORP IS OFTEN REQUIRED BY REGULATORS TO RAISE ADDITIONAL CAPITAL AS A CONDITION OF MAKING ACQUISITIONS
F06_440C020A_BUS,8.08025,/et05_bus_simu/F06_440C020A_BUS.wav,DESPITE THE JULY DECLINE DURABLE GOODS ORDERS REMAINED SEVEN POINT SEVEN PERCENT ABOVE THE YEAR EARLIER LEVEL
F06_446C020M_BUS,7.7843125,/et05_bus_simu/F06_446C020M_BUS.wav,NET INCOME ROSE ONE HUNDRED TWENTY FIVE PERCENT TO SEVEN HUNDRED FIFTY THREE MILLION SWISS FRANCS IN THE PERIOD
F05_442C020I_BUS,4.220125,/et05_bus_simu/F05_442C020I_BUS.wav,BUT ON THE FIRST READ THROUGH THE CASE IS WITHOUT MERIT AND WE INTEND TO FIGHT IT
F06_440C0212_BUS,8.9439375,/et05_bus_simu/F06_440C0212_BUS.wav,HE ALSO SAID THAT THE COMPANY FOR THE FIRST TIME WAS DEVELOPING DRUGS SPECIFICALLY FOR THE OVER THE COUNTER CONSUMER HEALTH CARE MARKET
M05_441C020M_BUS,9.5630625,/et05_bus_simu/M05_441C020M_BUS.wav,UNLESS OTHERWISE NOTED CHANGES INVOLVED DIRECT HOLDINGS OF COMMON STOCK AND TOOK PLACE IN SEPTEMBER AND OCTOBER OF NINETEEN EIGHTY SEVEN
M06_441C0209_BUS,3.8480625,/et05_bus_simu/M06_441C0209_BUS.wav,THE EARLIER RISE WAS PREVIOUSLY REPORTED AS FOUR POINT THREE PERCENT
M05_441C0202_BUS,5.7358125,/et05_bus_simu/M05_441C0202_BUS.wav,A COMMISSION SPOKESMAN SAID A DECISION ON THE APPEAL IS EXPECTED SOON
M05_445C0209_BUS,5.939625,/et05_bus_simu/M05_445C0209_BUS.wav,AND BOTH MORTGAGED THEIR HOMES TO SECURE THE LOANS THEY NEEDED TO START THE BUSINESS
M05_443C020F_BUS,8.6678125,/et05_bus_simu/M05_443C020F_BUS.wav,SONY WHICH LOST POINTS IN PREVIOUS SESSIONS THIS WEEK REBOUNDED EIGHTY TO FIVE THOUSAND ONE HUNDRED THIRTY
F06_444C0211_BUS,11.4321875,/et05_bus_simu/F06_444C0211_BUS.wav,HOWEVER INVESTMENT INCOME WHICH REPRESENTS THIRTEEN PERCENT OF THE INDUSTRY'S REVENUES ROSE ELEVEN PERCENT IN THE QUARTER REFLECTING GAINS FROM THE RISING STOCK MARKET
M05_441C020X_BUS,7.2278125,/et05_bus_simu/M05_441C020X_BUS.wav,THE BOND FUNDS IN PARTICULAR PROVIDE ROBUST YIELDS FOR INVESTORS AND HEFTY FEES FOR UNDERWRITERS
M06_446C0213_BUS,5.304125,/et05_bus_simu/M06_446C0213_BUS.wav,IT ALSO OWNS THREE STATE BUSINESS MAGAZINES IN FLORIDA GEORGIA AND ARIZONA
F05_445C020X_BUS,3.5003125,/et05_bus_simu/F05_445C020X_BUS.wav,CONTINENTAL STARTED THE APPEAL PROCESS BUT RECENTLY SETTLED THE CASE
