ID,duration,wav,wrd
F06_447C0202_CAF,2.7600625,/et05_caf_simu/F06_447C0202_CAF.wav,I HAVE MY LIST OF CHANGES I'D LIKE TO SEE
M05_441C020H_CAF,5.6280625,/et05_caf_simu/M05_441C020H_CAF.wav,TWO YEARS AGO B. A. S. F. MADE THREE SEPARATE ACQUISITIONS IN THE U. S.
M06_446C020Q_CAF,5.78425,/et05_caf_simu/M06_446C020Q_CAF.wav,THERE WAS A STRIKING SPLIT BETWEEN THE SEXES WITH MEN MORE LIKELY THAN WOMEN TO FAVOR SPACE PROGRAMS
M05_443C020O_CAF,8.9719375,/et05_caf_simu/M05_443C020O_CAF.wav,HE SAID THE COMPANY HAS ENTERED SIXTEEN SMALLER CELLULAR MARKETS THIS YEAR AND HAS EXPANDED ITS FINANCIAL SERVICES WORK FORCE
F06_447C020P_CAF,8.7523125,/et05_caf_simu/F06_447C020P_CAF.wav,THE INDEPENDENT COMMITTEE WILL RECOMMEND THAT HOLDERS ACCEPT THE OFFER AT A MEETING EXPECTED TO BE HELD IN DECEMBER T. W. A. SAID
M06_442C020G_CAF,4.32,/et05_caf_simu/M06_442C020G_CAF.wav,A MONSANTO SPOKESMAN SAID THERE'S VERY LITTLE WE CAN SAY
F06_444C020X_CAF,7.4480625,/et05_caf_simu/F06_444C020X_CAF.wav,THE AMERICAN STOCK EXCHANGE INDEX LOST ZERO POINT SEVEN THREE TO THREE HUNDRED EIGHTY POINT NINE FOUR
