ID,duration,wav,wrd
F05_444C0210_CAF,7.820375,/et05_caf_simu/F05_444C0210_CAF.wav,THE INSTITUTE SAID EARNED PREMIUMS ROSE THREE POINT ONE PERCENT IN THE SECOND QUARTER FAILING TO KEEP PACE WITH INFLATION WHICH ROSE FOUR POINT FIVE PERCENT
M06_447C020X_CAF,5.264,/et05_caf_simu/M06_447C020X_CAF.wav,SALANT SHARES CLOSED UNCHANGED ON THE BIG BOARD AT NINE DOLLARS AND SEVENTY FIVE CENTS
F05_446C020S_CAF,6.1081875,/et05_caf_simu/F05_446C020S_CAF.wav,AMONG MEN FORTY ONE PERCENT SUPPORTED BOOSTING THE SPACE EXPLORATION BUDGET COMPARED WITH NINETEEN PERCENT OF WOMEN
M06_443C020E_CAF,5.33625,/et05_caf_simu/M06_443C020E_CAF.wav,KYOCERA WAS UP SIXTY AT FIVE THOUSAND TWO HUNDRED SIXTY
F05_442C020A_CAF,8.164125,/et05_caf_simu/F05_442C020A_CAF.wav,UNDER TERMS PREVIOUSLY REPORTED THE ITALIAN AGRICULTURAL CONCERN ASSUMED ABOUT ONE HUNDRED NINETY FIVE MILLION DOLLARS IN SUBORDINATED DEBT AS PART OF THE TRANSACTION
M06_445C0207_CAF,2.3521875,/et05_caf_simu/M06_445C0207_CAF.wav,BUT THE PENALTIES FOR FAILURE ARE REAL
F05_445C020O_CAF,1.884,/et05_caf_simu/F05_445C020O_CAF.wav,A LENGTHY FIGHT IS LIKELY
M05_443C0214_CAF,9.659625,/et05_caf_simu/M05_443C0214_CAF.wav,NISSAN LOST THIRTY TO ONE THOUSAND FIVE HUNDRED TWENTY AND TOYOTA WAS DOWN THIRTY TO END THE DAY AT TWO THOUSAND SIX HUNDRED TWENTY
M05_443C020Q_CAF,5.099875,/et05_caf_simu/M05_443C020Q_CAF.wav,M. C. I. PLANS TO BEGIN OFFERING THE SERVICE AT THE END OF THIS MONTH
M06_441C0209_CAF,3.8480625,/et05_caf_simu/M06_441C0209_CAF.wav,THE EARLIER RISE WAS PREVIOUSLY REPORTED AS FOUR POINT THREE PERCENT
M05_444C0208_CAF,5.8760625,/et05_caf_simu/M05_444C0208_CAF.wav,CITICORP HAD TWENTY ONE POINT FIVE BILLION DOLLARS IN CAPITAL AT THE END OF LAST YEAR
M05_441C0202_CAF,5.7358125,/et05_caf_simu/M05_441C0202_CAF.wav,A COMMISSION SPOKESMAN SAID A DECISION ON THE APPEAL IS EXPECTED SOON
M06_443C020M_CAF,4.8721875,/et05_caf_simu/M06_443C020M_CAF.wav,THE NEW COMPANY ASHLAND COAL INCORPORATED IS LISTED ON THE NEW YORK STOCK EXCHANGE
M05_440C020C_CAF,8.7716875,/et05_caf_simu/M05_440C020C_CAF.wav,THE RISE IN THAT CATEGORY IN JULY WAS LED BY INCREASED ORDERS FOR AIRCRAFT AND PARTS NONELECTRICAL MACHINERY LUMBER AND FURNITURE
F06_447C020G_CAF,9.2320625,/et05_caf_simu/F06_447C020G_CAF.wav,THE UNDERWRITING GROUP HAS A THIRTY DAY OPTION TO ACQUIRE AN ADDITIONAL FIVE HUNDRED THOUSAND SHARES AT EIGHT DOLLARS EACH
F05_442C020W_CAF,7.0201875,/et05_caf_simu/F05_442C020W_CAF.wav,YESTERDAY MOODY'S INVESTORS SERVICE RAISED LILCO'S CREDIT RATINGS IN RECOGNITION OF THE IMPROVED OUTLOOK FOR STEADY FINANCIAL RECOVERY
M05_446C0212_CAF,12.3475625,/et05_caf_simu/M05_446C0212_CAF.wav,CLOSELY HELD TIMES PUBLISHING ALSO OWNS TWO WASHINGTON BASED PUBLICATIONS CONGRESSIONAL QUARTERLY WHICH COVERS CAPITOL HILL AND GOVERNING WHICH COVERS STATE AND LOCAL GOVERNMENTS
F05_446C020C_CAF,6.1643125,/et05_caf_simu/F05_446C020C_CAF.wav,THE UNSOLD BALANCE LATE YESTERDAY WAS ABOUT THIRTY SIX POINT THREE MILLION DOLLARS ACCORDING TO SHEARSON LEHMAN BROTHERS THE LEAD UNDERWRITER
M05_441C020M_CAF,9.5630625,/et05_caf_simu/M05_441C020M_CAF.wav,UNLESS OTHERWISE NOTED CHANGES INVOLVED DIRECT HOLDINGS OF COMMON STOCK AND TOOK PLACE IN SEPTEMBER AND OCTOBER OF NINETEEN EIGHTY SEVEN
F06_442C020M_CAF,5.8160625,/et05_caf_simu/F06_442C020M_CAF.wav,EVEN SOME BIGGER COMPANIES CAUTION THAT THEY ARE LEERY OF PAYING TOO BIG A PREMIUM
F06_440C0208_CAF,3.448,/et05_caf_simu/F06_440C0208_CAF.wav,UNION OFFICIALS EXPECT RATIFICATION
F05_445C020Y_CAF,2.50425,/et05_caf_simu/F05_445C020Y_CAF.wav,NEITHER SIDE WOULD DISCLOSE TERMS
M05_440C0207_CAF,8.412,/et05_caf_simu/M05_440C0207_CAF.wav,THE AGENCY ISN'T LIKELY TO TAKE ANY ACTION UNTIL THE UNION'S RANK AND FILE VOTES ON THE CONTRACT IN TWO TO THREE WEEKS
F06_441C020K_CAF,12.3601875,/et05_caf_simu/F06_441C020K_CAF.wav,THE FOLLOWING OFFICERS DIRECTORS AND LARGE STOCKHOLDERS OF COMPANIES REPORTED CHANGES IN HOLDINGS UNDER THE SECURITIES EXCHANGE ACT OF NINETEEN THIRTY FOUR
M06_441C020V_CAF,6.0801875,/et05_caf_simu/M06_441C020V_CAF.wav,CLOSED END FUNDS ARE TRADED ON EXCHANGES LIKE STOCKS BUT INVEST IN A WIDE PORTFOLIO OF OTHER SECURITIES
F05_445C020J_CAF,8.30825,/et05_caf_simu/F05_445C020J_CAF.wav,YESTERDAY'S SESSION BEGAN WITH A SHARP QUICK DECLINE IN THE INDUSTRIAL AVERAGE OF MORE THAN FORTY FIVE POINTS WHICH SOME MARKET ANALYSTS ATTRIBUTED TO FOREIGN SELLING
M06_442C020U_CAF,7.248125,/et05_caf_simu/M06_442C020U_CAF.wav,THE ONE HUNDRED SHARE INDEX CLOSED SIX POINT EIGHT POINTS LOWER AT ONE THOUSAND SEVEN HUNDRED FIFTY NINE POINT NINE
M06_444C0204_CAF,5.9121875,/et05_caf_simu/M06_444C0204_CAF.wav,SEPARATELY NEW YORK STATE SOLD ABOUT SEVENTY SEVEN POINT ONE MILLION DOLLARS OF CERTIFICATES OF PARTICIPATION
F06_440C020R_CAF,8.08825,/et05_caf_simu/F06_440C020R_CAF.wav,PRICES ARE GOING UP SAID GEORGE C. EADS VICE PRESIDENT AND CHIEF ECONOMIST AT GENERAL MOTORS CORPORATION
M06_443C020P_CAF,9.6560625,/et05_caf_simu/M06_443C020P_CAF.wav,IN ADDITION U. S. WEST DATA SOLUTIONS BUSINESS APPLIED COMMUNICATIONS INCORPORATED IS WORKING OUT WELL AND PERFORMING AHEAD OF ALL OUR SCHEDULES
M06_443C0212_CAF,2.952,/et05_caf_simu/M06_443C0212_CAF.wav,YESTERDAY'S LOSERS INCLUDED AUTOMOBILES
F05_447C020Q_CAF,5.836125,/et05_caf_simu/F05_447C020Q_CAF.wav,THE TRANSACTION REQUIRES APPROVAL OF A MAJORITY OF THE SHARES OF THE HOLDERS NOT AFFILIATED WITH MR. ICAHN
M05_443C020F_CAF,8.6678125,/et05_caf_simu/M05_443C020F_CAF.wav,SONY WHICH LOST POINTS IN PREVIOUS SESSIONS THIS WEEK REBOUNDED EIGHTY TO FIVE THOUSAND ONE HUNDRED THIRTY
F05_443C0210_CAF,5.7961875,/et05_caf_simu/F05_443C0210_CAF.wav,THE COMPANIES ARE FOLLOWED BY AT LEAST THREE ANALYSTS AND HAD A MINIMUM FIVE CENT CHANGE IN ACTUAL EARNINGS PER SHARE
M05_441C020Q_CAF,5.803625,/et05_caf_simu/M05_441C020Q_CAF.wav,IF THE FED PUSHES THE DOLLAR HIGHER IT MAY CURB THE DEMAND FOR U. S. EXPORTS
M06_440C0205_CAF,2.848,/et05_caf_simu/M06_440C0205_CAF.wav,THE COMPANY PREVIOUSLY TRADED OVER THE COUNTER
M05_446C020H_CAF,8.0919375,/et05_caf_simu/M05_446C020H_CAF.wav,HE SAID THAT FOR THE FULL YEAR WANG IS AIMING FOR AN AFTER TAX PROFIT EQUAL TO THREE PERCENT TO FIVE PERCENT OF SALES
F06_441C020R_CAF,7.3921875,/et05_caf_simu/F06_441C020R_CAF.wav,TOO MUCH FOCUS IS PLACED ON REDUCTION OF CROSS COUNTRY LOANS MR. MEYERMAN SAID
F06_442C020V_CAF,6.296125,/et05_caf_simu/F06_442C020V_CAF.wav,UTILITY ANALYSTS HOWEVER EXPECT THE AGREEMENT TO BE COMPLETED WITHOUT MUCH DIFFICULTY
M06_445C020H_CAF,4.5040625,/et05_caf_simu/M06_445C020H_CAF.wav,THE SUIT SEEKS TO BLOCK THE CONTRACT WHICH WOULD HAVE RAISED PAY LEVELS BUT CUT BENEFITS
M05_443C020W_CAF,8.235625,/et05_caf_simu/M05_443C020W_CAF.wav,THE AMERICAN STOCK EXCHANGE INDEX LOST ZERO POINT SEVEN THREE TO THREE HUNDRED EIGHTY POINT NINE FOUR
M06_445C020L_CAF,7.44,/et05_caf_simu/M06_445C020L_CAF.wav,ALTHOUGH THOSE GAINS ERODED DURING THE AFTERNOON STOCK PRICES STAYED WITHIN A NARROW RANGE UNTIL THE LAST HALF HOUR OF TRADING
M05_446C0214_CAF,5.77175,/et05_caf_simu/M05_446C0214_CAF.wav,INDUSTRY ANALYSTS VALUE THE COMPANY AT ABOUT SIX HUNDRED FIFTY MILLION DOLLARS
F05_442C020Z_CAF,4.1800625,/et05_caf_simu/F05_442C020Z_CAF.wav,HE SAID SUCH PRODUCTS WOULD BE MARKETED BY OTHER COMPANIES WITH EXPERIENCE IN THAT BUSINESS
M05_445C020Q_CAF,4.7559375,/et05_caf_simu/M05_445C020Q_CAF.wav,IF THE DOLLAR STARTS TO PLUNGE THE FED MAY STEP UP ITS DEFENSE OF THE CURRENCY
F06_444C0213_CAF,4.9600625,/et05_caf_simu/F06_444C0213_CAF.wav,A CHANGE IN THE FIRM'S OWNERSHIP ALSO SHOULD TURN ON A BRIGHT WARNING LIGHT
F05_444C0202_CAF,5.46825,/et05_caf_simu/F05_444C0202_CAF.wav,IT HAD FORECAST A NINETEEN EIGHTY SIX FOURTH QUARTER LOSS OF EIGHTEEN MILLION DOLLARS TO TWENTY TWO MILLION DOLLARS
M05_444C0207_CAF,5.7398125,/et05_caf_simu/M05_444C0207_CAF.wav,THE ISSUE IS RATED SINGLE A BY MOODY'S AND SINGLE A MINUS BY S. AND P.
M06_446C0203_CAF,2.6960625,/et05_caf_simu/M06_446C0203_CAF.wav,THE PERCENTAGE CHANGE IS SINCE YEAR END
F05_440C0209_CAF,3.0040625,/et05_caf_simu/F05_440C0209_CAF.wav,A P. B. G. C. SPOKESWOMAN DECLINED COMMENT
F06_441C020G_CAF,5.4240625,/et05_caf_simu/F06_441C020G_CAF.wav,ELDERS FINANCE AND ELDERS AGRIBUSINESS WILL REMAIN BASED IN AUSTRALIA
F06_444C020A_CAF,6.5760625,/et05_caf_simu/F06_444C020A_CAF.wav,IN ADDITION BANKS IN GENERAL ARE BEING PUSHED BY REGULATORS TO BOOST THEIR CAPITAL POSITIONS
M06_443C0213_CAF,3.3290625,/et05_caf_simu/M06_443C0213_CAF.wav,HONDA WAS DOWN TEN TO ONE THOUSAND NINE HUNDRED THIRTY
M06_444C020U_CAF,4.2599375,/et05_caf_simu/M06_444C020U_CAF.wav,M. C. I. PLANS TO BEGIN OFFERING THE SERVICE AT THE END OF THE MONTH
F05_446C020I_CAF,6.1403125,/et05_caf_simu/F05_446C020I_CAF.wav,HE SAID THE COMPANY'S GOAL IS TO HAVE FIFTEEN PERCENT TO TWENTY PERCENT REVENUE GROWTH TO ABOUT THREE POINT TWO BILLION DOLLARS FOR THE YEAR
M06_447C0207_CAF,7.7280625,/et05_caf_simu/M06_447C0207_CAF.wav,WASHINGTON NATIONAL PAID NINETEEN DOLLARS A SHARE FOR THE TWO POINT SIX MILLION UNITED PRESIDENTIAL SHARES IT DIDN'T ALREADY OWN
M06_444C020M_CAF,3.3040625,/et05_caf_simu/M06_444C020M_CAF.wav,WE HAD TO SUSTAIN SOME MODEST OPERATING LOSSES
M06_443C020H_CAF,5.528375,/et05_caf_simu/M06_443C020H_CAF.wav,THOSE IDENTIFIED AS BENEFICIAL OWNERS HOLD AT LEAST TEN PERCENT OF A COMPANY'S EQUITY SECURITIES
M05_444C020K_CAF,4.56425,/et05_caf_simu/M05_444C020K_CAF.wav,LATELY COMPUTER RETAILING HAS BEEN TOUGH ON EVERYBODY
M06_446C0211_CAF,5.3840625,/et05_caf_simu/M06_446C0211_CAF.wav,AFTER THE OFFERING REPUBLIC NEW YORK WILL HOLD ABOUT FORTY NINE PERCENT OF THE AFFILIATE
F05_444C020H_CAF,6.628125,/et05_caf_simu/F05_444C020H_CAF.wav,AMONG EXPORT LED ELECTRICAL AND COMPUTER MAKERS JAPAN VICTOR COMPANY FELL FIFTY TO TWO THOUSAND THREE HUNDRED TWENTY
F05_446C020T_CAF,9.0521875,/et05_caf_simu/F05_446C020T_CAF.wav,ACCORDING TO THE AVERAGE ESTIMATE OF SEVEN ECONOMISTS SURVEYED BY DOW JONES CAPITAL MARKETS REPORT NEW ORDERS FOR U. S. DURABLE GOODS ROSE TWO POINT FOUR PERCENT LAST MONTH
F06_447C0208_CAF,11.2644375,/et05_caf_simu/F06_447C0208_CAF.wav,BEFORE THE TRANSACTION WASHINGTON NATIONAL CONTROLLED ONE POINT EIGHT MILLION UNITED PRESIDENTIAL SHARES OR FORTY ONE POINT FIVE PERCENT OF THE COMPANY
M05_443C020S_CAF,3.9559375,/et05_caf_simu/M05_443C020S_CAF.wav,A PRINT MEDIA CAMPAIGN WILL BEGIN THE FOLLOWING DAY
M05_447C0203_CAF,3.2356875,/et05_caf_simu/M05_447C0203_CAF.wav,AND I'M SURE YOU HAVE YOUR OWN LIST
M05_447C020B_CAF,6.0198125,/et05_caf_simu/M05_447C020B_CAF.wav,THESE ARE UNEDUCATED PEOPLE HE SAYS IN ENGLISH SO THE PATIENTS WON'T UNDERSTAND
M06_446C0202_CAF,6.54,/et05_caf_simu/M06_446C0202_CAF.wav,TO MAKE THEM DIRECTLY COMPARABLE EACH INDEX IS BASED ON THE CLOSE OF NINETEEN SIXTY NINE EQUALING ONE HUNDRED
F05_446C020N_CAF,4.4120625,/et05_caf_simu/F05_446C020N_CAF.wav,THE REAL ESTATE INVESTMENT TRUST SAID IT WAS STILL HOPING TO REACH A NEW CREDIT ARRANGEMENT
F06_445C0203_CAF,5.4880625,/et05_caf_simu/F06_445C0203_CAF.wav,A SPOKESMAN SAID THE COMPANY HAS ABOUT SIXTY MILLION SHARES OUTSTANDING
M05_441C020D_CAF,5.81175,/et05_caf_simu/M05_441C020D_CAF.wav,IT RECEIVED NO PROPOSALS THAT WERE IN THE BEST INTEREST OF THE SHAREHOLDERS THE COMPANY SAID
M05_447C020A_CAF,3.9479375,/et05_caf_simu/M05_447C020A_CAF.wav,UNITED PRESIDENTIAL IS A LIFE INSURANCE COMPANY
F06_441C0203_CAF,4.2480625,/et05_caf_simu/F06_441C0203_CAF.wav,FIRST COMMODITY OFFICIALS COULDN'T BE REACHED FOR COMMENT
F06_442C020S_CAF,11.9443125,/et05_caf_simu/F06_442C020S_CAF.wav,AT THE CLOSE THE FINANCIAL TIMES THIRTY SHARE INDEX WAS THREE POINT NINE POINTS LOWER AT ONE THOUSAND FOUR HUNDRED EIGHTEEN POINT SIX
F06_446C0209_CAF,7.6561875,/et05_caf_simu/F06_446C0209_CAF.wav,MR. ICAHN AND AN INVESTOR GROUP HE HEADS HOLD SEVENTY TWO POINT SEVEN PERCENT OF T. W. A.'S SHARES
M06_445C020T_CAF,6.5119375,/et05_caf_simu/M06_445C020T_CAF.wav,NO ONE IS MAKING VERY MUCH MONEY ON IT ACKNOWLEDGES BRIAN J. KELLY CHAIRMAN OF BELL ATLANTIC'S INVESTMENT DEVELOPMENT UNIT
M06_441C020O_CAF,5.552125,/et05_caf_simu/M06_441C020O_CAF.wav,ABOUT ALL BUSINESSMEN CAN COUNT ON IS THAT POLICY WILL BE PRETTY VOLATILE
F06_442C0202_CAF,6.416125,/et05_caf_simu/F06_442C0202_CAF.wav,ACCEPTED BIDS RANGED FROM SIX POINT TWO PERCENT TO SIX POINT TWO TWO FIVE PERCENT
F05_445C020I_CAF,3.2201875,/et05_caf_simu/F05_445C020I_CAF.wav,THE AIRLINE IMPOSED THE CONTRACT WITHOUT UNION BARGAINING
F06_446C020O_CAF,4.7199375,/et05_caf_simu/F06_446C020O_CAF.wav,WE'RE NOT READY TO SAY WE'RE IN TECHNICAL DEFAULT A SPOKESMAN SAID
F06_447C0214_CAF,2.0078125,/et05_caf_simu/F06_447C0214_CAF.wav,WE DIDN'T LIKE THAT
M05_445C020G_CAF,10.2996875,/et05_caf_simu/M05_445C020G_CAF.wav,THE ORDER ISSUED LATE WEDNESDAY BY JUDGE DIANA MURPHY STEMS FROM A SUIT FILED IN FEDERAL COURT LAST MONTH BY THE UNION REPRESENTING THE MACHINISTS
M05_441C0208_CAF,9.3080625,/et05_caf_simu/M05_441C0208_CAF.wav,THE OVERALL GAIN THE FIFTH IN THE PAST SEVEN MONTHS FOLLOWED A REVISED FOUR POINT ONE PERCENT INCREASE IN FEBRUARY
M05_442C0206_CAF,6.09175,/et05_caf_simu/M05_442C0206_CAF.wav,THE TORONTO BASED COMPANY PROVIDES MORTGAGE GUARANTEES TO THE CANADIAN REAL ESTATE INDUSTRY
M06_442C020L_CAF,7.5040625,/et05_caf_simu/M06_442C020L_CAF.wav,THE MAY SLUMP REPORTED JUNE TWENTY SECOND CAME AS A BIG SURPRISE TO MOST ANALYSTS AND HELPED TRIGGER A POWERFUL BOND RALLY THAT DAY
F06_445C0215_CAF,6.000125,/et05_caf_simu/F06_445C0215_CAF.wav,AND AFTER A TEMPORARY DOWNTURN IN THE NEXT COUPLE OF YEARS THE NUMBERS PROBABLY WILL GO BACK UP
F05_447C0211_CAF,2.79625,/et05_caf_simu/F05_447C0211_CAF.wav,LATELY COMPUTER RETAILING HAS BEEN TOUGH ON EVERYBODY
F05_443C0203_CAF,6.7643125,/et05_caf_simu/F05_443C0203_CAF.wav,USING A MEASURE THAT COUNTS THE MILITARY AMONG THE EMPLOYED THE RATE WAS UNCHANGED AT SIX POINT SIX PERCENT LAST MONTH
F06_445C0201_CAF,8.24825,/et05_caf_simu/F06_445C0201_CAF.wav,OWENS ILLINOIS SAID ITS SHARE PURCHASES WOULD BE FINANCED BY EXISTING CREDIT LINES AND NEW ONES TO BE ARRANGED
M06_440C020X_CAF,5.9521875,/et05_caf_simu/M06_440C020X_CAF.wav,MANY ANALYSTS CITE AN EXPECTED INCREASE IN AIRCRAFT ORDERS AS A BIG REASON FOR THE ANTICIPATED JUNE INCREASE
M05_445C020W_CAF,10.0996875,/et05_caf_simu/M05_445C020W_CAF.wav,THE JURY AWARDED MR. SCHARENBERG ONE HUNDRED FIVE MILLION DOLLARS A FIGURE BASED ON TEN YEARS OF PROFITS HAD HIS PROJECT BEEN COMPLETED
M06_440C0213_CAF,4.672,/et05_caf_simu/M06_440C0213_CAF.wav,HE SAID SUCH PRODUCT WOULD BE MARKETED BY OTHER COMPANIES WITH EXPERIENCE IN THAT BUSINESS
M06_447C020L_CAF,5.496625,/et05_caf_simu/M06_447C020L_CAF.wav,EMPLOYMENT LOOKED STRONG INFLATION WAS LOW AND CONSUMER SPENDING AND INVESTMENT WERE HOLDING UP REASONABLY WELL
M05_441C0206_CAF,3.8518125,/et05_caf_simu/M05_441C0206_CAF.wav,IN EUROPE AN AMERICAN CAN AT LEAST READ STREET SIGNS
M05_440C020S_CAF,4.6361875,/et05_caf_simu/M05_440C020S_CAF.wav,WHAT WE DON'T KNOW IS HOW MUCH IS PRICE AND HOW MUCH IS VOLUME
F05_446C020V_CAF,6.996125,/et05_caf_simu/F05_446C020V_CAF.wav,THE MAY SLUMP REPORTED JUNE TWENTY SECOND CAME AS A BIG SURPRISE TO MOST ANALYSTS AND HELPED TRIGGER A POWERFUL BOND RALLY THAT DAY
F05_442C020X_CAF,3.384,/et05_caf_simu/F05_442C020X_CAF.wav,ABOUT THREE POINT FIVE BILLION DOLLARS OF SECURITIES ARE AFFECTED
M06_444C020T_CAF,4.984,/et05_caf_simu/M06_444C020T_CAF.wav,THE MARKET'S STRENGTH MAY SHOW THAT DEMAND ISN'T ALL A CREATION OF INCENTIVES
M05_447C020V_CAF,7.98775,/et05_caf_simu/M05_447C020V_CAF.wav,MANHATTAN INDUSTRIES CONTINUED TO TRADE ABOVE THE OFFER PRICE YESTERDAY INDICATING THE MARKET EXPECTS A HIGHER BID
F06_444C020Q_CAF,9.8560625,/et05_caf_simu/F06_444C020Q_CAF.wav,THE OFFERS INDICATE A TOTAL PRICE FOR THE COMPANY EXCEEDING EIGHT HUNDRED MILLION DOLLARS BASED ON SEVENTEEN POINT TWO MILLION SHARES OUTSTANDING
F05_443C0207_CAF,2.732125,/et05_caf_simu/F05_443C0207_CAF.wav,IT ISN'T CLEAR YET WHETHER THE CAMPAIGN WORKS
M05_444C0209_CAF,10.267625,/et05_caf_simu/M05_444C0209_CAF.wav,AS ONE OF THE MOST ACQUISITION HUNGRY OF MAJOR BANKS CITICORP IS OFTEN REQUIRED BY REGULATORS TO RAISE ADDITIONAL CAPITAL AS A CONDITION OF MAKING ACQUISITIONS
F06_445C020D_CAF,6.1600625,/et05_caf_simu/F06_445C020D_CAF.wav,GRAND AUTO SLID THREE TO FIFTEEN AND ONE EIGHTH ON THE AMERICAN STOCK EXCHANGE
F06_447C020J_CAF,8.248625,/et05_caf_simu/F06_447C020J_CAF.wav,IN THE EFFORTS TO RESTORE MARKET CONFIDENCE ADMINISTRATION OFFICIALS HAVE EMPHASIZED THAT THE ECONOMY'S FUNDAMENTALS REMAIN SOUND
M05_447C0215_CAF,11.3554375,/et05_caf_simu/M05_447C0215_CAF.wav,SHEARSON LEHMAN HUTTON INCORPORATED'S INDEX OF LONG TERM TREASURY BONDS STAYED IN A VERY SMALL RANGE YESTERDAY FINISHING VERY CLOSE TO WEDNESDAY'S CLOSING LEVEL
M06_441C020A_CAF,5.86425,/et05_caf_simu/M06_441C020A_CAF.wav,IF DEFENSE IS EXCLUDED MARCH ORDERS ROSE ONE PERCENT AFTER A THREE PERCENT INCREASE IN FEBRUARY
F05_445C020R_CAF,4.676,/et05_caf_simu/F05_445C020R_CAF.wav,IF THE FED PUSHES THE DOLLAR HIGHER IT MAY CURB THE DEMAND FOR U. S. EXPORTS
F05_446C0206_CAF,2.588,/et05_caf_simu/F05_446C0206_CAF.wav,WE'RE NOT PREPARED TO BE ADVOCATES FOR THE K. G. B.
F06_445C0202_CAF,6.864125,/et05_caf_simu/F06_445C0202_CAF.wav,IF ALL TWENTY MILLION SHARES WERE PURCHASED THE COMPANY'S EQUITY WOULD BE REDUCED BY ABOUT ONE THIRD
F06_446C0201_CAF,9.888,/et05_caf_simu/F06_446C0201_CAF.wav,HERE ARE PRICE TRENDS ON THE WORLD'S MAJOR STOCK MARKETS AS CALCULATED BY MORGAN STANLEY CAPITAL INTERNATIONAL PERSPECTIVE GENEVA
M06_445C020F_CAF,4.6320625,/et05_caf_simu/M06_445C020F_CAF.wav,IT RECEIVED NO PROPOSALS THAT WERE IN THE BEST INTEREST OF THE SHAREHOLDERS THE COMPANY SAID
F06_440C0211_CAF,4.6400625,/et05_caf_simu/F06_440C0211_CAF.wav,ABOUT THREE POINT FIVE BILLION DOLLARS OF SECURITIES ARE AFFECTED
F05_440C020G_CAF,3.3080625,/et05_caf_simu/F05_440C020G_CAF.wav,ANALYSTS TOO GENERALLY PLAYED DOWN THE EFFECT ON BANKS
M06_443C020R_CAF,6.216125,/et05_caf_simu/M06_443C020R_CAF.wav,AS PART OF THE MARKETING PLAN THE COMPANY WILL BEGIN AIRING TELEVISION COMMERCIALS DURING PRIME TIME ON ELECTION NIGHT NEXT TUESDAY
M05_447C020R_CAF,4.0679375,/et05_caf_simu/M05_447C020R_CAF.wav,THE INVESTOR NOW OWNS SEVENTY THREE PERCENT OF THE COMPANY
F06_446C020A_CAF,8.0400625,/et05_caf_simu/F06_446C020A_CAF.wav,SEPARATELY NEW YORK STATE SOLD ABOUT SEVENTY SEVEN POINT ONE MILLION DOLLARS OF CERTIFICATES OF PARTICIPATION
F05_440C020O_CAF,5.688125,/et05_caf_simu/F05_440C020O_CAF.wav,UNABLE TO AGREE ON FRIDAY THE BOARD MUST MEET AGAIN AT LEAST BY PHONE TO REGISTER ITS CHOICE
F05_445C0208_CAF,2.94825,/et05_caf_simu/F05_445C0208_CAF.wav,THEIR BUSINESS ISN'T JUST A JOB BUT THEIR INVESTMENT
F05_447C0201_CAF,5.3961875,/et05_caf_simu/F05_447C0201_CAF.wav,I DON'T MEAN THERE COULDN'T BE SOME IMPROVEMENTS IN THE REVENUE ACT OF NINETEEN EIGHTY SIX WHICH TOOK EFFECT THIS MONTH
F05_443C020J_CAF,5.755625,/et05_caf_simu/F05_443C020J_CAF.wav,COMPANIES ARE LISTED WHERE TRANSACTIONS GENERALLY AGGREGATE TEN THOUSAND SHARES OR ONE HUNDRED THOUSAND DOLLARS
M05_441C020P_CAF,5.3080625,/et05_caf_simu/M05_441C020P_CAF.wav,IF THE DOLLAR STARTS TO PLUNGE THE FED MAY STEP UP ITS DEFENSE OF THE CURRENCY
F06_446C0208_CAF,3.76,/et05_caf_simu/F06_446C0208_CAF.wav,BUT THE INVESTIGATION COULD MAKE SOME LENDERS WARY
F05_440C020T_CAF,2.5561875,/et05_caf_simu/F05_440C020T_CAF.wav,RATES FELL ON SHORT TERM TREASURY BILLS
F05_443C0206_CAF,4.9163125,/et05_caf_simu/F05_443C0206_CAF.wav,THE TORONTO BASED COMPANY PROVIDES MORTGAGE GUARANTEES TO THE CANADIAN REAL ESTATE INDUSTRY
M05_441C020X_CAF,7.2278125,/et05_caf_simu/M05_441C020X_CAF.wav,THE BOND FUNDS IN PARTICULAR PROVIDE ROBUST YIELDS FOR INVESTORS AND HEFTY FEES FOR UNDERWRITERS
M05_444C0212_CAF,10.955625,/et05_caf_simu/M05_444C0212_CAF.wav,REALIZED CAPITAL GAINS INCREASED FORTY TWO PERCENT TO NINE HUNDRED NINE MILLION DOLLARS FROM SIX HUNDRED FORTY POINT NINE MILLION DOLLARS
M06_443C0211_CAF,3.7519375,/et05_caf_simu/M06_443C0211_CAF.wav,ESTIMATED AND ACTUAL RESULTS INVOLVING LOSSES ARE OMITTED
F06_441C020U_CAF,1.79175,/et05_caf_simu/F06_441C020U_CAF.wav,OUR GUESS IS NO
F05_440C020P_CAF,6.723875,/et05_caf_simu/F05_440C020P_CAF.wav,COMMERCE DEPARTMENT OFFICIALS NOTED HOWEVER THAT AUTO IMPORTS USUALLY RISE IN OCTOBER AS DEALERS FILL THEIR INVENTORIES WITH NEW MODELS
M05_445C0209_CAF,5.939625,/et05_caf_simu/M05_445C0209_CAF.wav,AND BOTH MORTGAGED THEIR HOMES TO SECURE THE LOANS THEY NEEDED TO START THE BUSINESS
F06_443C0204_CAF,10.0643125,/et05_caf_simu/F06_443C0204_CAF.wav,M. I. C. C. INVESTMENTS HAS THREE SERIES OF PUBLICLY TRADED PREFERRED SHARES AND TEN SERIES OF PRIVATELY HELD PREFERRED STOCK
F06_445C0214_CAF,7.096125,/et05_caf_simu/F06_445C0214_CAF.wav,THE NUMBERS LOOKED AMAZINGLY GOOD INDUSTRIAL GROWTH RATES ABOVE TEN PERCENT PER YEAR YEAR AFTER YEAR
F05_442C020Y_CAF,6.488,/et05_caf_simu/F05_442C020Y_CAF.wav,HE ALSO SAID THAT THE COMPANY FOR THE FIRST TIME WAS DEVELOPING DRUGS SPECIFICALLY FOR THE OVER THE COUNTER CONSUMER HEALTH CARE MARKET
F06_444C020J_CAF,7.9920625,/et05_caf_simu/F06_444C020J_CAF.wav,SONY WHICH LOST POINTS IN PREVIOUS SESSIONS THIS WEEK REBOUNDED EIGHTY TO FIVE THOUSAND ONE HUNDRED THIRTY
F06_440C020Q_CAF,5.8401875,/et05_caf_simu/F06_440C020Q_CAF.wav,THE RISE IN AUTO IMPORTS ALSO REFLECTS HIGHER PRICES FOR IMPORTED CARS
F05_440C020I_CAF,6.220625,/et05_caf_simu/F05_440C020I_CAF.wav,THERE SHOULDN'T BE ANY RISK TO THE BANKS IN THIS SORT OF STUFF SAID LAWRENCE COHN A BANKING ANALYST AT MERRILL LYNCH AND COMPANY
F06_446C020Z_CAF,5.712125,/et05_caf_simu/F06_446C020Z_CAF.wav,REPUBLIC NEW YORK ROSE ONE AND ONE QUARTER TO FORTY FIVE AND SEVEN EIGHTHS
M06_444C020W_CAF,3.4880625,/et05_caf_simu/M06_444C020W_CAF.wav,A PRINT MEDIA CAMPAIGN WILL BEGIN THE FOLLOWING DAY
F05_444C0214_CAF,5.8120625,/et05_caf_simu/F05_444C0214_CAF.wav,MONEY MANAGERS WHO SELL THEIR FIRMS BUT THEN CONTINUE WORKING FOR THEM MAY BE LESS DEDICATED UNDER NEW OWNERSHIP THEY SAY
M05_443C020B_CAF,2.748,/et05_caf_simu/M05_443C020B_CAF.wav,THAT WAS CERTAINLY TRUE LAST WEEK
F06_447C0217_CAF,9.5441875,/et05_caf_simu/F06_447C0217_CAF.wav,THE LOW WAS ONE THOUSAND TWO HUNDRED SEVENTY POINT ONE NINE AND THE HIGH WAS ONE THOUSAND TWO HUNDRED SEVENTY THREE POINT EIGHT EIGHT
F05_440C020E_CAF,7.3565625,/et05_caf_simu/F05_440C020E_CAF.wav,THE AVERAGE RATE ON NEW THIRTEEN WEEK TREASURY BILLS INCREASED TO SIX POINT ONE TWO PERCENT FROM FIVE POINT NINE SEVEN PERCENT AT THE PREVIOUS AUCTION LAST WEEK
F06_442C0212_CAF,5.1680625,/et05_caf_simu/F06_442C0212_CAF.wav,FOREIGNERS ARE BACK AND NEGOTIATING WITH THE CHINESE WILL BE AS TOUGH AS EVER
M05_444C020R_CAF,9.8996875,/et05_caf_simu/M05_444C020R_CAF.wav,THE MID JULY INCREASE CAME EVEN THOUGH AUTO MAKERS ARE OFFERING INCENTIVES ON FEWER CARS THIS YEAR THAN THEY DID LAST YEAR OR EARLIER THIS YEAR
F06_445C020V_CAF,2.136,/et05_caf_simu/F06_445C020V_CAF.wav,WE DIDN'T LIKE THAT
F05_444C020D_CAF,3.268125,/et05_caf_simu/F05_444C020D_CAF.wav,IT ADDS TO THE SUPPORT FOR THE TRADE BILL GETTING THROUGH HE SAID
F05_446C020W_CAF,4.0124375,/et05_caf_simu/F05_446C020W_CAF.wav,DURABLE GOODS REPORTS FREQUENTLY ARE HIGHLY VOLATILE FROM MONTH TO MONTH
M06_444C0205_CAF,8.032375,/et05_caf_simu/M06_444C0205_CAF.wav,THE ISSUE WAS PRICED AFTER AUCTION TO YIELD FROM THREE POINT FIVE PERCENT IN NINETEEN EIGHTY SEVEN TO FIVE POINT FIVE PERCENT IN NINETEEN NINETY SEVEN
M06_442C0214_CAF,4.416125,/et05_caf_simu/M06_442C0214_CAF.wav,A CHANGE IN THE FIRM'S OWNERSHIP ALSO SHOULD TURN ON A BRIGHT WARNING LIGHT
M05_441C0205_CAF,2.97975,/et05_caf_simu/M05_441C0205_CAF.wav,THE LANGUAGE IS A BIG PROBLEM
M05_441C020C_CAF,9.9719375,/et05_caf_simu/M05_441C020C_CAF.wav,THE COMPANY WHICH RUNS RETAIL AUTOMOTIVE STORES TOLD SHEARSON LEHMAN BROTHERS ITS FINANCIAL ADVISER TO TERMINATE DISCUSSIONS TO SELL THE FIRM
M05_441C020W_CAF,7.20375,/et05_caf_simu/M05_441C020W_CAF.wav,ALTHOUGH CLOSED END FUNDS HAVE BEEN AROUND SINCE AT LEAST THE NINETEEN TWENTIES THEY HAVE BOOMED IN POPULARITY THIS YEAR
F05_441C0207_CAF,2.652,/et05_caf_simu/F05_441C0207_CAF.wav,IN JAPAN IT'S ALL GREEK SO TO SPEAK
F06_441C0215_CAF,5.5119375,/et05_caf_simu/F06_441C0215_CAF.wav,HE SAID SUCH PRODUCTS WOULD BE MARKETED BY OTHER COMPANIES WITH EXPERIENCE IN THAT BUSINESS
F06_440C020A_CAF,8.08025,/et05_caf_simu/F06_440C020A_CAF.wav,DESPITE THE JULY DECLINE DURABLE GOODS ORDERS REMAINED SEVEN POINT SEVEN PERCENT ABOVE THE YEAR EARLIER LEVEL
F05_443C020G_CAF,8.004375,/et05_caf_simu/F05_443C020G_CAF.wav,THE FOLLOWING OFFICERS DIRECTORS AND LARGE STOCKHOLDERS OF COMPANIES REPORTED CHANGES IN HOLDINGS UNDER THE SECURITIES EXCHANGE ACT OF NINETEEN THIRTY FOUR
F05_442C020N_CAF,3.3801875,/et05_caf_simu/F05_442C020N_CAF.wav,WE'RE GOING TO BE BIDDERS SAID A TOP OFFICIAL OF A MAJOR OIL COMPANY
F05_444C020Y_CAF,6.132125,/et05_caf_simu/F05_444C020Y_CAF.wav,VOLUME WAS EIGHTEEN MILLION ONE HUNDRED NINETY THOUSAND SHARES COMPARED WITH TEN MILLION FIVE HUNDRED FIFTY THOUSAND MONDAY
M05_442C020D_CAF,9.371625,/et05_caf_simu/M05_442C020D_CAF.wav,SONY CORPORATION FOR EXAMPLE CLOSED AT FOUR THOUSAND NINE HUNDRED FIFTY YEN THIRTY FOUR DOLLARS AND FIFTY CENTS A SHARE YESTERDAY
M05_441C0211_CAF,10.3074375,/et05_caf_simu/M05_441C0211_CAF.wav,AT THE CLOSE THE FINANCIAL TIMES THIRTY SHARE INDEX WAS THREE POINT NINE POINTS LOWER AT ONE THOUSAND FOUR HUNDRED EIGHTEEN POINT SIX
F05_446C020B_CAF,7.66025,/et05_caf_simu/F05_446C020B_CAF.wav,THE ISSUE WAS PRICED AFTER AUCTION TO YIELD FROM THREE POINT FIVE PERCENT IN NINETEEN EIGHTY SEVEN TO FIVE POINT FIVE PERCENT IN NINETEEN NINETY SEVEN
M05_441C020L_CAF,6.987625,/et05_caf_simu/M05_441C020L_CAF.wav,THOSE IDENTIFIED AS BENEFICIAL OWNERS HOLD AT LEAST TEN PERCENT OF A COMPANY'S EQUITY SECURITIES
F06_442C020E_CAF,9.0241875,/et05_caf_simu/F06_442C020E_CAF.wav,UNDER TOKYO TRADING RULES THE MAXIMUM ONE DAY DROP FOR SONY IS FIVE HUNDRED YEN ABOUT THREE DOLLARS AND FIFTY CENTS
F05_444C020G_CAF,6.260125,/et05_caf_simu/F05_444C020G_CAF.wav,STATE OFFICIALS HOWEVER SAY THE AIRLINES HAVE INDICATED THEY WILL COMPLY WITH MOST OF THE STANDARDS AS LONG AS COMPETITORS DO
