ID,duration,wav,wrd
F06_442C0208_PED,9.7601875,/et05_ped_real/F06_442C0208_PED.wav,THE COMPANY WHICH RUNS RETAIL AUTOMOTIVE STORES TOLD SHEARSON LEHMAN BROTHERS ITS FINANCIAL ADVISER TO TERMINATE DISCUSSIONS TO SELL THE FIRM
F05_445C0211_PED,2.687875,/et05_ped_real/F05_445C0211_PED.wav,A PRINT MEDIA CAMPAIGN WILL BEGIN THE FOLLOWING DAY
F06_444C020S_PED,8.00025,/et05_ped_real/F06_444C020S_PED.wav,INCENTIVES CAN MOVE AROUND SALES BUT NOT CREATE THEM SAID CHARLES BRADY AN OPPENHEIMER AND COMPANY AUTO STOCK ANALYST
F06_441C020W_PED,6.85625,/et05_ped_real/F06_441C020W_PED.wav,ALTHOUGH CLOSED END FUNDS HAVE BEEN AROUND SINCE AT LEAST THE NINETEEN TWENTIES THEY HAVE BOOMED IN POPULARITY THIS YEAR
F05_446C020V_PED,7.1039375,/et05_ped_real/F05_446C020V_PED.wav,THE MAY SLUMP REPORTED JUNE TWENTY SECOND CAME AS A BIG SURPRISE TO MOST ANALYSTS AND HELPED TRIGGER A POWERFUL BOND RALLY THAT DAY
F05_443C020M_PED,5.1516875,/et05_ped_real/F05_443C020M_PED.wav,THE NEW COMPANY ASHLAND COAL INCORPORATED IS LISTED ON THE NEW YORK STOCK EXCHANGE
